title,description,url,img_url,publication_date,publisher
Fantastik Dörtlü filminin kadrosuna bir yıldız isim daha katıldı: Gümüş Sörfçü belli oldu!,Fantastik Dörtlü filminin kadrosuna yeni isimler katılmaya devam ediyor. Dahil olan yeni isim Gümüş Sörfçü karakterini canlandıracak.,https://www.cumhuriyet.com.tr/kultur-sanat/fantastik-dortlu-filminin-kadrosuna-bir-yildiz-isim-daha-katildi-gumus-2193546?utm_medium=KategoriSayfasi&utm_source=KategoriSayfasi,https://www.cumhuriyet.com.tr/thumbs/1520x900/Archive/2024/4/4/2193546/kapak_214325.jpeg,2024-04-04 21:49:04+03:00,cumhuriyet
Lezzetinin sırrı o noktada saklı: Enfes Tarhana Çorbası nasıl yapılır? Püf noktalarıyla Tarhana Çorbası tarifi...,"Türk mutfağının bu eşsiz lezzetini evinizde denemek ve sevdiklerinize sunmak istiyorsanız, işte size pratik bir tarif. Hem yapımı kolay hem de tadıyla damakları şenlendiren tarhana çorbası, sofralarınıza bereket ve lezzet katacak.",https://www.cumhuriyet.com.tr/gurme/lezzetinin-sirri-o-noktada-sakli-enfes-tarhana-corbasi-nasil-yapilir-2193543?utm_medium=KategoriSayfasi&utm_source=KategoriSayfasi,https://www.cumhuriyet.com.tr/thumbs/1520x900/Archive/2024/4/4/2193543/kapak_212809.jpg,2024-04-04 21:28:14+03:00,cumhuriyet
Özel Kimlik filminin konusu ne? Özel Kimlik filminin oyuncuları kim?,"Özel Kimlik (Special ID) filmi televizyon ekranlarında izleyicisiyle buluşmaya hazırlanıyor. Özel Kimlik filminin konusu ve oyuncularının kimler olduğu merak ediliyor. Peki, Özel Kimlik filminin konusu ne? Özel Kimlik filminin oyuncuları kim? İşte ayrıntılar...",https://www.cumhuriyet.com.tr/tv-rehberi/ozel-kimlik-filminin-konusu-ne-ozel-kimlik-filminin-oyunculari-kim-2193539?utm_medium=Kategori%20Sayfasi&utm_source=Cumhuriyet&utm_campaign=Kategori%20Sayfasi,https://www.cumhuriyet.com.tr/thumbs/1520x900/Archive/2024/4/4/2193539/kapak_210738.jpg,2024-04-04 21:07:42+03:00,cumhuriyet
Antalya DOB'un 25. yıl gala gecesi: Opera ve bale şöleni!,"Kuruluşunun 25. yılını kutlayan Antalya Devlet Opera ve Balesi, sanatseverler ile buluşacak.",https://www.cumhuriyet.com.tr/kultur-sanat/antalya-dobun-25-yil-gala-gecesi-opera-ve-bale-soleni-2193535?utm_medium=KategoriSayfasi&utm_source=KategoriSayfasi,https://www.cumhuriyet.com.tr/thumbs/1520x900/Archive/2024/4/4/2193535/kapak_202054.jpg,2024-04-04 20:52:05+03:00,cumhuriyet
İBB Şehir Tiyatroları 'Savaş ve Barış'ı Madach Uluslararası Tiyatro Buluşması'nda sahneleyecek!,"İstanbul Büyükşehir Belediyesi Şehir Tiyatroları, Savaş ve Barış oyununu Budapeşte'de sahneleyecek.",https://www.cumhuriyet.com.tr/kultur-sanat/ibb-sehir-tiyatrolari-savas-ve-barisi-madach-uluslararasi-tiyatro-2193531?utm_medium=KategoriSayfasi&utm_source=KategoriSayfasi,https://www.cumhuriyet.com.tr/thumbs/1520x900/Archive/2024/4/4/2193531/kapak_195121.jpg,2024-04-04 20:15:46+03:00,cumhuriyet
Müzik ziyafetine geri sayım başladı: Klasik müziğin yıldızları İstanbul Müzik Festivali'nde sahne alacak!,Bu yıl 52'ncisi düzenlenecek olan İstanbul Müzik Festivali'ne geri sayım başladı.,https://www.cumhuriyet.com.tr/kultur-sanat/muzik-ziyafetine-geri-sayim-basladi-klasik-muzigin-yildizlari-istanbul-2193530?utm_medium=Kategori%20Sayfasi&utm_source=Cumhuriyet&utm_campaign=Kategori%20Sayfasi,https://www.cumhuriyet.com.tr/thumbs/1520x900/Archive/2024/4/4/2193530/kapak_193631.jpg,2024-04-04 19:36:35+03:00,cumhuriyet
AÖL (Açık Öğretim Lisesi) 2.dönem sınav sonuçları açıklandı mı? AÖL (Açık Öğretim Lisesi) 2.dönem sınav sonuçları ne zaman açıklanacak?,"Açık Öğretim Lisesi (AÖL) 2. dönem sınavları 16-17 Mart tarihleri arasında tamamlandı. Sınavlara katılım gösteren öğrenciler, sınavların üzerinden günler geçmesi nedeniyle sonuçlara yönelik araştırmalarını hızlandırdı. Peki, AÖL (Açık Öğretim Lisesi) 2.dönem sınav sonuçları açıklandı mı? AÖL (Açık Öğretim Lisesi) 2.dönem sınav sonuçları ne zaman açıklanacak?",https://www.cumhuriyet.com.tr/egitim/aol-acik-ogretim-lisesi-2donem-sinav-sonuclari-aciklandi-mi-aol-2193464?utm_medium=Kategori%20Sayfasi&utm_source=Cumhuriyet&utm_campaign=Kategori%20Sayfasi,https://www.cumhuriyet.com.tr/thumbs/1520x900/Archive/2024/4/4/2193464/kapak_160047.jpg,2024-04-04 16:00:54+03:00,cumhuriyet
Pandispanya nasıl yapılır? Pandispanya malzemeleri nelerdir? - Son Dakika Gurme Haberleri,"Pandispanya, tatlılarınıza hafiflik ve kabarık bir dokunuş katmak için mükemmel bir seçenektir. Ev yapımı pandispanya, birçok farklı tatlı ve pastanın temelini oluşturabilir ve kendinizi bir pastane ustası gibi hissetmenizi sağlayabilir.",https://www.cumhuriyet.com.tr/gurme/pandispanya-nasil-yapilir-pandispanya-malzemeleri-nelerdir-2193457?utm_medium=Kategori%20Sayfasi&utm_source=Cumhuriyet&utm_campaign=Kategori%20Sayfasi,https://www.cumhuriyet.com.tr/thumbs/1520x900/Archive/2024/4/4/2193457/kapak_154435.jpg,2024-04-04 15:44:49+03:00,cumhuriyet
Togg'dan önemli açıklama: Bayramda yola çıkacaklar dikkat!,"Türkiye’nin farklı şehirlerinde kullanıcıları T10X ile buluşturan Togg, elektrikli araçla bayram seyahatine çıkacak kullanıcılara bazı önerilerde bulundu.",https://www.cumhuriyet.com.tr/otomotiv/toggdan-onemli-aciklama-bayramda-yola-cikacaklar-dikkat-2193418?utm_medium=KategoriSayfasi&utm_source=KategoriSayfasi,https://www.cumhuriyet.com.tr/thumbs/1520x900/Archive/2024/4/4/2193418/kapak_134810.jpg,2024-04-04 13:48:17+03:00,cumhuriyet
Ekonomik ve lezzetli: Bisküvi pastası tarifi,"Tatlı yapmak keyifli olsa da bazen pahalı malzemelerle dolu tarifler bütçeyi zorlayabilir. İşte bu noktada ev yapımı bisküvi pastası devreye giriyor. Ekonomik ve kolay hazırlanan bu tarif, herkesin evinde bulunan malzemelerle yapılabilir ve son derece lezzetlidir. İşte, ekonomik ve lezzetli Bisküvi pastası tarifi...",https://www.cumhuriyet.com.tr/gurme/ekonomik-ve-lezzetli-biskuvi-pastasi-tarifi-2193402?utm_medium=Kategori%20Sayfasi&utm_source=Cumhuriyet&utm_campaign=Kategori%20Sayfasi,https://www.cumhuriyet.com.tr/thumbs/1520x900/Archive/2024/4/4/2193402/kapak_130939.jpg,2024-04-04 13:09:43+03:00,cumhuriyet
Yedi saatten az uyuyanlara acil sağlık uyarısı,"Amerikan Kardiyoloji Koleji'nin yıllık bilimsel oturumunda paylaşılan ön bulgulara göre, yüksek tansiyona yakalanma riskinin uyku düzeniyle bağlantılı olduğu ortaya çıktı.",https://www.cumhuriyet.com.tr/yasam/yedi-saatten-az-uyuyanlara-acil-saglik-uyarisi-2193399?utm_medium=Kategori%20Sayfasi&utm_source=Cumhuriyet&utm_campaign=Kategori%20Sayfasi,https://www.cumhuriyet.com.tr/thumbs/1520x900/Archive/2024/4/4/2193399/kapak_130440.jpg,2024-04-04 13:04:51+03:00,cumhuriyet
Yapımcı Türker İnanoğlu için tören düzenlendi,"Türk sinemasında Bay Sinema olarak anılan, yönetmen, film ve televizyon yapımcısı Türker İnanoğlu için TİM Show Center'da tören düzenlendi.",https://www.cumhuriyet.com.tr/kultur-sanat/yapimci-turker-inanoglu-icin-toren-duzenlendi-2193381?utm_medium=Kategori%20Sayfasi&utm_source=Cumhuriyet&utm_campaign=Kategori%20Sayfasi,https://www.cumhuriyet.com.tr/thumbs/1520x900/Archive/2024/4/4/2193381/kapak_124811.jpg,2024-04-04 12:48:14+03:00,cumhuriyet
"Toyota, Land Cruiser serisinin yeni nesil modeli Prado'yu Türkiye'de satışa sunacak","Toyota, yeni Land Cruiser Prado modelini, yılın üçüncü çeyreğinin sonunda piyasaya sürecek.",https://www.cumhuriyet.com.tr/otomotiv/toyota-land-cruiser-serisinin-yeni-nesil-modeli-pradoyu-turkiyede-2193380?utm_medium=Kategori%20Sayfasi&utm_source=Cumhuriyet&utm_campaign=Kategori%20Sayfasi,https://www.cumhuriyet.com.tr/thumbs/1520x900/Archive/2024/4/4/2193380/kapak_123014.jpeg,2024-04-04 12:32:20+03:00,cumhuriyet
Ewan McGregor açıkladı: Obi-Wan Kenobi rolüne dönecek mi?,"Star Wars evreninde Obi-Wan karakterini canlandıran Ewan McGregor, Burada daha fazla hikaye anlatacak zamanım var dedi.",https://www.cumhuriyet.com.tr/kultur-sanat/ewan-mcgregor-acikladi-obi-wan-kenobi-rolune-donecek-mi-2193373?utm_medium=Kategori%20Sayfasi&utm_source=Cumhuriyet&utm_campaign=Kategori%20Sayfasi,https://www.cumhuriyet.com.tr/thumbs/1520x900/Archive/2024/4/4/2193373/kapak_121956.jpg,2024-04-04 12:20:18+03:00,cumhuriyet
Bayramların olmazsa olmazı: Ev baklavası tarifi,"Bayramlar, sevdiklerimizle bir araya gelip lezzetli yemeklerin tadını çıkarmak için harika bir fırsattır. Türk mutfağının vazgeçilmez tatlılarından biri olan baklava, bayram sofralarının da yıldızıdır. Ancak, evde yapılan taze ve lezzetli bir baklava, hazır alınanlardan çok daha özel ve değerlidir. İşte, evde kolayca hazırlayabileceğiniz enfes bir baklava tarifi...",https://www.cumhuriyet.com.tr/gurme/bayramlarin-olmazsa-olmazi-ev-baklavasi-tarifi-2193370?utm_medium=Kategori%20Sayfasi&utm_source=Cumhuriyet&utm_campaign=Kategori%20Sayfasi,https://www.cumhuriyet.com.tr/thumbs/1520x900/Archive/2024/4/4/2193370/kapak_121517.jpg,2024-04-04 12:15:25+03:00,cumhuriyet
Ünlü aktöre Bugatti satışı neden yasaklandı?,"Görevimiz Tehlike ve Top Gun serilerinin yıldızı, ünlü Amerikalı aktör Tom Cruise’un, ünlü otomobil firması Bugatti tarafından kara listeye alındığını biliyor muydunuz? İşte, nedeni...",https://www.cumhuriyet.com.tr/yasam/unlu-aktore-bugatti-satisi-neden-yasaklandi-2193342?utm_medium=KategoriSayfasi&utm_source=KategoriSayfasi,https://www.cumhuriyet.com.tr/thumbs/1520x900/Archive/2024/4/4/2193342/kapak_113016.jpg,2024-04-04 12:14:29+03:00,cumhuriyet
Sağlık emekçilerinden 'vergide adalet' eylemi,"Sağlık meslek örgütleri, “vergide adalet” istemiyle yaptıkları basın açıklamasıyla “Adaletsiz vergi sistemi nedeniyle kaşıkla verilen kepçeyle geri alınıyor” dedi.",https://www.cumhuriyet.com.tr/saglik/saglik-emekcilerinden-vergide-adalet-eylemi-2193346?utm_medium=KategoriSayfasi&utm_source=KategoriSayfasi,https://www.cumhuriyet.com.tr/thumbs/1520x900/Archive/2024/4/4/2193346/kapak_114247.jpeg,2024-04-04 11:43:49+03:00,cumhuriyet
İktidar tabip odalarına da el attı,"Ankara Tabip Odası’nın (ATO) seçimli olağan genel kurulu, 4-5 Mayıs tarihlerinde yapılacak.",https://www.cumhuriyet.com.tr/saglik/iktidar-tabip-odalarina-da-el-atti-2193228?utm_medium=KategoriSayfasi&utm_source=KategoriSayfasi,https://www.cumhuriyet.com.tr/thumbs/1520x900/Archive/2024/4/4/2193228/kapak_100944.jpeg,2024-04-04 10:12:03+03:00,cumhuriyet
Köy Enstitüleri Fikir ve Kültür Günleri 4. kez Ayvalık’ta,"Köy Enstitüleri Fikir ve Kültür Günleri, Ayvalık Belediyesi’nin ev sahipliğinde bu yıl dördüncü kez misafirlerini ağırlayacak. 19-21 Nisan’da düzenlenecek etkinlikte dinleti, panel, söyleşi ve tematik belgesel gösterimi gerçekleştirilecek.",https://www.cumhuriyet.com.tr/egitim/koy-enstituleri-fikir-ve-kultur-gunleri-4-kez-ayvalikta-2193297?utm_medium=Kategori%20Sayfasi&utm_source=Cumhuriyet&utm_campaign=Kategori%20Sayfasi,https://www.cumhuriyet.com.tr/thumbs/1520x900/Archive/2024/4/4/2193297/kapak_100832.jpg,2024-04-04 10:08:38+03:00,cumhuriyet
"Ege Deniz'i 1,3 derece ısındı","Meteoroloji Genel Müdürlüğü’nün yeni çalışmasına göre, küresel ısınmanın etkilerinin ciddi düzeyde kendini gösterdiği Türkiye’de 4 denizde, su sıcaklığının 1 derecenin üzerinde arttığı görüldü.",https://www.cumhuriyet.com.tr/cevre/ege-denizi-13-derece-isindi-2193281?utm_medium=KategoriSayfasi&utm_source=KategoriSayfasi,https://www.cumhuriyet.com.tr/thumbs/1520x900/Archive/2024/4/4/2193281/kapak_094155.jpg,2024-04-04 09:53:31+03:00,cumhuriyet
YKS sınav yerleri ve sınav giriş belgeleri ne zaman açıklanacak?,"Milyonlarca üniversite öğrencisi adayı gözlerini YKS sınav giriş belgelerinin çıkacağı ve sınav yerlerinin belli olacağı tarihe çevrildi. Peki, YKS sınav yerleri ve sınav giriş belgeleri ne zaman açıklanacak?",https://www.cumhuriyet.com.tr/egitim/yks-sinav-yerleri-ve-sinav-giris-belgeleri-ne-zaman-aciklanacak-2193284?utm_medium=KategoriSayfasi&utm_source=KategoriSayfasi,https://www.cumhuriyet.com.tr/thumbs/1520x900/Archive/2024/4/4/2193284/kapak_095251.jpg,2024-04-04 09:53:02+03:00,cumhuriyet
Lezzetli bir atıştırmalık: Patates salatası tarifi,"Ev yapımı patates salatası, taze malzemelerle hazırlanan ve serinletici bir lezzet sunan harika bir atıştırmalıktır. Bu pratik tarif, sıcak yaz günlerinde mükemmel bir tercihtir. İşte, pratik bir atıştırmalık patates salatası tarifi...",https://www.cumhuriyet.com.tr/gurme/lezzetli-bir-atistirmalik-patates-salatasi-tarifi-2193179?utm_medium=Kategori%20Sayfasi&utm_source=Cumhuriyet&utm_campaign=Kategori%20Sayfasi,https://www.cumhuriyet.com.tr/thumbs/1520x900/Archive/2024/4/3/2193179/kapak_200704.jpg,2024-04-03 20:07:07+03:00,cumhuriyet
Akdeniz Anemisi (Talasemi) nedir? Akdeniz Anemisi (Talasemi) belirtileri neler?,"Sosyal medyada en fazla araştırılan hastalıklardan biri de Tıpta Talasemi olarak bilinen Akdeniz Anemisi oldu. Peki, Akdeniz Anemisi (Talasemi) nedir? Akdeniz Anemisi (Talasemi) belirtileri neler?",https://www.cumhuriyet.com.tr/saglik/akdeniz-anemisi-talasemi-nedir-akdeniz-anemisi-talasemi-2193173?utm_medium=KategoriSayfasi&utm_source=KategoriSayfasi,https://www.cumhuriyet.com.tr/thumbs/1520x900/Archive/2024/4/3/2193173/kapak_191637.jpg,2024-04-03 19:16:42+03:00,cumhuriyet
ATA AÖF bahar dönemi ara sınav tarihleri ne zaman?,"Atatürk Üniversitesi Açık Öğretim Fakültesi (AÖF) akademik takvimini yayınlamasıyla birlikte bahar dönemi sınav tarihleri de belli oldu. Peki, ATA AÖF bahar dönemi ara sınav tarihleri ne zaman?",https://www.cumhuriyet.com.tr/egitim/ata-aof-bahar-donemi-ara-sinav-tarihleri-ne-zaman-2193162?utm_medium=KategoriSayfasi&utm_source=KategoriSayfasi,https://www.cumhuriyet.com.tr/thumbs/1520x900/Archive/2024/4/3/2193162/kapak_183144.jpg,2024-04-03 18:31:57+03:00,cumhuriyet
400 bin TL'lik otomobil kredi ile 1 milyonu aşıyor! Araba alma hayali kuranlar ne yapmalı?,Merkez Bankası'nın politika faizini yüzde 50'ye çıkarması otomotiv satışlarını etkiledi. Otomerkezi.net CEO’su Muhammed Ali Karakaş “Otomotiv kredi çıkmazında sıkıştı” sözleri ile son durumu değerlendirdi.,https://www.cumhuriyet.com.tr/otomotiv/400-bin-tllik-otomobil-kredi-ile-1-milyonu-asiyor-araba-alma-hayali-2193040?utm_medium=Kategori%20Sayfasi&utm_source=Cumhuriyet&utm_campaign=Kategori%20Sayfasi,https://www.cumhuriyet.com.tr/thumbs/1520x900/Archive/2024/4/3/2193040/kapak_143314.jpg,2024-04-03 17:41:10+03:00,cumhuriyet
Ramazan Bayramı öncesi mevsimine uygun lastik önerisi: Goodyear yapılması gerekenleri sıraladı...,"Goodyear uzmanları, Ramazan Bayramı'nda tatile çıkacak sürücülere mevsimine uygun lastik taktırması önerisinde bulundu.",https://www.cumhuriyet.com.tr/otomotiv/ramazan-bayrami-oncesi-mevsimine-uygun-lastik-onerisi-goodyear-2193131?utm_medium=Kategori%20Sayfasi&utm_source=Cumhuriyet&utm_campaign=Kategori%20Sayfasi,https://www.cumhuriyet.com.tr/thumbs/1520x900/Archive/2024/4/3/2193131/kapak_171032.jpg,2024-04-03 17:10:35+03:00,cumhuriyet
Voltify ve Beefull işbirliği ile elektrikli otomobillerde yüzde 20 indirimli şarj...,"Elektrikli araç kiralama platformu Voltify ile araç şarj istasyonu operatörü Beefull işbirliğine gitti. Voltify müşterilerinin, bu işbirliği sayesinde Beefull'un şarj istasyonu ağından yüzde 20 indirimli fiyatlarla faydalanabileceği açıklandı.",https://www.cumhuriyet.com.tr/otomotiv/voltify-ve-beefull-isbirligi-ile-elektrikli-otomobillerde-yuzde-20-2193068?utm_medium=Kategori%20Sayfasi&utm_source=Cumhuriyet&utm_campaign=Kategori%20Sayfasi,https://www.cumhuriyet.com.tr/thumbs/1520x900/Archive/2024/4/3/2193068/kapak_152638.jpg,2024-04-03 15:27:23+03:00,cumhuriyet
True Detective yıldızı Chris Pratt ile Mercy'de yer alacak...,"True Detective dizisindeki performansıyla tanınan Kali Reis, Mercy'nin kadrosuna dahil oldu.",https://www.cumhuriyet.com.tr/kultur-sanat/true-detective-yildizi-chris-pratt-ile-mercyde-yer-alacak-2193049?utm_medium=Kategori%20Sayfasi&utm_source=Cumhuriyet&utm_campaign=Kategori%20Sayfasi,https://www.cumhuriyet.com.tr/thumbs/1520x900/Archive/2024/4/3/2193049/kapak_145833.jpg,2024-04-03 14:58:38+03:00,cumhuriyet
'Spider-Man 4 gelecek mi?' sorusunu Sam Raimi cevapladı: Geri dönüş yolda mı?,"Spider-Man 4'ün çekileceği bir süredir gündemdeydi. Sam Raimi, devam filmiyle ilgili açıklamalarda bulundu.",https://www.cumhuriyet.com.tr/kultur-sanat/spider-man-4-gelecek-mi-sorusuna-sam-raimi-acikladi-geri-donus-2193037?utm_medium=KategoriSayfasi&utm_source=KategoriSayfasi,https://www.cumhuriyet.com.tr/thumbs/1520x900/Archive/2024/4/3/2193037/kapak_142624.jpg,2024-04-03 14:43:59+03:00,cumhuriyet
Otomobil satışlarında otomatik şanzımanlı modeller farkı açıyor: Manuel satışları durma noktasına geldi...,Otomobil ve hafif ticari araç satışları 2024 yılına hızlı başladı. ODMD verilerine göre Mart 2024'te şanzıman tipine göre satışlar belli oldu. Otomatik vitese talep artmaya devam ediyor.,https://www.cumhuriyet.com.tr/otomotiv/otomobil-satislarinda-otomatik-sanzimanli-modeller-farki-aciyor-manuel-2193026?utm_medium=Kategori%20Sayfasi&utm_source=Cumhuriyet&utm_campaign=Kategori%20Sayfasi,https://www.cumhuriyet.com.tr/thumbs/1520x900/Archive/2024/4/3/2193026/kapak_135928.jpg,2024-04-03 14:00:35+03:00,cumhuriyet
Otomobil ve hafif ticari araç satışları mart istatistikleri: Satışların 3'te 2'si benzinli...,Otomobil ve hafif ticari araç satışları 2024 yılına hızlı başladı. ODMD verilerine göre Mart 2024'te motor tipine göre satışlar belli oldu. Emisyon değerlerine göre satışlar da paylaşıldı. Elektrikli payı 2023'e oranla yaklaşık 3 kat arttı.,https://www.cumhuriyet.com.tr/otomotiv/otomobil-ve-hafif-ticari-arac-satislari-mart-istatistikleri-satislarin-2193006?utm_medium=Kategori%20Sayfasi&utm_source=Cumhuriyet&utm_campaign=Kategori%20Sayfasi,https://www.cumhuriyet.com.tr/thumbs/1520x900/Archive/2024/4/3/2193006/kapak_131101.jpg,2024-04-03 13:50:43+03:00,cumhuriyet
Hikmet Çetinkaya: Sanatın Işığını Yayan Bir Ressamın Hikayesi,Sanat yolculuğunda birçok başarıya imza atan Ressam Hikmet Çetinkaya'nın hikayesi...,https://www.cumhuriyet.com.tr/kultur-sanat/hikmet-cetinkaya-sanatin-isigini-yayan-bir-ressamin-hikayesi-2193020?utm_medium=KategoriSayfasi&utm_source=KategoriSayfasi,https://www.cumhuriyet.com.tr/thumbs/1520x900/Archive/2024/4/3/2193020/kapak_133342.jpg,2024-04-03 13:33:48+03:00,cumhuriyet
Benedict Cumberbatch'in yeni projesi belli oldu! Olivia Colman eşlik edecek...,Benedict Cumberbatch 1989 yapımı bir filmin yeniden uyarlamasında Olivia Colman ile başrolü üstlenecek.,https://www.cumhuriyet.com.tr/kultur-sanat/benedict-cumberbatchin-yeni-projesi-belli-oldu-olivia-colman-eslik-2193011?utm_medium=KategoriSayfasi&utm_source=KategoriSayfasi,https://www.cumhuriyet.com.tr/thumbs/1520x900/Archive/2024/4/3/2193011/kapak_132404.jpg,2024-04-03 13:24:10+03:00,cumhuriyet
Otomobil ve hafif ticari araç satışları mart istatistikleri: SUV satışları zirveden düşmüyor!...,Otomobil ve hafif ticari araç satışları 2024 yılına hızlı başladı. ODMD verilerine göre Mart 2024'te segmentlere göre satışlar belli oldu.,https://www.cumhuriyet.com.tr/otomotiv/otomobil-ve-hafif-ticari-arac-satislari-mart-istatistikleri-suv-2193000?utm_medium=KategoriSayfasi&utm_source=KategoriSayfasi,https://www.cumhuriyet.com.tr/thumbs/1520x900/Archive/2024/4/3/2193000/kapak_130203.jpg,2024-04-03 13:02:07+03:00,cumhuriyet
Otomobil ve hafif ticari araç satışları açıklandı: Düşüş başladı!,Otomobil ve hafif ticari araç satışları 2024 yılına hızlı başladı. ODMD verilerine göre Mart 2024'te ise düşüşün ilk sinyali geldi.,https://www.cumhuriyet.com.tr/otomotiv/otomobil-ve-hafif-ticari-arac-satislari-aciklandi-dusus-basladi-2192991?utm_medium=Kategori%20Sayfasi&utm_source=Cumhuriyet&utm_campaign=Kategori%20Sayfasi,https://www.cumhuriyet.com.tr/thumbs/1520x900/Archive/2024/4/3/2192991/kapak_124910.jpg,2024-04-03 12:51:07+03:00,cumhuriyet
İzmir’de kuralık alarmı: 9 aylık su kaldı!,"İzmir Su ve Kanalizasyon İdaresi (İZSU) Genel Müdürü Ali Hıdır Köseoğlu, kentin önemli su kaynaklarından Tahtalı ve Gördes barajlarının doluluk seviyelerini değerlendirerek, “Son 25 yıl geriye doğru baktığımızda barajın 3'üncü en kurak dönemindeyiz. Hatta 2008 yılında bu seviye 75 milyona kadar düşmüştür. Bugün su, 111 milyon metreküp seviyesinde. Yapılan hesaplamalara göre, Tahtalı Barajı'nda 8-9 aylık ihtiyacı karşılayacak kadar suyumuz var dedi.",https://www.cumhuriyet.com.tr/cevre/izmirde-kuralik-alarmi-9-aylik-su-kaldi-2192948?utm_medium=KategoriSayfasi&utm_source=KategoriSayfasi,https://www.cumhuriyet.com.tr/thumbs/1520x900/Archive/2024/4/3/2192948/kapak_114120.jpg,2024-04-03 11:41:27+03:00,cumhuriyet
Zilkale Vadisi’nde ‘Kır Lokantası’ Projesine Tepki,"Zilkale Vadisi'ni Pazar Orman İşletme Müdürlüğü’nün  ‘Kır Lokantası’ yapılması için 20 yıllığına ihaleye çıkarması, bölge halkının ve çevre savunucularının tepkisini topladı.",https://www.cumhuriyet.com.tr/cevre/zilkale-vadisinde-kir-lokantasi-projesine-tepki-2192911?utm_medium=Kategori%20Sayfasi&utm_source=Cumhuriyet&utm_campaign=Kategori%20Sayfasi,https://www.cumhuriyet.com.tr/thumbs/1520x900/Archive/2024/4/3/2192911/kapak_103927.jpeg,2024-04-03 11:13:46+03:00,cumhuriyet
38. Uluslararası Ankara Müzik Festivali!,"Sevda-Cenap And Müzik Vakfı tarafından düzenlenen 38. Uluslararası Ankara Müzik Festivali, 4 Nisan'da başlıyor.",https://www.cumhuriyet.com.tr/kultur-sanat/38-uluslararasi-ankara-muzik-festivali-2192924?utm_medium=KategoriSayfasi&utm_source=KategoriSayfasi,https://www.cumhuriyet.com.tr/thumbs/1520x900/Archive/2024/4/3/2192924/kapak_110037.jpg,2024-04-03 11:00:42+03:00,cumhuriyet
"e-YDS başvuru tarihleri ne zaman? e-YDS başvurusu nereden, nasıl yapılır?","Ölçme, Seçme ve Yerleştirme Merkezi (ÖSYM) tarafından yapılan Elektronik Yabancı Dil Bilgisi Seviye Tespit Sınavı 27 Nisan 2024 tarihinde yapılacak. Peki, e-YDS başvurusu nereden yapılır? e-YDS başvurusu nasıl yapılır?",https://www.cumhuriyet.com.tr/egitim/e-yds-basvuru-tarihleri-ne-zaman-e-yds-basvurusu-nereden-nasil-2192683?utm_medium=KategoriSayfasi&utm_source=KategoriSayfasi,https://www.cumhuriyet.com.tr/thumbs/1520x900/Archive/2024/4/2/2192683/kapak_160522.jpg,2024-04-02 16:05:31+03:00,cumhuriyet
Anadolu Üniversitesi bahar dönemi final sınavları ne zaman? AÖF sınav sonuçları nereden öğrenilir?,"Anadolu Üniversitesi Açıköğretim, İktisat ve İşletme Fakülteleri (AÖF) 2023-2024 Öğretim Yılı Bahar Dönemi Ara sınavı sonuçları açıklandı. Peki, Anadolu Üniversitesi bahar dönemi final sınavları ne zaman? AÖF sınav sonuçları nereden öğrenilir?",https://www.cumhuriyet.com.tr/egitim/anadolu-universitesi-bahar-donemi-final-sinavlari-ne-zaman-aof-sinav-2192659?utm_medium=KategoriSayfasi&utm_source=KategoriSayfasi,https://www.cumhuriyet.com.tr/thumbs/1520x900/Archive/2024/4/2/2192659/kapak_151834.jpg,2024-04-02 15:18:38+03:00,cumhuriyet
Pirina fabrikasının izinlerinin iptali için açılan dava yeniden görülecek,"Ayvalık’taki pirina fabrikasının çevre izninin iptali için açılan davaya verilen ret kararı istinaftan döndü. Dava yeniden görülecek. Ayvalık Belediye Başkanı Mesut Ergin,  “Biz bu hukuk mücadelesini verirken, AKP adayı bırakın mücadele vermeyi, kendisi Çevre Bakanlığı’na konuyu bir kez bile iletmiş mi? Sevsinler senin çevreciliğini” dedi.",https://www.cumhuriyet.com.tr/cevre/pirina-fabrikasinin-izinlerinin-iptali-icin-acilan-dava-yeniden-2192558?utm_medium=KategoriSayfasi&utm_source=KategoriSayfasi,https://www.cumhuriyet.com.tr/thumbs/1520x900/Archive/2024/4/2/2192558/kapak_120721.jpg,2024-04-02 12:07:26+03:00,cumhuriyet
'Spor salonlarındaki enfeksiyon riskine' karşı uyarı,"Göğüs Hastalıkları Anabilim Dalı Bölüm Başkanı Prof. Dr. Şevket Özkaya, Birçok spor salonu, sauna benzeri ortak kullanımı bulunan havuz ve duşlar önemli birer enfeksiyon kaynağı olabilmektedir dedi.",https://www.cumhuriyet.com.tr/saglik/spor-salonlarindaki-enfeksiyon-riskine-karsi-uyari-2192538?utm_medium=Kategori%20Sayfasi&utm_source=Cumhuriyet&utm_campaign=Kategori%20Sayfasi,https://www.cumhuriyet.com.tr/thumbs/1520x900/Archive/2024/4/2/2192538/kapak_114356.jpg,2024-04-02 11:44:00+03:00,cumhuriyet
Süt ve paketlenmiş meyve suları içmek çocuklarda iştahsızlık sebebi,"İştahsızlığın çocuklarda sık görülen bir semptom olduğunu belirten Çocuk Sağlığı ve Hastalıkları Uzmanı Dr. Rıza İnanç, “Öğün aralarında verilen meyve suları, süt gibi gıdalar çocuğun çabuk doymasına ve öğün atlamalarına neden olur. Abur cubur, asitli içecekler ve paketlenmiş ürünlerden uzak durulmalıdır. Son zamanlarda bu ürünlerin tüketimi, çocuklar arasında artış göstermiştir. Kreş ve anaokulu yetkilileri bu konuda duyarlı olmalıdır” dedi.",https://www.cumhuriyet.com.tr/saglik/sut-ve-paketlenmis-meyve-sulari-icmek-cocuklarda-istahsizlik-sebebi-2192471?utm_medium=Kategori%20Sayfasi&utm_source=Cumhuriyet&utm_campaign=Kategori%20Sayfasi,https://www.cumhuriyet.com.tr/thumbs/1520x900/Archive/2024/4/2/2192471/kapak_105333.jpg,2024-04-02 11:18:55+03:00,cumhuriyet
