title,description,url,img_url,publication_date,publisher
Datça'da turfanda hasat başladı: Dönümde 5 ton ürün,Muğla'nın Datça ilçesinde turfanda patates üretimi yapılan tarlalarda hasat başladı.,https://www.cumhuriyet.com.tr/yasam/datcada-turfanda-hasat-basladi-donumde-5-ton-urun-2195412?utm_medium=KategoriSayfasi&utm_source=KategoriSayfasi,https://www.cumhuriyet.com.tr/thumbs/1520x900/Archive/2024/4/11/2195412/kapak_211115.jpg,2024-04-11 21:11:23+03:00,cumhuriyet
Lezzet ve şifa deposu! Doğada kendiliğinden yetişiyor: Kilosu 50 TL,Lezzet ve şifa deposu çiriş otu Erzincan’da tezgahlarda yerini aldı.,https://www.cumhuriyet.com.tr/yasam/lezzet-ve-sifa-deposu-dogada-kendiliginden-yetisiyor-kilosu-50-tl-2195406?utm_medium=Kategori%20Sayfasi&utm_source=Cumhuriyet&utm_campaign=Kategori%20Sayfasi,https://www.cumhuriyet.com.tr/thumbs/1520x900/Archive/2024/4/11/2195406/kapak_195910.jpg,2024-04-11 19:59:16+03:00,cumhuriyet
"Özgür Özel, Ayşe Ateş ile bayramlaştı","CHP lideri Genel Başkanı Özgür Özel, Ankara’nın ortasında suikaste kurban giden eski Ülkü Ocakları Başkanı Sinan Ateş’in eşi Ayşe Ateş’i arayarak Şeker Bayramı’nı kutladı.",https://www.cumhuriyet.com.tr/siyaset/ozgur-ozel-ayse-ates-ile-bayramlasti-2195394?utm_medium=KategoriSayfasi&utm_source=KategoriSayfasi,https://www.cumhuriyet.com.tr/thumbs/1520x900/Archive/2024/4/11/2195394/kapak_184623.jpg,2024-04-11 19:55:34+03:00,cumhuriyet
Hatay'da ürünler dalında kaldı: Depremzede kadınların elinde reçele dönüştü!,Dalda kalan narenciyenin kabuğu depremzede kadınların elinde reçel oldu,https://www.cumhuriyet.com.tr/yasam/hatayda-urunler-dalinda-kaldi-depremzede-kadinlarin-elinde-recele-2195404?utm_medium=Kategori%20Sayfasi&utm_source=Cumhuriyet&utm_campaign=Kategori%20Sayfasi,https://www.cumhuriyet.com.tr/thumbs/1520x900/Archive/2024/4/11/2195404/kapak_195210.jpg,2024-04-11 19:52:15+03:00,cumhuriyet
Sarıgöl'de ekim başladı: İlk hasat haziran ayında,Manisa'nın Sarıgöl ilçesinde yazlık sebzelerin fidanları toprakla buluşturulmaya başlandı.,https://www.cumhuriyet.com.tr/yasam/sarigolde-ekim-basladi-ilk-hasat-haziran-ayinda-2195403?utm_medium=KategoriSayfasi&utm_source=KategoriSayfasi,https://www.cumhuriyet.com.tr/thumbs/1520x900/Archive/2024/4/11/2195403/kapak_194436.jpg,2024-04-11 19:44:42+03:00,cumhuriyet
Adana'da 70 ton mahsul tarlada kaldı: Üretici bedavaya dağıttı,"Adana’da bir üretici, ihracat için ektiği lahana tarlada kalınca ücretsiz dağıttı.",https://www.cumhuriyet.com.tr/yasam/adanada-70-ton-mahsul-tarlada-kaldi-uretici-bedavaya-dagitti-2195402?utm_medium=KategoriSayfasi&utm_source=KategoriSayfasi,https://www.cumhuriyet.com.tr/thumbs/1520x900/Archive/2024/4/11/2195402/kapak_193136.jpg,2024-04-11 19:31:48+03:00,cumhuriyet
Bu tarlada ürünleri müşteri topluyor: Kilosu 100 TL,"Samsun'un Bafra İlçesinde çilek tarlasına gelen müşteriler, alacakları çilekleri seçerek kendileri topluyor.",https://www.cumhuriyet.com.tr/yasam/bu-tarlada-urunleri-musteri-topluyor-kilosu-100-tl-2195397?utm_medium=KategoriSayfasi&utm_source=KategoriSayfasi,https://www.cumhuriyet.com.tr/thumbs/1520x900/Archive/2024/4/11/2195397/kapak_185934.jpg,2024-04-11 18:59:39+03:00,cumhuriyet
"Eylül ayında hasat ediliyor, dört mevsim tüketiliyor!",Adana’nın Kozan ilçesinde coğrafi işaretli Kuytucak Narı Eylül ayında hasat edilmesinin ardından kurutularak 4 mevsim tüketiliyor.,https://www.cumhuriyet.com.tr/yasam/eylul-ayinda-hasat-ediliyor-dort-mevsim-tuketiliyor-2195396?utm_medium=KategoriSayfasi&utm_source=KategoriSayfasi,https://www.cumhuriyet.com.tr/thumbs/1520x900/Archive/2024/4/11/2195396/kapak_185519.jpg,2024-04-11 18:55:25+03:00,cumhuriyet
"CHP İstanbul İl Başkanı Çelik, İBB ve ilçelerde son durumu açıkladı","CHP İstanbul İl Başkanı Özgür Çelik, 31 Mart yerel seçimlerin ardından tamamlanan itiraz süreci sonrası açıklamada bulundu. Çelik, İBB Başkanlığı, Meclis Çoğunluğu, 26 İlçe Belediyesi, Bahçelievler’de meclis çoğunluğu kazandık. dedi.",https://www.cumhuriyet.com.tr/siyaset/chp-istanbul-il-baskani-celik-ibb-ve-ilcelerde-son-durumu-acikladi-2195395?utm_medium=KategoriSayfasi&utm_source=KategoriSayfasi,https://www.cumhuriyet.com.tr/thumbs/1520x900/Archive/2024/4/11/2195395/kapak_185405.jpg,2024-04-11 18:54:10+03:00,cumhuriyet
Kozan'da ilk kez ekildi! Hasadı erken başladı: Tarlada kilosu 17 TL,"Adana’nın Kozan ilçesinde 70 dönüm araziye ilk kez soğan ekimi gerçekleştiren üretici Ahmet Demiryürek, mısırda elde edemediği verimi soğanda elde etti.",https://www.cumhuriyet.com.tr/yasam/kozanda-ilk-kez-ekildi-hasadi-erken-basladi-tarlada-kilosu-17-tl-2195393?utm_medium=KategoriSayfasi&utm_source=KategoriSayfasi,https://www.cumhuriyet.com.tr/thumbs/1520x900/Archive/2024/4/11/2195393/kapak_183820.jpg,2024-04-11 18:38:32+03:00,cumhuriyet
"Pazarcıydı, milyarder oldu... İdama mahkum edildi!","Vietnam'da bir mahkeme, emlak kralı Truong My Lan'ı, ülkenin kayıtlara geçen en büyük dolandırıcılık vakası olan 304 trilyon dongluk (12,46 milyar dolar) dolandırıcılık suçlaması nedeniyle idama mahkum etti.",https://www.cumhuriyet.com.tr/dunya/pazarciydi-milyarder-oldu-idama-mahkum-edildi-2195380?utm_medium=Kategori%20Sayfasi&utm_source=Cumhuriyet&utm_campaign=Kategori%20Sayfasi,https://www.cumhuriyet.com.tr/thumbs/1520x900/Archive/2024/4/11/2195380/kapak_174714.jpg,2024-04-11 17:47:33+03:00,cumhuriyet
En kötü çift olan 4 burç: Bu burçların ilişkisi yürümüyor,"Astroloji söz konusu olduğunda burçlar arasındaki uyumluluk ilişkilerde önemli rol oynar. Bazı eşleşmeler uyumlu bir şekilde gelişirken, diğerleri aşılmaz görünen zorluklarla karşı karşıya kalır. İşte, en kötü çift olan 4 burç...",https://www.cumhuriyet.com.tr/astroloji/en-kotu-cift-olan-4-burc-bu-burclarin-iliskisi-yurumuyor-2195379?utm_medium=Kategori%20Sayfasi&utm_source=Cumhuriyet&utm_campaign=Kategori%20Sayfasi,https://www.cumhuriyet.com.tr/thumbs/1520x900/Archive/2024/4/11/2195379/kapak_174054.jpg,2024-04-11 17:40:58+03:00,cumhuriyet
Kırk Yalan filminin konusu ne? Kırk Yalan filmi nerede çekildi? Kırk Yalan filmi oyuncu kadrosunda kimler var?,"Kırk Yalan filmi beyaz perde ardından televizyon izleyicileriyle buluşuyor. Komedi türündeki filmi ilk kez izleyecek olanlar, kadro ve karakterleri merak ediyor. Peki, Kırk Yalan filminin konusu ne? Kırk Yalan filmi nerede çekildi? Kırk Yalan filmi oyuncu kadrosunda kimler var?",https://www.cumhuriyet.com.tr/kultur-sanat/kirk-yalan-filminin-konusu-ne-kirk-yalan-filmi-nerede-cekildi-kirk-2195375?utm_medium=KategoriSayfasi&utm_source=KategoriSayfasi,https://www.cumhuriyet.com.tr/thumbs/1520x900/Archive/2024/4/11/2195375/kapak_171419.jpg,2024-04-11 17:14:22+03:00,cumhuriyet
Borsa ne zaman açılacak? Borsa İstanbul'un kapalı olduğu günler hangileri?,"Şeker Bayramı tatili sürerken Borsa işlem tarihine yönelik araştırmalar da sürüyor. Piyasaların tatil olması nedeniyle Borsa işlemlerini erteleyen vatandaşlar, açılış tarihini merak ediyor. Peki, Borsa ne zaman açılacak? Borsa İstanbul açılış tarihi ne?",https://www.cumhuriyet.com.tr/ekonomi/borsa-ne-zaman-acilacak-borsa-istanbulun-kapali-oldugu-gunler-2195373?utm_medium=KategoriSayfasi&utm_source=KategoriSayfasi,https://www.cumhuriyet.com.tr/thumbs/1520x900/Archive/2024/4/11/2195373/kapak_170819.jpg,2024-04-11 17:08:24+03:00,cumhuriyet
"Koray Aydın'dan Meral Akşener'e: Kurultayı iptal ettirmeye çalışıyorlar, kararın arkasında durun","İYİ Parti Genel Başkan Adayı Koray Aydın, partide bazı milletvekilleri ve il başkanlarının olağanüstü kurultayın iptal edilmesi için çalıştığını öne sürerek Genel Başkan Meral Akşener'e kararın sonuna kadar arkasında durması çağrısında bulundu.",https://www.cumhuriyet.com.tr/siyaset/koray-aydindan-meral-aksenere-kurultayi-iptal-ettirmeye-2195372?utm_medium=KategoriSayfasi&utm_source=KategoriSayfasi,https://www.cumhuriyet.com.tr/thumbs/1520x900/Archive/2024/4/11/2195372/kapak_170636.jpg,2024-04-11 17:07:47+03:00,cumhuriyet
Türkiye'nin küresel ihracatta payı rekor seviyeye ulaştı,"Ticaret Bakanlığı, Türkiye'nin küresel mal ihracatından aldığı payın, 2023 yılında bir önceki yıla göre 0,06 puan artışla yüzde 1,08'e yükselerek tarihin en yüksek seviyesine ulaştığını açıkladı.",https://www.cumhuriyet.com.tr/ekonomi/turkiyenin-kuresel-ihracatta-payi-rekor-seviyeye-ulasti-2195370?utm_medium=Kategori%20Sayfasi&utm_source=Cumhuriyet&utm_campaign=Kategori%20Sayfasi,https://www.cumhuriyet.com.tr/thumbs/1520x900/Archive/2024/4/11/2195370/kapak_164930.jpg,2024-04-11 16:49:35+03:00,cumhuriyet
12 Nisan Cuma günlük burç yorumları: Bugün sizleri neler bekliyor? 12 Nisan Cuma burç yorumları,"Koç, boğa, ikizler, yengeç, aslan, başak, terazi, akrep, yay, oğlak, kova ve balık burçları işte günlük burç yorumları. Sizleri neler bekliyor? İşte 12 Nisan Cuma günlük burç yorumlarınız...",https://www.cumhuriyet.com.tr/astroloji/12-nisan-cuma-gunluk-burc-yorumlari-bugun-sizleri-neler-bekliyor-12-2195369?utm_medium=Kategori%20Sayfasi&utm_source=Cumhuriyet&utm_campaign=Kategori%20Sayfasi,https://www.cumhuriyet.com.tr/thumbs/1520x900/Archive/2024/4/11/2195369/kapak_164826.gif,2024-04-11 16:48:31+03:00,cumhuriyet
İsrail Başbakanı Netanyahu'dan İran'a üstü kapalı mesaj,"İsrail’in, Suriye’nin başkenti Şam'daki İran konsolosluk binasına hava saldırısı düzenlenmesiyle iki ülke arasında gerginlik artarken İsrail Başbakanı Binyamin Netanyahu, isim vermeden üstü kapalı bir şekilde Tahran’ı tehdit ederek “Kim bize zarar verirse biz de ona zarar veririz” dedi.",https://www.cumhuriyet.com.tr/dunya/israil-basbakani-netanyahudan-irana-ustu-kapali-mesaj-2195351?utm_medium=KategoriSayfasi&utm_source=KategoriSayfasi,https://www.cumhuriyet.com.tr/thumbs/1520x900/Archive/2024/4/11/2195351/kapak_161935.jpg,2024-04-11 16:19:38+03:00,cumhuriyet
2 otomobil yarış yaptı olan motorcuya oldu: Motosiklet kullanımında ekipmanın önemi bir kez daha görüldü: İşte o video...,2 otomobilin birbiri ile yarış yaptığı bir motosiklet kullanıcısının kamerasına yansıdı. Yarış yapanlardan biri kontrolünü kaybettiği Jaguar marka aracı ile motosikletliye çarptı. O anlar motosiklet kullanımında ekipmanın önemini gözler önüne serdi.,https://www.cumhuriyet.com.tr/otomotiv/2-otomobil-yaris-yapti-olan-motorcuya-oldu-motosiklet-kullaniminda-2195339?utm_medium=KategoriSayfasi&utm_source=KategoriSayfasi,https://www.cumhuriyet.com.tr/thumbs/1520x900/Archive/2024/4/11/2195339/kapak_153951.jpg,2024-04-11 16:06:08+03:00,cumhuriyet
Son dakika... ABD'de ÜFE beklentilerin altında kaldı,"Son dakika haberi... ABD'de Üretici Fiyat Endeksi (ÜFE), martta aylık bazda yüzde 0,2, yıllık bazda yüzde 2,1 artışla beklentilerin altında gerçekleşti.",https://www.cumhuriyet.com.tr/ekonomi/son-dakika-abdde-ufe-beklentilerin-altinda-kaldi-2195344?utm_medium=KategoriSayfasi&utm_source=KategoriSayfasi,https://www.cumhuriyet.com.tr/thumbs/1520x900/Archive/2024/4/11/2195344/kapak_154508.jpg,2024-04-11 16:04:31+03:00,cumhuriyet
Son Dakika... Avrupa Merkez Bankası faiz kararını açıkladı,"Son dakika gelişmesi... Avrupa Merkez Bankası (ECB), 3 temel politika faizini piyasa beklentileri doğrultusunda sabit tuttu.",https://www.cumhuriyet.com.tr/ekonomi/son-dakika-avrupa-merkez-bankasi-faiz-kararini-acikladi-2195338?utm_medium=KategoriSayfasi&utm_source=KategoriSayfasi,https://www.cumhuriyet.com.tr/thumbs/1520x900/Archive/2024/4/11/2195338/kapak_154416.jpg,2024-04-11 15:48:45+03:00,cumhuriyet
YSK Başkanı Ahmet Yener'den seçim sonuçlarına yapılan itirazlara ilişkin açıklama: '4 yerde seçim yenilenecek',"Bayram dolayısıyla basın mensuplarıyla bir araya gelen Yüksek Seçim Kurulu (YSK) Başkanı Ahmet Yener, 31 Mart Mahalli İdareler Genel Seçimlerinin itiraz süreci çerçevesinde AKP’nin 2, CHP’nin 1, MHP’nin 1 ve DEM Parti’nin 2 itirazının kabul edildiğini aktardı.",https://www.cumhuriyet.com.tr/siyaset/ysk-baskani-ahmet-yenerden-secim-sonuclarina-yapilan-itirazlara-2195316?utm_medium=Kategori%20Sayfasi&utm_source=Cumhuriyet&utm_campaign=Kategori%20Sayfasi,https://www.cumhuriyet.com.tr/thumbs/1520x900/Archive/2024/4/11/2195316/kapak_145318.jpg,2024-04-11 15:48:33+03:00,cumhuriyet
AKP'den YRP'ye bayram ziyareti... YRP'li Uğurlu: 'Bizim yüzümüzden kaybettiğiniz belediye yok çok şükür',"Yeniden Refah Partisi (YRP) Genel Başkan Yardımcısı Mehmet Fatih Uğurlu, bayramlaşma ziyaretleri kapsamında kendilerini ziyarete gelen AKP’li heyete “Bizim yüzümüzden kaybettiğiniz belediye yok çok şükür” ifadelerini kullandı.",https://www.cumhuriyet.com.tr/siyaset/akpden-yrpye-bayram-ziyareti-yrpli-ugurlu-bizim-yuzumuzden-2195335?utm_medium=KategoriSayfasi&utm_source=KategoriSayfasi,https://www.cumhuriyet.com.tr/thumbs/1520x900/Archive/2024/4/11/2195335/kapak_151636.jpg,2024-04-11 15:39:14+03:00,cumhuriyet
Başak Demirtaş'la ilgili çirkin paylaşım üzerine Selahattin Demirtaş'ın avukatından açıklama,"HDP’nin eski Eş Genel Başkanı Selahattin Demirtaş'ın eşi Başak Demirtaş'la ilgili sosyal medyada yapılan çirkin paylaşımlar üzerine Demirtaş'ın avukatı Mahsuni Karaman “Hepsinin gereği yapılıyor, yapılacak” açıklaması yaptı.",https://www.cumhuriyet.com.tr/siyaset/basak-demirtasla-ilgili-cirkin-paylasim-uzerine-selahattin-demirtasin-2195340?utm_medium=Kategori%20Sayfasi&utm_source=Cumhuriyet&utm_campaign=Kategori%20Sayfasi,https://www.cumhuriyet.com.tr/thumbs/1520x900/Archive/2024/4/11/2195340/kapak_153314.jpg,2024-04-11 15:38:34+03:00,cumhuriyet
Samsung'un canlı çeviri özelliğine Türkçe dil desteği geliyor,"Samsung, canlı çeviri yapan özelliğine Türkçe dil desteği sunmaya hazırlanıyor.",https://www.cumhuriyet.com.tr/bilim-teknoloji/samsungun-canli-ceviri-ozelligine-turkce-dil-destegi-geliyor-2195334?utm_source=Anasayfa&utm_campaign=Cumhuriyet&utm_medium=BilimTeknoloji,https://www.cumhuriyet.com.tr/thumbs/1520x900/Archive/2024/4/11/2195334/kapak_151334.jpeg,2024-04-11 15:13:39+03:00,cumhuriyet
Kalp krizi geçiren HÜDA PAR başkan adayı hayatını kaybetti,"HÜDA PAR Malatya eski İl Başkanı ve son seçimlerde Malatya Büyükşehir adayı olan Mehmet İlker Dönmezer, geçirdiği kalp krizi sonrası hayatını kaybetti.",https://www.cumhuriyet.com.tr/siyaset/kalp-krizi-geciren-huda-par-baskan-adayi-hayatini-kaybetti-2195328?utm_medium=KategoriSayfasi&utm_source=KategoriSayfasi,https://www.cumhuriyet.com.tr/thumbs/1520x900/Archive/2024/4/11/2195328/kapak_150224.jpg,2024-04-11 15:02:52+03:00,cumhuriyet
Google Gemini sesleri dinleyip özetleyebilecek,Google Gemini herhangi bir sesi ya da konuşmayı dinleyip özetini çıkartabilecek.,https://www.cumhuriyet.com.tr/bilim-teknoloji/google-gemini-sesleri-dinleyip-ozetleyebilecek-2195325?utm_source=Anasayfa&utm_campaign=Cumhuriyet&utm_medium=BilimTeknoloji,https://www.cumhuriyet.com.tr/thumbs/1520x900/Archive/2024/4/11/2195325/kapak_144814.jpeg,2024-04-11 14:48:19+03:00,cumhuriyet
1 milyon kişiyi kandırmayı başardılar,"Facebook'ta açılan sahte bir Midjourney sayfasına inanan 1.2 milyon insan, farkına bile varmadan sayfanın yaydığı virüslerin kurbanı oldu.",https://www.cumhuriyet.com.tr/bilim-teknoloji/1-milyon-kisiyi-kandirmayi-basardilar-2195322?utm_source=Anasayfa&utm_campaign=Cumhuriyet&utm_medium=BilimTeknoloji,https://www.cumhuriyet.com.tr/thumbs/1520x900/Archive/2024/4/11/2195322/kapak_143746.jpeg,2024-04-11 14:37:50+03:00,cumhuriyet
"İran, İsrail'e saldıracak mı? 'Mesele ne zaman olacağı, olup olmayacağı değil'","ABD'nin Ortadoğu'daki en üst düzey askeri yetkilisi, 'İran'ın, İsrail'e olası saldırısını görüşmek üzere İsrail'e hareket etti. ABD istihbarat raporları, saldırının yüksek hassasiyetli füzeler ve insansız hava araçları yoluyla yapılacağını öne sürüyor.",https://www.cumhuriyet.com.tr/dunya/iran-israile-saldiracak-mi-mesele-ne-zaman-olacagi-olup-olmayacagi-2195321?utm_medium=Kategori%20Sayfasi&utm_source=Cumhuriyet&utm_campaign=Kategori%20Sayfasi,https://www.cumhuriyet.com.tr/thumbs/1520x900/Archive/2024/4/11/2195321/kapak_143655.jpg,2024-04-11 14:36:58+03:00,cumhuriyet
Tam Güneş tutulması uzaydan nasıl görünüyor?,NASA geçen günlerde gerçekleşen tam Güneş tutulmasının ürpertici bir görünümünü paylaştı.,https://www.cumhuriyet.com.tr/bilim-teknoloji/tam-gunes-tutulmasi-uzaydan-nasil-gorunuyor-2195320?utm_source=Anasayfa&utm_campaign=Cumhuriyet&utm_medium=BilimTeknoloji,https://www.cumhuriyet.com.tr/thumbs/1520x900/Archive/2024/4/11/2195320/kapak_143238.jpeg,2024-04-11 14:32:45+03:00,cumhuriyet
Ramazan ayı bitti: Dilber danslarıyla geri dönüyor!,"'İnci Taneleri' 2 haftalık aranın ardından ekrana  dönüş yapıyor. 18 Nisan’da yayımlanacak yeni bölümde Dilber, pavyonun açılışını yeni bir şarkı ve yeni dansıyla yapacak.",https://www.cumhuriyet.com.tr/yasam/ramazan-ayi-bitti-dilber-danslariyla-geri-donuyor-2195276?utm_source=Anasayfa&utm_campaign=Cumhuriyet&utm_medium=Yasam,https://www.cumhuriyet.com.tr/thumbs/1520x900/Archive/2024/4/11/2195276/kapak_110219.jpg,2024-04-11 14:24:19+03:00,cumhuriyet
Ekonomik ve lezzetli: Ev yapımı browni tarifi,"Ev yapımı browni tarifi, hem cebinize dost hem de damaklarınızı şenlendirecek bir lezzet alternatifidir. Bu tarifle, evinizde kolayca harika bir tatlı hazırlayabilirsiniz!",https://www.cumhuriyet.com.tr/gurme/ekonomik-ve-lezzetli-ev-yapimi-browni-tarifi-2195317?utm_source=Anasayfa&utm_campaign=Cumhuriyet&utm_medium=Gurme,https://www.cumhuriyet.com.tr/thumbs/1520x900/Archive/2024/4/11/2195317/kapak_142412.jpg,2024-04-11 14:24:18+03:00,cumhuriyet
"MHP'li Feti Yıldız'dan Özgür Özel'e: İnsanlar vardır şafak vaktinde doğar, akşam ezanında ölürler","MHP Hukuk ve Seçim İşlerinden Sorumlu Genel Başkan Yardımcısı Feti Yıldız, CHP Genel Başkanı Özgür Özel'in Bahçeli'ye verdiği yanıt üzerine Şeyh Edebali'nin 'ölüm' mesajı veren sözünü hatırlattı.",https://www.cumhuriyet.com.tr/siyaset/mhpli-feti-yildizdan-ozgur-ozele-insanlar-vardir-safak-vaktinde-2195310?utm_medium=KategoriSayfasi&utm_source=KategoriSayfasi,https://www.cumhuriyet.com.tr/thumbs/1520x900/Archive/2024/4/11/2195310/kapak_142049.jpg,2024-04-11 14:20:50+03:00,cumhuriyet
Mehmet Şimşek duyurmuştu! Dünya Bankası kredinin ayrıntılarını paylaştı,"Dünya Bankası Grubu (WBG), Türkiye'ye ilişkin Ülke İşbirliği Çerçevesinin detaylarını paylaştı. WBG İcra Direktörleri Kurulunca, Türkiye için hazırlanan Ülke İşbirliği Çerçevesi (CPF) üç kilit kalkınma stratejisine (üretkenlik artışı, istihdam ve daha iyi kamu hizmet sunumu ve doğal afetlere karşı dirençlilik) odaklanacak.",https://www.cumhuriyet.com.tr/ekonomi/mehmet-simsek-duyurmustu-dunya-bankasi-kredinin-ayrintilarini-paylasti-2195314?utm_medium=KategoriSayfasi&utm_source=KategoriSayfasi,https://www.cumhuriyet.com.tr/thumbs/1520x900/Archive/2024/4/11/2195314/kapak_141304.jpg,2024-04-11 14:13:07+03:00,cumhuriyet
"Elektrikli bisikleti bataryası patladı, uzmanlar uyardı",İngiltere’de tren istasyonunda bataryası patlayan elektrikli bisiklet alev aldı.,https://www.cumhuriyet.com.tr/dunya/elektrikli-bisikleti-bataryasi-patladi-uzmanlar-uyardi-2195301?utm_medium=Kategori%20Sayfasi&utm_source=Cumhuriyet&utm_campaign=Kategori%20Sayfasi,https://www.cumhuriyet.com.tr/thumbs/1520x900/Archive/2024/4/11/2195301/kapak_135235.jpg,2024-04-11 13:54:57+03:00,cumhuriyet
Ekrem İmamoğlu'na memleketi Trabzon'da büyük ilgi,"İstanbul Büyükşehir Belediyesi Başkanı Ekrem İmamoğlu, memleketi Trabzon’a geldi.",https://www.cumhuriyet.com.tr/siyaset/ekrem-imamogluna-memleketi-trabzonda-buyuk-ilgi-2195306?utm_medium=Kategori%20Sayfasi&utm_source=Cumhuriyet&utm_campaign=Kategori%20Sayfasi,https://www.cumhuriyet.com.tr/thumbs/1520x900/Archive/2024/4/11/2195306/kapak_135307.jpg,2024-04-11 13:53:10+03:00,cumhuriyet
Gizemli bir cismin Ay'ın yakınından geçtiği görüntülendi,NASA'nın uzay aracının kamerasına yakalanan gizemli cismin ne olduğu kısa süre içinde anlaşıldı.,https://www.cumhuriyet.com.tr/bilim-teknoloji/gizemli-bir-cismin-ayin-yakinindan-gectigi-goruntulendi-2195308?utm_source=Anasayfa&utm_campaign=Cumhuriyet&utm_medium=BilimTeknoloji,https://www.cumhuriyet.com.tr/thumbs/1520x900/Archive/2024/4/11/2195308/kapak_135220.jpeg,2024-04-11 13:52:25+03:00,cumhuriyet
Bilim insanları Güneş Sistemi'nin sonunu öngördü,"Bilim insanı, Üzücü haber şu ki Dünya, muhtemelen genişleyen Güneş tarafından yutulacak dedi.",https://www.cumhuriyet.com.tr/bilim-teknoloji/bilim-insanlari-gunes-sisteminin-sonunu-ongordu-2195307?utm_source=Anasayfa&utm_campaign=Cumhuriyet&utm_medium=BilimTeknoloji,https://www.cumhuriyet.com.tr/thumbs/1520x900/Archive/2024/4/11/2195307/kapak_134228.jpeg,2024-04-11 13:42:33+03:00,cumhuriyet
Kredi anlaşması 'müjde' diye sunuldu! Bu para nereye harcanacak?,"Hazine ve Maliye Bakanı Mehmet Şimşek, Dünya Bankası ile 2024-2028 yılları arasını kapsayan 18 milyar dolarlık ek finansman anlaşması imzaladığını duyurdu. Bu anlaşma ile birlikte Dünya Bankası'nın Türkiye'ye sağlayacağı toplam kredi miktarı 35 milyar dolara yükselmiş oldu. Anlaşmanın ayrıntılarına dair birçok soru gündeme gelirken ünlü iktisatçı Mahfi Eğilmez, Dünya Bankası kredilerinin ve IMF desteklerinin arasındaki farkları sıraladı.",https://www.cumhuriyet.com.tr/ekonomi/kredi-anlasmasi-mujde-diye-sunuldu-bu-para-nereye-harcanacak-2195287?utm_medium=KategoriSayfasi&utm_source=KategoriSayfasi,https://www.cumhuriyet.com.tr/thumbs/1520x900/Archive/2024/4/11/2195287/kapak_121355.jpg,2024-04-11 12:13:59+03:00,cumhuriyet
Düğün sezonu başladı! Gelinlik fiyatları cep yakıyor,Düğün sezonunun yaklaşmasıyla birlikte gelinliklere olan ilgi arttı. Son zamanlarda yoğun sipariş alınan gelinlikler de yeni sezonun fiyatları belli oldu.,https://www.cumhuriyet.com.tr/ekonomi/dugun-sezonu-basladi-gelinlik-fiyatlari-cep-yakiyor-2195284?utm_medium=KategoriSayfasi&utm_source=KategoriSayfasi,https://www.cumhuriyet.com.tr/thumbs/1520x900/Archive/2024/4/11/2195284/kapak_114107.jpg,2024-04-11 11:41:11+03:00,cumhuriyet
Türk denizlerinin röntgenini çekecek büyük deney başladı,"Türkiye'yi çevreleyen denizlerin sıcaklık, kirlilik ve oksijen durumunu tespit için 28 kıyı ilinde ODTÜ öğrencileri ve mezunlar ile yakınlarının katılımıyla ülkedeki en büyük çevre deneyini başlattı.",https://www.cumhuriyet.com.tr/bilim-teknoloji/turk-denizlerinin-rontgenini-cekecek-buyuk-deney-basladi-2195268?utm_source=Anasayfa&utm_campaign=Cumhuriyet&utm_medium=BilimTeknoloji,https://www.cumhuriyet.com.tr/thumbs/1520x900/Archive/2024/4/11/2195268/kapak_110805.jpeg,2024-04-11 11:08:11+03:00,cumhuriyet
2024-EKPSS sınav yerleri açıklandı mı? 2024-EKPSS sınav giriş belgesi ne zaman yayımlanır?,"Engelli Kamu Personeli Seçme Sınavı (2024/EKPSS) için geri sayım sürerken gözler sınav giriş belgelerine çevrildi. Peki, 2024-EKPSS sınav yerleri açıklandı mı? 2024-EKPSS sınav giriş belgesi ne zaman yayımlanır?",https://www.cumhuriyet.com.tr/egitim/2024-ekpss-sinav-yerleri-aciklandi-mi-2024-ekpss-sinav-giris-belgesi-2195273?utm_medium=KategoriSayfasi&utm_source=KategoriSayfasi,https://www.cumhuriyet.com.tr/thumbs/1520x900/Archive/2024/4/11/2195273/kapak_105440.jpg,2024-04-11 10:54:44+03:00,cumhuriyet
Her baharda gelen leylekler 'İsmayıl' ve 'Fatme' lisenin maskotu oldu,"Edirne'de, 44 yıldır eğitim verilen Yıldırım Beyazıt Anadolu Lisesi, okulun yanındaki elektrik direğini mesken tutan iki leyleğe 12 yıldır ev sahipliği yapıyor. Öğretmen ve öğrencilerin Trakya şivesiyle 'İsmayıl' ve 'Fatme' ismini koyduğu leyleklerin her yıl bahar aylarında geldiğini okulun İngilizce Öğretmeni Olcay Dal, Baharın gelişini cemrelerin düşmesiyle, takvimlerin değişmesiyle değil, İsmayıl ve Fatme'nin gelişiyle anlar olduk dedi.",https://www.cumhuriyet.com.tr/turkiye/her-baharda-gelen-leylekler-ismayil-ve-fatme-lisenin-maskotu-oldu-2195264?utm_source=Anasayfa&utm_campaign=Cumhuriyet&utm_medium=Yasam,https://www.cumhuriyet.com.tr/thumbs/1520x900/Archive/2024/4/11/2195264/kapak_105414.jpg,2024-04-11 10:54:20+03:00,cumhuriyet
Kritik veri açıklandı! Dolar ve Euro güne nasıl başladı? Dolar ve Euro ne kadar oldu? 11 Nisan 2024 döviz fiyatları,"ABD'de açıklanan enflasyon rakamları beklentilerin üzerinde gerçekleşti. Dün yükseliş eğilimi gösteren Dolar/TL, güne yatay başlamasının ardından 32,29 seviyesinden işlem görüyor. Aynı dakikalarda Euro/TL 34,68'den satılıyor.",https://www.cumhuriyet.com.tr/ekonomi/kritik-veri-aciklandi-dolar-ve-euro-gune-nasil-basladi-dolar-ve-euro-2195269?utm_medium=KategoriSayfasi&utm_source=KategoriSayfasi,https://www.cumhuriyet.com.tr/thumbs/1520x900/Archive/2024/4/11/2195269/kapak_105033.jpg,2024-04-11 10:50:38+03:00,cumhuriyet
Bilim insanlarından çığır açacak keşif: Alzheimer riskini düşürecek gen bulundu!,"Bilim insanları, Alzheimer riskini yüzde 70'e kadar azaltabilecek bir gen keşfetti.",https://www.cumhuriyet.com.tr/bilim-teknoloji/bilim-insanlarindan-cigir-acacak-kesif-alzheimer-riskini-dusurecek-gen-2195266?utm_medium=KategoriSayfasi&utm_source=KategoriSayfasi,https://www.cumhuriyet.com.tr/thumbs/1520x900/Archive/2024/4/11/2195266/kapak_104707.jpg,2024-04-11 10:47:12+03:00,cumhuriyet
