title,description,url,img_url,publishing_date,publisher
Steam Deck'in Mayıs ayında en çok oynanan 20 oyunu açıklandı,Valve'ın taşınabilir oyun konsolu Steam Deck'in Mayıs ayında en çok oynanan 20 oyunu açıklandı. Mayıs ayı boyunca Steam Deck'te en çok oynanan oyun FromSoftware tarafından geliştirilen aksiyon RPG oyunu Elden Ring oldu.,https://www.haberler.com/gamegar/mayis-2023-te-steam-deck-te-en-cok-oynanan-15985232-haberi/,https://foto.haberler.com/haber/2023/06/02/mayis-2023-te-steam-deck-te-en-cok-oynanan-15985232_2382_amp.jpg,2023-06-02 08:09:00+03:00,haberler.com
"Epic Games, 150 TL değerindeki Midnight Ghost Hunt oyununu veriyor",Her hafta kullanıcılarına ücretsiz oyunlar veren popüler dijital video oyun dağıtımcısı ve video oyun geliştiricisi Epic Games'in bu haftaki gizemli oyunu 150 TL olan Midnight Ghost Hunt. Oyunu 8 Haziran 2023 tarihine kadar ücretsiz olarak kütüphanenize ekleyebilirsiniz.,https://www.haberler.com/gamegar/epic-games-150-tl-degerindeki-midnight-ghost-15985199-haberi/,https://foto.haberler.com/haber/2023/06/02/epic-games-150-tl-degerindeki-midnight-ghost-15985199_7701_amp.jpg,2023-06-02 07:10:00+03:00,haberler.com
Haziran 2023 PlayStation Plus oyunları açıklandı! Toplam değeri 1567 TL,PlayStation Plus Haziran 2023 oyunlarının geçtiğimiz günlerde sızdırılmasının ardından PlayStation Blog'da 6 Haziran'dan itibaren eklenecek PlayStation Plus'ın Haziran 2023 oyunları belli oldu. PlayStation Plus kullanıcılarına 1567 TL değerinde üç adet ücretsiz oyun verilecek.,https://www.haberler.com/gamegar/haziran-2023-playstation-plus-oyunlari-aciklandi-15980928-haberi/,https://foto.haberler.com/haber/2023/06/01/haziran-2023-playstation-plus-oyunlari-aciklandi-15980928_7490_amp.jpg,2023-06-01 07:21:00+03:00,haberler.com
Everdream Valley PC ve PlayStation'da bugün çıkış yapıyor,"Genişleyen, rahat, hayvan cenneti çiftlik macerası Everdream Valley, Haziran 2023 için Nintendo Switch sürümüyle PC, PS4 ve PS5'te çıktı.",https://www.haberler.com/gamegar/everdream-valley-pc-ve-playstation-da-bugun-cikis-15973770-haberi/,https://foto.haberler.com/haber/2023/05/30/everdream-valley-pc-ve-playstation-da-bugun-cikis-15973770_9272_amp.jpg,2023-05-31 20:17:00+03:00,haberler.com
Steam'de en çok satan oyunlar açıklandı! 23 - 30 Mayıs 2023,"Steam'in 23 - 30 Mayıs 2023 tarihleri arasında en çok satan oyunları açıklandı. En çok satanın açıklandığı listede ilk 10'da oyunlar ve donanımlar yer aldı. Kimi oyunlar yükselirken, kimi oyunlar listede geriledi. Bazıları ise listede sırasını korumaya devam etti. İşte Steam'de haftanın en çok satan 10 oyunu.",https://www.haberler.com/gamegar/steam-de-en-cok-satan-oyunlar-aciklandi-23-30-15973195-haberi/,https://foto.haberler.com/haber/2023/05/30/steam-de-en-cok-satan-oyunlar-aciklandi-23-30-15973195_8841_amp.jpg,2023-05-30 11:53:00+03:00,haberler.com
Nordic Game Awards 2023'te ödüller sahiplerini buldu,"Nordic Game, 25 Mayıs'ta İsveç'in Malmö kentinde düzenlenen yıllık oyun endüstrisi konferansı NG23 Spring sırasında düzenlenen yıllık Nordic Game Awards'ın kazananlarını açıkladı.",https://www.haberler.com/gamegar/nordic-game-awards-2023-te-oduller-sahiplerini-15971052-haberi/,https://foto.haberler.com/haber/2023/05/29/nordic-game-awards-2023-te-oduller-sahiplerini-15971052_9891_amp.jpg,2023-05-29 15:36:00+03:00,haberler.com
Bu hafta çıkacak yeni oyunlar! 29 Mayıs - 4 Haziran 2023,"Her hafta yeni oyunlar piyasaya sürülmeye devam ediyor. Piyasaya yeni sürülen oyunların yanı sıra daha önce sürülmüş fakat farklı platformlara çıkış yapmaya hazırlanan oyunlar da yeni yerlerini almaya başlıyor. PC, Switch, PlayStation, Xbox, iOS ve Android için çıkacak yeni oyunlarda bu hafta neler var? Aksiyon, macera, simülasyon ve daha fazla türde pek çok oyun 29 Mayıs - 4 Haziran 2023 arasında çıkış yapmaya hazırlanıyor. Peki, bu hafta hangi oyunlar çıkacak? Detayları haberimizde…",https://www.haberler.com/gamegar/bu-hafta-cikacak-yeni-oyunlar-29-mayis-4-15970197-haberi/,https://foto.haberler.com/haber/2023/05/29/bu-hafta-cikacak-yeni-oyunlar-29-mayis-4-15970197_7188_amp.jpg,2023-05-29 12:17:00+03:00,haberler.com
"Epic Games, Steam değeri 200 TL olan Fallout: New Vegas'ı ücretsiz olarak veriyor",Her hafta kullanıcılarına ücretsiz oyunlar veren popüler dijital video oyun dağıtımcısı ve video oyun geliştiricisi Epic Games'in bu haftaki gizemli oyunu Steam değeri 200 TL olan Fallout: New Vegas - Ultimate Edition oldu. Oyunu 1 Haziran 2023 tarihine kadar ücretsiz olarak kütüphanenize ekleyebilirsiniz.,https://www.haberler.com/gamegar/epic-games-steam-degeri-200-tl-olan-fallout-new-15952433-haberi/,https://foto.haberler.com/haber/2023/05/26/epic-games-steam-degeri-200-tl-olan-fallout-new-15952433_1733_amp.jpg,2023-05-26 09:11:00+03:00,haberler.com
"NCSOFT, MMORPG türünde 25 yıllık mirasa bakan yeni marka fragmanını paylaştı","NCSOFT'un marka fragmanı ""MMORPG SPIRIT"", geliştiricinin amiral gemisi PC MMORPG IP'lerinin temel özelliklerini ele alıyor ve yakında çıkacak olan yeni oyunu THRONE AND LIBERTY'yi tanıtıyor.",https://www.haberler.com/gamegar/ncsoft-mmorpg-turunde-25-yillik-mirasa-bakan-15952394-haberi/,https://foto.haberler.com/haber/2023/05/26/ncsoft-mmorpg-turunde-25-yillik-mirasa-bakan-15952394_1507_amp.jpg,2023-05-26 08:46:00+03:00,haberler.com
Euro Truck Simulator 2'ye Türk dorse üreticisi TIRSAN geliyor,"Popüler tır simülasyon oyunu geliştiricisi SCS Software, Euro Truck Simulator 2'ye Türkiye merkezli ticari kullanım için yüksek kaliteli römorkların lider üreticisi TIRSAN'ın dorselerini oyuna ekleyeceğini duyurdu.",https://www.haberler.com/gamegar/euro-truck-simulator-2-ye-turk-dorse-ureticisi-15949800-haberi/,https://foto.haberler.com/haber/2023/05/25/euro-truck-simulator-2-ye-turk-dorse-ureticisi-15949800_9639_amp.jpg,2023-05-25 13:56:00+03:00,haberler.com
Bu hafta çıkacak yeni oyunlar! 22 - 28 Mayıs 2023,"Her hafta yeni oyunlar piyasaya sürülmeye devam ediyor. Piyasaya yeni sürülen oyunların yanı sıra daha önce sürülmüş fakat farklı platformlara çıkış yapmaya hazırlanan oyunlar da yeni yerlerini almaya başlıyor. PC, Switch, PlayStation, Xbox, iOS ve Android için çıkacak yeni oyunlarda bu hafta neler var? Aksiyon, macera, simülasyon ve daha fazla türde pek çok oyun 22 - 28 Mayıs 2023 arasında çıkış yapmaya hazırlanıyor. Peki, bu hafta hangi oyunlar çıkacak? Detayları haberimizde…",https://www.haberler.com/gamegar/bu-hafta-cikacak-yeni-oyunlar-22-28-mayis-2023-15939220-haberi/,https://foto.haberler.com/haber/2023/05/23/bu-hafta-cikacak-yeni-oyunlar-22-28-mayis-2023-15939220_4128_amp.jpg,2023-05-23 08:13:00+03:00,haberler.com
GeForce NOW kütüphanesine 16 yeni oyun ekleniyor!,2021 yılından bu yana ülkemizde aktif olan NVIDIA'nın bulut oyun servisi GeForce Now yeni oyunlar ile karşımıza çıkmaya devam ediyor.,https://www.haberler.com/teknoloji/geforce-now-kutuphanesine-16-yeni-oyun-ekleniyor-15865300-haberi/,https://foto.haberler.com/haber/2023/05/05/geforce-now-kutuphanesine-16-yeni-oyun-ekleni-15865300_amp.jpg,2023-05-23 07:43:00+03:00,haberler.com
"Asus, ProArt GeForce RTX 4080 ve 4070 Ti ekran kartlarını duyurdu","ASUS, içerik üreticilerinin ihtiyaçlarını karşılamak için tasarlanan ProArt GeForce RTX 4080 ve 4070 Ti ekran kartlarını duyurdu.",https://www.haberler.com/teknoloji/asus-proart-geforce-rtx-4080-ve-4070-ti-ekran-15865304-haberi/,https://foto.haberler.com/haber/2023/05/05/asus-proart-geforce-rtx-4080-ve-4070-ti-ekran-15865304_amp.jpg,2023-05-23 07:42:00+03:00,haberler.com
"Everdream Valley, 30 Mayıs'ta çıkış yapacak","Hayvan cenneti çiftlik macerası Everdream Valley, 30 Mayıs 2023'te PC, PS4 ve PS5'te çıkış yapmaya hazırlanırken Nintendo Switch sürümü Haziran 2023'te piyasaya sürülecek.",https://www.haberler.com/gamegar/everdream-valley-30-mayis-ta-cikis-yapacak-15939196-haberi/,https://foto.haberler.com/haber/2023/05/23/everdream-valley-30-mayis-ta-cikis-yapacak-15939196_8778_amp.jpg,2023-05-23 07:41:00+03:00,haberler.com
Steam'de haftanın en çok satanları! 9 - 16 Mayıs 2023,"Steam'in 9 - 16 Mayıs 2023 tarihleri arasında en çok satan oyunları açıklandı. En çok satanın açıklandığı listede ilk 10'da oyunlar ve donanımlar yer aldı. Kimi oyunlar yükselirken, kimi oyunlar listede geriledi. Bazıları ise listede sırasını korumaya devam etti. İşte Steam'de haftanın en çok satan 10 oyunu.",https://www.haberler.com/gamegar/steam-de-haftanin-en-cok-satanlari-9-16-mayis-15913113-haberi/,https://foto.haberler.com/haber/2023/05/16/steam-de-haftanin-en-cok-satanlari-9-16-mayis-15913113_8137_amp.jpg,2023-05-16 11:40:00+03:00,haberler.com
Altay Espor Genel Menajeri Erdican Çilengir ile özel röportaj,"Altay Espor'un Genel Menajeri Erdican Çilengir, başta Altay Espor olmak üzere espor sektörü hakkında açıklamalarda bulundu. Espor kariyerine adım atmak isteyen gençlere tavsiyelerden, espor kariyerinin başlangıcına kadar çok önemli açıklamalarda bulundu.",https://www.haberler.com/gamegar/altay-espor-genel-menajeri-erdican-cilengir-ile-15912342-haberi/,https://foto.haberler.com/haber/2023/05/16/altay-espor-genel-menajeri-erdican-cilengir-ile-15912342_6917_amp.jpg,2023-05-16 08:21:00+03:00,haberler.com
Bu hafta çıkacak yeni oyunlar! 15 - 21 Mayıs 2023,"Her hafta yeni oyunlar piyasaya sürülmeye devam ediyor. Piyasaya yeni sürülen oyunların yanı sıra daha önce sürülmüş fakat farklı platformlara çıkış yapmaya hazırlanan oyunlar da yeni yerlerini almaya başlıyor. PC, Switch, PlayStation, Xbox, iOS ve Android için çıkacak yeni oyunlarda bu hafta neler var? Aksiyon, macera, simülasyon ve daha fazla türde pek çok oyun 15 - 21 Mayıs 2023 arasında çıkış yapmaya hazırlanıyor. Peki, bu hafta hangi oyunlar çıkacak? Detayları haberimizde…",https://www.haberler.com/gamegar/bu-hafta-cikacak-yeni-oyunlar-15-21-mayis-2023-15909482-haberi/,https://foto.haberler.com/haber/2023/05/15/bu-hafta-cikacak-yeni-oyunlar-15-21-mayis-2023-15909482_4554_amp.jpg,2023-05-15 07:55:00+03:00,haberler.com
Epic Games 18 Mayıs 2023 ücretsiz gizemli oyunu ne?,"Her hafta kullanıcılarına ücretsiz oyunlar veren popüler dijital video oyun dağıtımcısı ve oyun geliştiricisi Epic Games, 18 Mayıs Perşembe günü kullanıcılarına gizemli oyun vereceği bildirildi. Kullanıcılar ise gizemli oyunun ne olduğunu araştırmaya başladı. Peki, Epic Games 18 Mayıs 2023 ücretsiz gizemli oyunu ne? Detayları haberimizde...",https://www.haberler.com/gamegar/epic-games-18-mayis-2023-ucretsiz-gizemli-oyunu-15893175-haberi/,https://foto.haberler.com/haber/2023/05/12/epic-games-18-mayis-2023-ucretsiz-gizemli-oyunu-15893175_8330_amp.jpg,2023-05-12 08:43:00+03:00,haberler.com
"Epic Games, ücretsiz olarak 360 TL değerinde The Sims 4 DLC'si veriyor","Her hafta kullanıcılarına ücretsiz oyunlar veren popüler dijital video oyun dağıtımcısı Epic Games, 11 - 18 Mayıs tarihleri arasında kullanıcılarına 360 TL değerinde yaşam simülasyon oyunu The Sims 4 DLC'si veriyor. Epic Games'in bir sonraki hafta vereceği oyun ise 18 Mayıs Perşembe günü belli olacak.",https://www.haberler.com/gamegar/epic-games-ucretsiz-olarak-360-tl-degerinde-the-15893170-haberi/,https://foto.haberler.com/haber/2023/05/12/epic-games-ucretsiz-olarak-360-tl-degerinde-the-15893170_5941_amp.jpg,2023-05-12 08:43:00+03:00,haberler.com
"Riot Games, AK Parti'nin seçim videosunda kullandığı League of Legends müziğine telif attı",Riot Games'in 2020 sezonu video öyküsünde yayınladığı Savaşçılar adlı League of Legends şarkısını AK Parti'nin seçim videosunda kullanmasının ardından video telif hakları nedeniyle kaldırıldı.,https://www.haberler.com/gamegar/riot-games-ak-parti-nin-secim-videosunda-15893148-haberi/,https://foto.haberler.com/haber/2023/05/12/riot-games-ak-parti-nin-secim-videosunda-15893148_9298_amp.jpg,2023-05-12 07:51:00+03:00,haberler.com
FIFA 23 ücretsiz nasıl oynanır? FIFA 23 ne zaman ücretsiz olacak?,"Electronic Arts'ın popüler futbol serisi FIFA'nın en başarılı ve en çok satan oyunu FIFA 23'ün ücretsiz nasıl oynanacağı ve ne zaman ücretsiz olacağı araştırılan konular arasında yer alıyor. Peki, FIFA 23 ücretsiz nasıl oynanır? FIFA 23 ne zaman ücretsiz olacak? Detayları haberimizde...",https://www.haberler.com/gamegar/fifa-23-ucretsiz-nasil-oynanir-fifa-23-ne-zaman-15890520-haberi/,https://foto.haberler.com/haber/2023/05/11/fifa-23-ucretsiz-nasil-oynanir-fifa-23-ne-zaman-15890520_7455_amp.jpg,2023-05-11 14:45:00+03:00,haberler.com
"699,00 TL değerindeki FIFA 23, Xbox Game Pass ve EA Play'e geliyor","Steam'de 699,00 TL ile satışa sunulan popüler futbol oyunu FIFA 23, yakın zamanda Xbox Game Pass ve EA Play aboneliğine ekleneceği bildirildi. Xbox Game Pass'in Twitter hesabından yapılan paylaşımda FIFA 23'ün çok yakında Xbox'a geleceği açıklandı. Peki, FIFA 23 ne zaman Xbox Game Pass'e gelecek? Detayları haberimizde...",https://www.haberler.com/gamegar/699-00-tl-degerindeki-fifa-23-xbox-game-pass-ve-15890401-haberi/,https://foto.haberler.com/haber/2023/05/11/699-00-tl-degerindeki-fifa-23-xbox-game-pass-ve-15890401_9213_amp.jpg,2023-05-11 14:05:00+03:00,haberler.com
Hollow Knight: Silksong ertelendi,"Geliştirici ekip Team Cherry, 2023'ün ilk yarısında piyasaya sürülmesi beklenen Hollow Knight: Silksong'un piyasaya sürülmesi için daha fazla zamana ihtiyacı olduğunu bu nedenle oyunun çıkış tarihinin ertelendiğini Twitter hesabından duyurdu.",https://www.haberler.com/gamegar/hollow-knight-silksong-ertelendi-15884214-haberi/,https://foto.haberler.com/haber/2023/05/10/hollow-knight-silksong-ertelendi-15884214_1720_amp.jpg,2023-05-10 07:30:00+03:00,haberler.com
Steam'de haftanın en çok satanları! 2 - 9 Mayıs 2023,"Steam'in 2 - 9 Mayıs 2023 tarihleri arasında en çok satan oyunları açıklandı. En çok satanın açıklandığı listede ilk 10'da oyunlar ve donanımlar yer aldı. Kimi oyunlar yükselirken, kimi oyunlar listede geriledi. Bazıları ise listede sırasını korumaya devam etti. İşte Steam'de haftanın en çok satan 10 oyunu.",https://www.haberler.com/gamegar/steam-de-haftanin-en-cok-satanlari-2-9-mayis-15880826-haberi/,https://foto.haberler.com/haber/2023/05/09/steam-de-haftanin-en-cok-satanlari-2-9-mayis-15880826_3813_amp.jpg,2023-05-09 11:38:00+03:00,haberler.com
Nisan 2023'te en çok indirilen PlayStation oyunları açıklandı,"Sony Interactive Entertainment'ın İçerik İletişim Uzmanı O'Dell Harmon Jr.'ın PlayStation Blog'da yayınladığı rapora göre PlayStation mağazasında Avrupa ve Amerika kullanıcılarının Nisan ayında en çok indirdiği PS5, PS4 ve PS VR oyunları açıklandı.",https://www.haberler.com/gamegar/nisan-2023-te-en-cok-indirilen-playstation-15879967-haberi/,https://foto.haberler.com/haber/2023/05/09/nisan-2023-te-en-cok-indirilen-playstation-15879967_9883_amp.jpg,2023-05-09 07:43:00+03:00,haberler.com
Bu hafta çıkacak yeni oyunlar! 8 - 14 Mayıs 2023,"Her hafta yeni oyunlar piyasaya sürülmeye devam ediyor. Piyasaya yeni sürülen oyunların yanı sıra daha önce sürülmüş fakat farklı platformlara çıkış yapmaya hazırlanan oyunlar da yeni yerlerini almaya başlıyor. PC, Switch, PlayStation, Xbox, iOS ve Android için çıkacak yeni oyunlarda bu hafta neler var? Aksiyon, macera, simülasyon ve daha fazla türde pek çok oyun 8 - 14 Mayıs 2023 arasında çıkış yapmaya hazırlanıyor. Peki, bu hafta hangi oyunlar çıkacak? Detayları haberimizde…",https://www.haberler.com/gamegar/bu-hafta-cikacak-yeni-oyunlar-8-14-mayis-2023-15875716-haberi/,https://foto.haberler.com/haber/2023/05/08/bu-hafta-cikacak-yeni-oyunlar-8-14-mayis-2023-15875716_2068_amp.jpg,2023-05-08 09:25:00+03:00,haberler.com
CS:GO Steam'de oyuncu rekoru kırmaya devam ediyor,"Counter Strike: Global Offensive, popüler dijital video oyun dağıtımcısı Steam'de geçtiğimiz aylardan bu yana sürekli olarak eş zamanlı oyuncu rekorunu tazeliyor. Geçtiğimiz günlerde ise CS GO, 1,8 milyon eş zamanlı oyuncu ile Steam'de rekor kırdı.",https://www.haberler.com/gamegar/cs-go-steam-de-oyuncu-rekoru-kirmaya-devam-ediyor-15875683-haberi/,https://foto.haberler.com/haber/2023/05/08/cs-go-steam-de-oyuncu-rekoru-kirmaya-devam-ediyor-15875683_2701_amp.jpg,2023-05-08 08:45:00+03:00,haberler.com
"Hogwarts Legacy, 15 milyon adet satarak 1 milyar dolar hasılat elde etti","Oyunun yayıncısı Warner Bros.'a göre Hogwarts Legacy, 31 Mart'ta sona eren üç ayı kapsayan ilk çeyrek kazanç sonuçlarında 15 milyon adet satışı aşarak 1 milyar doların üzerinde hasılat elde etti. Hogwarts Legacy, Warner Bros'un şimdiye kadarki en büyük oyun lansmanı oldu.",https://www.haberler.com/gamegar/hogwarts-legacy-15-milyon-adet-satarak-1-milyar-15875655-haberi/,https://foto.haberler.com/haber/2023/05/08/hogwarts-legacy-15-milyon-adet-satarak-1-milyar-15875655_2360_amp.jpg,2023-05-08 08:09:00+03:00,haberler.com
340 TL değerindeki Epic Games'in bu haftaki ücretsiz oyunları açıklandı,Epic Games her hafta olduğu gibi bu hafta da kullanıcılarına ücretsiz oyunlar vermeye devam ediyor. Bu hafta kullanıcılarına üç adet ücretsiz oyun veren Epic Games Store'un ücretsiz oyunları kullanıcılarını sevindirdi.,https://www.haberler.com/gamegar/340-tl-degerindeki-epic-games-in-bu-haftaki-15864398-haberi/,https://foto.haberler.com/haber/2023/05/05/340-tl-degerindeki-epic-games-in-bu-haftaki-15864398_5987_amp.jpg,2023-05-05 08:53:00+03:00,haberler.com
"Assassin's Creed Mirage, Ağustos'ta geliyor","Fransız video oyun geliştiricisi Ubisoft'un popüler aksiyon-macera serisinin son oyunu Assassin's Creed Mirage, GameStop çalışanı tarafından sızdırılan bilgilere göre Ağustos 2023'te piyasaya sürüleceği iddia edildi.",https://www.haberler.com/gamegar/assassin-s-creed-mirage-agustos-ta-geliyor-15859717-haberi/,https://foto.haberler.com/haber/2023/05/04/assassin-s-creed-mirage-agustos-ta-geliyor-15859717_7835_amp.jpg,2023-05-04 08:14:00+03:00,haberler.com
Redfall kötü lansman yaptı! Oyuncular gözü Starfield'a dikti,"2023'te piyasaya sürülmesi en çok beklenen oyunlar arasında yer alan Redfall, nihayet piyasaya sürüldü, ancak oyuncuların yaşadıkları optimizasyon sorunları nedeniyle oyun yerden yere vuruldu. Oyuncular ise yayıncının piyasaya süreceği bir diğer açık dünya oyunu Starfield'ın da kötü lansman yapmasından endişeleniyor.",https://www.haberler.com/gamegar/redfall-kotu-lansman-yapti-oyuncular-gozu-15854779-haberi/,https://foto.haberler.com/haber/2023/05/03/redfall-kotu-lansman-yapti-oyuncular-gozu-15854779_4564_amp.jpg,2023-05-03 08:35:00+03:00,haberler.com
Steam'de haftanın en çok satanları! 24 - 30 Nisan 2023,"Steam'in 24 - 30 Nisan 2023 tarihleri arasında en çok satan oyunları açıklandı. En çok satanın açıklandığı listede ilk 10'da oyunlar ve donanımlar yer aldı. Kimi oyunlar yükselirken, kimi oyunlar listede geriledi. Bazıları ise listede sırasını korumaya devam etti. İşte Steam'de haftanın en çok satan 10 oyunu.",https://www.haberler.com/gamegar/steam-de-haftanin-en-cok-satanlari-24-30-nisan-15854735-haberi/,https://foto.haberler.com/haber/2023/05/03/steam-de-haftanin-en-cok-satanlari-24-30-nisan-15854735_9897_amp.jpg,2023-05-03 07:30:00+03:00,haberler.com
Bu hafta çıkacak yeni oyunlar! 1 - 7 Mayıs 2023,"Her hafta yeni oyunlar piyasaya sürülmeye devam ediyor. Piyasaya yeni sürülen oyunların yanı sıra daha önce sürülmüş fakat farklı platformlara çıkış yapmaya hazırlanan oyunlar da yeni yerlerini almaya başlıyor. PC, Switch, PlayStation, Xbox, iOS ve Android için çıkacak yeni oyunlarda bu hafta neler var? Aksiyon, macera, simülasyon ve daha fazla türde pek çok oyun 1 - 7 Mayıs 2023 arasında çıkış yapmaya hazırlanıyor. Peki, bu hafta hangi oyunlar çıkacak? Detayları haberimizde…",https://www.haberler.com/gamegar/bu-hafta-cikacak-yeni-oyunlar-1-7-mayis-2023-15850531-haberi/,https://foto.haberler.com/haber/2023/05/02/bu-hafta-cikacak-yeni-oyunlar-1-7-mayis-2023-15850531_9982_amp.jpg,2023-05-02 09:38:00+03:00,haberler.com
Amazon Prime Gaming Mayıs 2023 oyunları açıklandı! 800 TL değerindeki 15 oyunu ücretsiz veriyor,"Amazon'un abonelerine özel olarak her ay ücretsiz bir şekilde verdiği Amazon Prime Gaming'in Mayıs 2023 oyunları açıklandı. Bu ay kullanıcılarına 800,00 TL değerinde ücretsiz oyunlar veren Amazon Prime Gaming'in oyunları önümüzdeki günlerde erişime açılacak.",https://www.haberler.com/gamegar/amazon-prime-gaming-mayis-2023-oyunlari-aciklandi-15850456-haberi/,https://foto.haberler.com/haber/2023/05/02/amazon-prime-gaming-mayis-2023-oyunlari-aciklandi-15850456_4134_amp.jpg,2023-05-02 08:40:00+03:00,haberler.com
"STAR WARS Jedi: Survivor, Steam kullanıcıları tarafından olumsuz incelemelere boğuldu","STAR WARS Jedi: Fallen Order'ın devam niteliğindeki aksiyon-macera oyununun eleştirmenlerden aldığı yüksek puanlara rağmen, oyunculardan kötü incelemeler almaya devam ediyor.",https://www.haberler.com/gamegar/star-wars-jedi-survivor-olumsuz-kullanici-15850430-haberi/,https://foto.haberler.com/haber/2023/05/02/star-wars-jedi-survivor-olumsuz-kullanici-15850430_6733_amp.jpg,2023-05-02 08:19:00+03:00,haberler.com
Sony'den yeni patent: PlayStation 5 tasarımı değişiyor!,"PlayStation 5 tasarımı değişiyor. Sony tarafından alınan yeni bir patent, çıkarılabilir optik disk sürücüsü desteği kazanacağını gösterdi.",https://www.haberler.com/teknoloji/sony-den-yeni-patent-playstation-5-tasarimi-15837015-haberi/,https://foto.haberler.com/haber/2023/04/28/sony-den-yeni-patent-playstation-5-tasarimi-15837015_amp.jpg,2023-04-28 23:35:00+03:00,haberler.com
"Steam, Türkiye'de en çok satan oyunları açıkladı!","Steam, 11 Nisan ile 18 Nisan tarihleri aralığında Türkiye'de en çok satan oyunları paylaştı. İşte en popüler yapımlar...",https://www.haberler.com/teknoloji/steam-turkiye-de-en-cok-satan-oyunlari-acikladi-15810371-haberi/,https://foto.haberler.com/haber/2023/04/22/steam-turkiye-de-en-cok-satan-oyunlari-acikla-15810371_amp.jpg,2023-04-28 11:46:00+03:00,haberler.com
Steam duyurdu: İşte en çok satan oyunlar,"Steam, haftanın en çok satan oyunlar listesini güncelledi. Steam Deck yine listeye damga vurdu. İşte ayrıntılar!",https://www.haberler.com/teknoloji/steam-duyurdu-iste-en-cok-satan-oyunlar-15778359-haberi/,https://foto.haberler.com/haber/2023/04/19/steam-duyurdu-iste-en-cok-satan-oyunlar-15778359_amp.jpg,2023-04-28 11:27:00+03:00,haberler.com
Steam masaüstü uygulaması yenilendi,"Popüler dijital video oyun dağıtımcısı Steam, geçtiğimiz aylarda yıllardır düzenleme getirmediği mobil uygulamasına yeni tasarım güncellemesi getirmesinin ardından bu kez de masaüstü uygulaması için yeni özellik ve iyileştirme güncellemesi getirdi.",https://www.haberler.com/gamegar/steam-masaustu-uygulamasi-yenilendi-15832671-haberi/,https://foto.haberler.com/haber/2023/04/28/steam-masaustu-uygulamasi-yenilendi-15832671_9991_amp.jpg,2023-04-28 08:12:00+03:00,haberler.com
Epic Games'in bu haftaki ücretsiz oyunu açıklandı! Toplam değeri 333 TL,"Epic Games her hafta olduğu gibi kullanıcılarına ücretsiz oyunlar vermeye devam ediyor. Epic Games bu hafta kullanıcılarına 333 TL değerinde ücretsiz oyun veriyor. Peki, Epic Games bu hafta hangi oyun ücretsiz? Detayları haberimizde...",https://www.haberler.com/gamegar/epic-games-in-bu-haftaki-ucretsiz-oyunu-aciklandi-15832650-haberi/,https://foto.haberler.com/haber/2023/04/28/epic-games-in-bu-haftaki-ucretsiz-oyunu-aciklandi-15832650_3652_amp.jpg,2023-04-28 07:40:00+03:00,haberler.com
PlayStation Plus Mayıs 2023 oyunları açıklandı! Toplam değeri 1258 TL,PlayStation Plus Mayıs 2023 oyunlarının geçtiğimiz günlerde sızdırılmasının ardından PlayStation Blog'da 2 Mayıs'tan itibaren eklenecek PlayStation Plus'ın Mayıs 2023 oyunları belli oldu. PlayStation Plus kullanıcılarına 1258 TL değerinde üç adet ücretsiz oyun verilecek.,https://www.haberler.com/gamegar/playstation-plus-mayis-2023-oyunlari-aciklandi-15827777-haberi/,https://foto.haberler.com/haber/2023/04/27/playstation-plus-mayis-2023-oyunlari-aciklandi-15827777_2599_amp.jpg,2023-04-27 09:11:00+03:00,haberler.com
Netflix Games kütüphanesine bir yeni oyun daha eklenecek,"Netflix, geçtiğimiz günlerde yayınlanan bir açıklamayla, Laya's Horizon adlı popüler mobil oyununun Netflix Games platformuna gelmeye hazırlandığını duyurdu. Alto's Adventure'ın geliştiricileri Laya's Horizon ile 2 Mayıs'ta Netflix Games'e geliyor.",https://www.haberler.com/gamegar/netflix-games-kutuphanesine-bir-yeni-oyun-daha-15827735-haberi/,https://foto.haberler.com/haber/2023/04/27/netflix-games-kutuphanesine-bir-yeni-oyun-daha-15827735_4041_amp.jpg,2023-04-27 08:41:00+03:00,haberler.com
Steam'de haftanın en çok satanları! 17 - 23 Nisan 2023,"Steam'in 17 - 23 Nisan 2023 tarihleri arasında en çok satan oyunları açıklandı. En çok satanın açıklandığı listede ilk 10'da oyunlar ve donanımlar yer aldı. Kimi oyunlar yükselirken, kimi oyunlar listede geriledi. Bazıları ise listede sırasını korumaya devam etti. İşte Steam'de haftanın en çok satan 10 oyunu.",https://www.haberler.com/gamegar/steam-de-haftanin-en-cok-satanlari-17-23-nisan-15819663-haberi/,https://foto.haberler.com/haber/2023/04/25/steam-de-haftanin-en-cok-satanlari-17-23-nisan-15819663_8448_amp.jpg,2023-04-25 11:21:00+03:00,haberler.com
