,title,description,url,img_url,publishing_date,publisher
736,Vezirköprü'de Muhtarlar Toplantısı Gerçekleştirildi,"Samsun'un Vezirköprü ilçesinde kurum amirleri, muhtarlar ve muhtar adaylarının katıldığı toplantıda vatandaşların talep ve şikayetleri masaya yatırıldı. Toplantıda, Vezirköprü'de ve mahallelerinde yürütülen çalışmalar değerlendirildi ve vatandaşların talepleri görüşüldü.",https://www.haberler.com/yerel/vezirkopru-de-muhtarlar-toplantisi-gerceklestirildi-16993605-haberi/,https://foto.haberler.com/haber/2024/03/30/kaymakam-kaya-vatandasimiza-en-iyi-hizmeti-su-16993605_amp.jpg,2024-03-30T12:08:00+0300,haberler.com
737,Samsun'da İhracat İthalat Dengesi Değişti,"TÜİK verilerine göre Samsun'da Ocak-Şubat döneminde ihracat artarken ithalat azaldı. Şubat ayında Samsun'dan 103 milyon dolar ihracat, 114,1 milyon dolar ithalat gerçekleşti.",https://www.haberler.com/ekonomi/samsun-da-ihracat-ithalat-dengesi-degisti-16993604-haberi/,https://foto.haberler.com/haber/2024/03/30/samsun-da-ithalat-ihracati-gecti-16993604_amp.jpg,2024-03-30T12:08:00+0300,haberler.com
738,Hakkari'de Kütüphane Haftası etkinliği düzenlendi,"Hakkari'nin Çukurca ilçesinde Kütüphane Haftası dolayısıyla düzenlenen etkinlik, ilgi gördü. İlçe Halk Kütüphanesi tarafından Halk Eğitim Merkezinde gerçekleştirilen etkinlikte kitapların önemi anlatıldı ve şarkılar seslendirildi. Kaymakam Mert Kumcu, kurum amirleri ve vatandaşlar etkinliğe katıldı.",https://www.haberler.com/guncel/hakkari-de-kutuphane-haftasi-etkinligi-duzenlendi-16993597-haberi/,https://foto.haberler.com/haber/2024/03/30/hakkari-de-kutuphane-haftasi-etkinligi-duzenl-16993597_amp.jpg,2024-03-30T12:04:00+0300,haberler.com
739,"Diyanet İşleri Başkanlığı, asılsız haberlere karşı vatandaşların yanında olduğunu açıkladı","Diyanet İşleri Başkanlığı, bir gazetenin asılsız haberine yanıt vererek, vatandaşların her zaman yanında olma kararlılığını sürdüreceğini belirtti.",https://www.haberler.com/yerel/diyanet-isleri-baskanligi-asilsiz-haberlere-karsi-vatandaslarin-yaninda-oldugunu-acikladi-16993595-haberi/,https://foto.haberler.com/haber/2024/03/30/depremzedeye-makarna-haberine-diyanet-isleri-16993595_amp.jpg,2024-03-30T12:04:00+0300,haberler.com
740,İstanbul'da Seçim Hazırlıkları Tamamlandı,"31 Mart yerel seçimlere 1 gün kala İstanbul'da oylarını kullanılacağı okullara sandıklar kuruldu. Sınıflara paravan kurulurken, seçmenlerin oylarını kullanılacağı sandıklar ve oy kabinleri sınıflara yerleştirildi.",https://www.haberler.com/yerel/istanbul-da-secim-hazirliklari-tamamlandi-16993592-haberi/,https://foto.haberler.com/haber/2024/03/30/istanbul-da-sandiklar-siniflara-tasindi-16993592_amp.jpg,2024-03-30T12:03:00+0300,haberler.com
741,Depremin Vurduğu Hatay'da Afetzede Vatandaşlar İçin 96 Konteyner Seçim Alanı Kuruldu,31 Mart yerel seçimlerine kısa bir süre kala depremin vurduğu Hatay'da afetzede vatandaşlar için 96 konteyner seçim alanı kuruldu. Depremzede vatandaşlar konteynerlerde güvenle oy kullanabilecek.,https://www.haberler.com/yerel/depremin-vurdugu-hatay-da-afetzede-vatandaslar-icin-96-konteyner-secim-alani-kuruldu-16993591-haberi/,https://foto.haberler.com/haber/2024/03/30/enkaz-kentte-96-konteyner-secim-alani-kuruldu-16993591_amp.jpg,2024-03-30T12:02:00+0300,haberler.com
742,Muğla İl Karması Kadın Hokey Takımı Türkiye Şampiyonu,"Muğla İl Karması Kadın Hokey Takımı, Konya'da düzenlenen Intercity Hokey Türkiye Şampiyonası'nda İstanbul İl Karması takımını 3-2 yenerek şampiyonluğa ulaştı.",https://www.haberler.com/spor/mugla-il-karmasi-kadin-hokey-takimi-turkiye-sampiyonu-16993589-haberi/,https://foto.haberler.com/haber/2024/03/30/muglali-kadinlar-turkiye-sampiyonu-16993589_amp.jpg,2024-03-30T12:00:00+0300,haberler.com
743,ASELSAN Konya Mesleki ve Teknik Anadolu Lisesi'ne Bilgisayar Laboratuvarları ve Atölye Kazandırıldı,"ASELSAN Konya Mesleki ve Teknik Anadolu Lisesi, merkezi sınavla öğrenci alan yüzde 1'lik başarı dilimine sahip olup, iki modern bilgisayar laboratuvarı ve teknolojik cihazların yer aldığı atölye ile donatıldı. Okul, genç mühendis adaylarına yenilikçi çözümler üretebilme yeteneği kazandırmak için çeşitli proje ve uygulamalı eğitim programları sunuyor.",https://www.haberler.com/guncel/aselsan-konya-mesleki-ve-teknik-anadolu-lisesi-ne-bilgisayar-laboratuvarlari-ve-atolye-kazandirildi-16993585-haberi/,https://foto.haberler.com/haber/2024/03/30/savunma-sanayisinin-muhendis-adaylarina-tekno-16993585_amp.jpg,2024-03-30T11:58:00+0300,haberler.com
744,Nepal'de düzenlenen Shree Pachali Bhairav Khadga Siddhi Jatra Festivali başladı,Nepal'in başkenti Katmandu'da her 12 yılda bir gerçekleşen Shree Pachali Bhairav Khadga Siddhi Jatra Festivali başladı. Katılımcılar çeşitli tanrı kostümleriyle etkileyici maske dansları sergiliyor.,https://www.haberler.com/guncel/nepal-de-duzenlenen-shree-pachali-bhairav-khadga-siddhi-jatra-festivali-basladi-16993584-haberi/,https://foto.haberler.com/haber/2024/03/30/album-nepal-de-sokaklar-festival-nedeniyle-16993584_amp.jpg,2024-03-30T11:58:00+0300,haberler.com
745,Depremzede öğrenci Türkiye şampiyonu oldu,"Kilis Anadolu Lisesi 10. sınıf öğrencisi Sümeyra Dağlı, Samsun'da yapılan bilek güreşi şampiyonasında Türkiye şampiyonu oldu. Depremden etkilenen Dağlı, sol kolda birinci, sağ kolda ise ikinci oldu.",https://www.haberler.com/spor/depremzede-ogrenci-turkiye-sampiyonu-oldu-16993583-haberi/,https://foto.haberler.com/haber/2024/03/30/992-sporcunun-arasindan-turkiye-sampiyonu-old-16993583_amp.jpg,2024-03-30T11:57:00+0300,haberler.com
746,"Trakya Üniversitesi, Bulgaristan'daki iş birliklerini sürdürüyor","Trakya Üniversitesi Rektörü Prof. Dr. Erhan Tabakoğlu ve beraberindeki heyet, Kırcaali Valisi Nikola Çanev'i ziyaret etti. Tabakoğlu, ziyarette Bulgaristan'daki üniversitelerle olan iş birliklerinin devam ettiğini belirtti. Heyet ayrıca Kırcaali Belediyesi ile iş birliği anlaşması imzaladı ve Kırcaalili öğrencilerle buluştu.",https://www.haberler.com/guncel/trakya-universitesi-bulgaristan-daki-is-birliklerini-surduruyor-16993580-haberi/,https://foto.haberler.com/haber/2024/03/30/edirne-den-kisa-kisa-16993580_amp.jpg,2024-03-30T11:56:00+0300,haberler.com
747,Eskişehir'de AB Onaylı Süt Çiftliği Sertifikası Verildi,"Eskişehir İl Tarım ve Orman Müdürlüğü, Tepebaşı ilçesinde bulunan bir süt çiftliğine AB Onaylı Süt Çiftliği Sertifikası teslim etti. İşletme, AB standartlarında süt ürettiği belirlenerek sertifikayı almaya hak kazandı.",https://www.haberler.com/yerel/eskisehir-de-ab-onayli-sut-ciftligi-sertifikasi-verildi-16993573-haberi/,https://foto.haberler.com/haber/2024/03/30/tepebasi-nda-bir-ciftlik-avrupa-birligi-onayl-16993573_amp.jpg,2024-03-30T11:53:00+0300,haberler.com
748,Bursa'da tehlikeli taşımacılık kamerada,Bursa'da kamyonetinin arkasına koyduğu demirleri güvenlik tedbirlerini almadan taşıyan şoför kameraya yansıdı. Başka bir olayda ise konserve kapağı taşıyan kamyonetin arkasında giden kişi canını hiçe saydı.,https://www.haberler.com/3-sayfa/bursa-da-tehlikeli-tasimacilik-kamerada-16993571-haberi/,https://foto.haberler.com/haber/2024/03/30/bursa-da-tehlikeli-tasimacilik-kamerada-16993571_amp.jpg,2024-03-30T11:53:00+0300,haberler.com
749,Sivas İmranlı'da Uyuşturucu Operasyonu: 2 Bin 147 Hap Ele Geçirildi,"Sivas'ın İmranlı ilçesinde düzenlenen operasyonda 2 bin 147 uyuşturucu hap ele geçirildi, gözaltına alınan 2 şüpheli tutuklandı.",https://www.haberler.com/guncel/sivas-imranli-da-uyusturucu-operasyonu-2-bin-147-hap-ele-gecirildi-16993570-haberi/,https://foto.haberler.com/haber/2024/03/30/sivas-ta-uyusturucu-operasyonunda-2-zanli-16993570_amp.jpg,2024-03-30T11:52:00+0300,haberler.com
750,"Anka, CHP Genel Merkezi'nde Kurulan Dijital Seçim Takip Merkezini Görüntüledi. CHP'li Okakın: ""Eksiksiz Bir Çalışma İnşa Ettik, Hiçbir Şüphemiz Yok.""","ANKA Haber Ajansı, CHP'nin sandık sonuçlarını ve oy kullanma günü yaşanacak tüm gelişmeleri takip edeceği dijital seçim takip ve çağrı merkezini görüntüledi. Okullardan, ilçe ve il seçim merkezlerinden Ankara'ya akacak on binlerce sandık sonucunu bir araya getirecek dijital takip merkezi dördüncü ve son tatbikatını ANKA Haber Ajansı'na açtı. Seçim gecesi hukuki itirazlar ya da parti örgütünün yaşayabileceği her türlü soruna karşı görev başında olacak çağrı merkezi için de CHP'nin Parti Meclisi toplantılarının yapıldığı salon organize edildi. Hem dijital takip üssü hem de seçim günü için yapılan tüm hazırlıklar hakkında ANKA Haber Ajansı'na bilgi veren CHP Genel Başkan Yardımcısı Pınar Uzun Okakın 31 Mart seçimleri için hiçbir eksikleri kalmadığını vurguladı. Çok deneyimli ve bu alada rüştünü ispat etmiş bir ekiple çalıştıklarını anlatan Okakın, ""Sektörel deneyimi çok yüksek, seçim güvenliğinin dijital altyapısında oluşabilecek tüm alternatif tabloya hazırlık deneyimi de bulunan kimselerle, güçlü bir kadroyla büyük, özverili, eksiksiz bir çalışmayı hep birlikte inşa ettik. Bu konuda hiçbir şüphemiz yok” dedi.",https://www.haberler.com/guncel/anka-chp-genel-merkezi-nde-kurulan-dijital-secim-16993568-haberi/,https://foto.haberler.com/haber/2024/03/30/anka-chp-genel-merkezi-nde-kurulan-dijital-se-16993568_amp.jpg,2024-03-30T11:51:00+0300,haberler.com
751,Meksika'da düzenlenen 2024 Orman Festivali'nde sanatçılar yarasa kostümleriyle performans sergiledi,Meksika'nın başkenti Meksiko'daki Chapultepec Ormanı'nda düzenlenen 2024 Orman Festivali sırasında sanatçılar yarasa kostümleri içinde performans sergiledi.,https://www.haberler.com/guncel/meksika-da-duzenlenen-2024-orman-festivali-nde-sanatcilar-yarasa-kostumleriyle-performans-sergiledi-16993562-haberi/,https://foto.haberler.com/haber/2024/03/30/album-meksika-da-orman-festivali-renkli-16993562_amp.jpg,2024-03-30T11:48:00+0300,haberler.com
752,Prag'da düzenlenen Paskalya festivalinde renkli süsler sergilendi,"Çek Cumhuriyeti'nin başkenti Prag'da düzenlenen Paskalya festivalinde, renkli ve çeşitli süsler sergilendi. Festival, 29 Mart 2024 tarihinde gerçekleşti ve birçok ziyaretçi tarafından ilgiyle karşılandı.",https://www.haberler.com/guncel/cek-cumhuriyeti-nde-paskalya-coskusu-16993561-haberi/,https://www.haberler.com/mstatic/haberlercom_haberi.jpg,2024-03-30T11:48:00+0300,haberler.com
753,"Maduro, ABD'nin Venezuela'ya yönelik tehditlerine karşı uyarıda bulundu","Venezuela Devlet Başkanı Nicolas Maduro, ABD'nin yeni tehditlerine karşı uyarıda bulundu. Maduro, ABD'nin ülkeye yönelik yaptırım ve ekonomik saldırılarla sonlarını getirmekle tehdit ettiğini belirtti.",https://www.haberler.com/guncel/maduro-abd-nin-venezuela-ya-yonelik-tehditlerine-karsi-uyarida-bulundu-16993560-haberi/,https://www.haberler.com/mstatic/haberlercom_haberi.jpg,2024-03-30T11:48:00+0300,haberler.com
754,Cezayir'de Ramazan'da toplu iftar etkinlikleri düzenlendi,"CEZAYİR, 30 Mart (Xinhua) -- Cezayir'in şehir merkezinde Ramazan'da toplu iftar yapan insanlar, 29 Mart 2024. (Fotoğraf: Xinhua)",https://www.haberler.com/guncel/cezayir-de-toplu-iftar-heyecani-16993559-haberi/,https://www.haberler.com/mstatic/haberlercom_haberi.jpg,2024-03-30T11:48:00+0300,haberler.com
755,Fındık Bahçelerinin Rehabilitasyonu Projesiyle Verim ve Kalite Artıyor,Tarım ve Orman Bakanlığı tarafından desteklenen Fındık Bahçelerinin Rehabilitasyonu Projesi kapsamında Ordu'da yeni modern bahçeler kuruluyor. Proje sayesinde yaşlı ve verimsiz fındık bahçeleri sökülerek teraslar oluşturuluyor ve gençleştirme çalışmaları yapılıyor. Bu sayede fındık tarımında verim ve kalite artışı sağlanıyor.,https://www.haberler.com/ekonomi/findik-bahcelerinin-rehabilitasyonu-projesiyle-verim-ve-kalite-artiyor-16993556-haberi/,https://foto.haberler.com/haber/2024/03/30/findikta-modern-bahceler-urun-kalitesini-ve-16993556_amp.jpg,2024-03-30T11:46:00+0300,haberler.com
756,"Adıyaman'da hafif ticari araç şarampole devrildi, 7 kişi yaralandı","Adıyaman'ın Besni ilçesinde meydana gelen trafik kazasında, hafif ticari araç şarampole devrildi ve 7 kişi yaralandı. Kazada yaralananlar hastaneye kaldırıldı.",https://www.haberler.com/guncel/adiyaman-da-hafif-ticari-arac-sarampole-devrildi-7-kisi-yaralandi-16993555-haberi/,https://foto.haberler.com/haber/2024/03/30/adiyaman-da-hafif-ticari-aracin-devrilmesi-so-16993555_local.jpg,2024-03-30T11:46:00+0300,haberler.com
757,Portekizli Eurovision Şampiyonu Salvador Sobral İstanbul'da Konser Verdi,"Amar Pelos Dois şarkısıyla 2017'de Eurovision Şarkı Yarışması'nı kazanan Portekizli sanatçı Salvador Sobral, İstanbul'da ilk konserini verdi. Sobral, konserde Filistin'e destek çağrısı yaparken, Türk hayranlarının ilgisinden de memnun olduğunu belirtti.",https://www.haberler.com/guncel/portekizli-eurovision-sampiyonu-salvador-sobral-istanbul-da-konser-verdi-16993554-haberi/,https://foto.haberler.com/haber/2024/03/30/portekizli-sarkici-salvador-sobral-crr-de-kon-16993554_amp.jpg,2024-03-30T11:46:00+0300,haberler.com
758,Diyarbakır'da Sıfır Atık Projesiyle Doğa Korunuyor ve Ekonomiye Katkı Sağlanıyor,"Diyarbakır'da uygulanan ""Sıfır Atık"" projesi sayesinde doğa korunarak, ekonomiye katkı sağlandı.",https://www.haberler.com/guncel/diyarbakir-sifir-atik-dedi-7-yilda-78-bin-893-16993550-haberi/,https://foto.haberler.com/haber/2024/03/30/diyarbakir-sifir-atik-dedi-7-yilda-78-bin-893-16993550_amp.jpg,2024-03-30T11:44:00+0300,haberler.com
759,"Bilecik'te Kamyonun Kapağı Çarptı, Motosiklet Sürücüsü Yaralandı","Bilecik'te seyir halindeki kamyonun açılan kapağı, karşı yönden gelen motosiklet sürücüsüne çarptı. Yaralanan sürücü hastaneye kaldırıldı.",https://www.haberler.com/3-sayfa/bilecik-te-kamyonun-kapagi-carpti-motosiklet-surucusu-yaralandi-16993549-haberi/,https://foto.haberler.com/haber/2024/03/30/bilecik-te-akil-almaz-trafik-kazasi-16993549_amp.jpg,2024-03-30T11:44:00+0300,haberler.com
760,THY Euroleague'de Türk Takımları Galibiyetle Kapattı,"Fenerbahçe Beko evinde ALBA Berlin'i, A. Efes de deplasmanda Baskonia'yı mağlup etti. A. Efes Play-In bölgesine girdi. Fenerbahçe'de Nigel Hayes-Davis Euroleague tarihinde bir maçta en çok sayı atan basketbolcu oldu. Real Madrid liderliğini sürdürdü.",https://www.haberler.com/spor/thy-euroleague-de-turk-takimlari-galibiyetle-kapatti-16993548-haberi/,https://foto.haberler.com/haber/2024/03/30/thy-euroleague-de-32-haftanin-ardindan-16993548_amp.jpg,2024-03-30T11:44:00+0300,haberler.com
761,"Gaziantep Şehir Hastanesi'nde 7,5 Ayda 1 Milyon 100 Bin Hastaya Sağlık Hizmeti Verildi","Sağlık Bakanı Fahrettin Koca, Gaziantep Şehir Hastanesi'nin açılışından itibaren yaklaşık 7,5 aylık sürede 1 milyon 100 bin hastaya sağlık hizmeti verildiğini açıkladı. Hastanede 25 bin hastanın yatarak tedavi gördüğü, 300 binin üzerinde hastanın acil hizmetlerinden faydalandığı belirtildi.",https://www.haberler.com/guncel/gaziantep-sehir-hastanesi-nde-7-5-ayda-1-milyon-100-bin-hastaya-saglik-hizmeti-verildi-16993544-haberi/,https://foto.haberler.com/haber/2024/03/30/gaziantep-sehir-hastanesi-nde-1-milyon-100-bi-16993544_local.jpg,2024-03-30T11:42:00+0300,haberler.com
762,İSO Yeşil Gündem Sohbetleri'nde Türkiye'nin hidrojen ekonomisi rolü ele alındı,"İstanbul Sanayi Odası'nın (İSO) sürdürülebilirlik vizyonu çerçevesinde başlattığı İSO Yeşil Gündem Sohbetleri'nin 13'üncüsünde hidrojen ekonomisinde Türkiye'nin rolü ele alındı. Programda, hidrojenin enerji kaynağı olarak kullanımı, temiz enerji dönüşümü ve jeopolitik etkileri tartışıldı.",https://www.haberler.com/ekonomi/iso-yesil-gundem-sohbetleri-nde-turkiye-nin-hidrojen-ekonomisi-rolu-ele-alindi-16993543-haberi/,https://foto.haberler.com/haber/2024/03/30/hidrojen-pazari-ihracatta-yeni-kapilar-acacak-16993543_amp.jpg,2024-03-30T11:42:00+0300,haberler.com
763,Bolu'da çıkan yangın bitişiğindeki eve sıçradı,"Bolu'nun Mudurnu ilçesinde çıkan yangın, bitişiğinde bulunan eve de sıçradı. İtfaiye ekipleri tarafından söndürülen yangında şans eseri yaralanan olmadı.",https://www.haberler.com/3-sayfa/bolu-da-cikan-yangin-bitisigindeki-eve-sicradi-16993541-haberi/,https://foto.haberler.com/haber/2024/03/30/bolu-da-korkutan-yangin-alevler-yan-eve-sicra-16993541_amp.jpg,2024-03-30T11:42:00+0300,haberler.com
764,Brezilya'da eski Devlet Başkanı Bolsonaro'nun İsrail ziyareti talebi reddedildi,"Brezilya Yüksek Mahkemesi, eski Devlet Başkanı Jair Bolsonaro'nun İsrail'e yapacağı ziyaret için pasaportunun iade talebini reddetti. Mahkeme, soruşturmanın henüz tamamlanmadığını belirterek talebi reddetti.",https://www.haberler.com/guncel/brezilya-da-eski-devlet-baskani-bolsonaro-nun-israil-ziyareti-talebi-reddedildi-16993535-haberi/,https://www.haberler.com/mstatic/haberlercom_haberi.jpg,2024-03-30T11:40:00+0300,haberler.com
765,Koruma Altındaki Kızıl Şahinler Kars'ta Karla Kaplı Arazide Avlanırken Görüntülendi,"Kars'ta kar yağışıyla beyaza bürünen doğada yiyecek bulmakta zorlanan koruma altındaki kızıl şahinler, karla kaplı arazide avlanırken görüntülendi. Sarp kayalıkların ve derin kanyonların bulunduğu bölge, birçok yırtıcı kuş türüne ev sahipliği yapıyor.",https://www.haberler.com/guncel/koruma-altindaki-kizil-sahinler-kars-ta-karla-kapli-arazide-avlanirken-goruntulendi-16993534-haberi/,https://foto.haberler.com/haber/2024/03/30/koruma-altindaki-kizil-sahin-kars-ta-avlanirk-16993534_amp.jpg,2024-03-30T11:40:00+0300,haberler.com
766,Eskişehir'de KYK Yurdunda İftar Programı Düzenlendi,"Eskişehir'de Sivrihisar İlçe Müftülüğü, Sivrihisar Kredi Yurtlar Kurumu Erkek Öğrenci Yurdu'nda kalan öğrenciler için iftar programı düzenledi. Programa Müftülük yetkilileri ve öğrenciler katıldı.",https://www.haberler.com/yerel/eskisehir-de-kyk-yurdunda-iftar-programi-duzenlendi-16993533-haberi/,https://foto.haberler.com/haber/2024/03/30/sivrihisar-ilce-muftulugu-nden-sivrihisar-kyk-16993533_amp.jpg,2024-03-30T11:40:00+0300,haberler.com
767,Tiyatro Oyununda Evlenme Teklifi,"Sahne Tozu Tiyatrosu'nda sahnelenen 'Yedi Kocalı Hürmüz' adlı oyununun bitiminde bir seyirci sahneye çıkarak kız arkadaşına evlenme teklifi yaptı. Olay, izleyiciler tarafından cep telefonu kameralarıyla kaydedildi.",https://www.haberler.com/yerel/tiyatro-oyununda-evlenme-teklifi-16993532-haberi/,https://foto.haberler.com/haber/2024/03/30/tiyatro-oyununda-ilginc-anlar-sahneye-kosup-16993532_amp.jpg,2024-03-30T11:40:00+0300,haberler.com
768,"Niğde Valisi, uyuşturucu operasyonunda yaralanan polis memurlarını ödüllendirdi","Niğde Valisi Cahit Çelik, uyuşturucu operasyonunda yaralanmalarına rağmen suçluları yakalayan 2 polis memurunu başarı belgesi ile ödüllendirdi. Vali Çelik, polis memurlarını makamında kabul ederek, operasyon sırasında görevlerini yerine getirdikleri için başarı belgesi takdim etti.",https://www.haberler.com/yerel/nigde-valisi-uyusturucu-operasyonunda-yaralanan-polis-memurlarini-odullendirdi-16993531-haberi/,https://foto.haberler.com/haber/2024/03/30/nigde-de-uyusturucu-operasyonunda-yaralanan-16993531_amp.jpg,2024-03-30T11:40:00+0300,haberler.com
769,Adanalı kebapçıdan Y. Adana Demirspor ve Hatayspor'a sürpriz ikram,"Adanalı kebapçı, Y. Adana Demirspor ve Hatayspor arasında oynanan hazırlık maçı sonrası 31 metrelik boru kebabı yapıp iki kulübe de ikram etti.",https://www.haberler.com/spor/adanali-kebapcidan-y-adana-demirspor-ve-hatayspor-a-surpriz-ikram-16993530-haberi/,https://foto.haberler.com/haber/2024/03/30/y-adana-demirspor-hatayspor-macinin-ardindan-16993530_amp.jpg,2024-03-30T11:40:00+0300,haberler.com
770,Gaziantep'te Şahinbey Millet Camisi'nde çocuklar spor aktiviteleriyle eğlenceli vakit geçiriyor,"Gaziantep'teki Şahinbey Millet Camisi ve Külliyesi'nde çocuklar için oluşturulan aktivite alanında spor oyunları oynayarak eğlenceli vakit geçiriyorlar. Masa tenisi, langırt, satranç ve masa hokeyi gibi oyunlarla çocuklar hem eğleniyor hem de yeni oyunları öğrenme şansı elde ediyorlar.",https://www.haberler.com/guncel/gaziantep-te-sahinbey-millet-camisi-nde-cocuklar-spor-aktiviteleriyle-eglenceli-vakit-geciriyor-16993524-haberi/,https://foto.haberler.com/haber/2024/03/30/millet-camisindeki-aktivite-alanlari-cocuklar-16993524_amp.jpg,2024-03-30T11:38:00+0300,haberler.com
771,"Tekirdağlı kadın, eşinin makro fotoğrafladığı canlıları deri ürünlerin üzerine resmediyor","Tekirdağ'da yaşayan Serap Özsoy, eşinin makro fotoğrafladığı canlıları, tasarladığı deri ürünlerin üzerine resmediyor. İl Kültür ve Turizm Müdürlüğünce Yahya Kemal Beyatlı Kültür Merkezinde açılan deri işleme kursuna katılan Özsoy, çalışmalarını 'Küçük hayatlar' adlı sergide beğeniye sunacak.",https://www.haberler.com/guncel/tekirdagli-kadin-esinin-makro-fotografladigi-canlilari-deri-urunlerin-uzerine-resmediyor-16993523-haberi/,https://foto.haberler.com/haber/2024/03/30/esinin-makro-fotografladigi-canlilari-deri-uz-16993523_amp.jpg,2024-03-30T11:38:00+0300,haberler.com
772,BŞEÜ TÖMER öğrencileri iftarda buluştu,"Bilecik Şeyh Edebali Üniversitesi (BŞEÜ) Türkçe Öğretimi Uygulama ve Araştırma Merkezi (TÖMER) öğrencileri iftarda bir araya geldi. Rektör Prof. Dr. Şükrü Beydemir'in de katıldığı etkinlikte, öğrencilere yöresel yemekler ikram edildi.",https://www.haberler.com/guncel/bseu-tomer-ogrencileri-iftarda-bulustu-16993516-haberi/,https://foto.haberler.com/haber/2024/03/30/bilecik-te-tomer-ogrencileri-iftarda-bulustu-16993516_amp.jpg,2024-03-30T11:36:00+0300,haberler.com
773,Diyarbakır'da Arı Ölümleri Artıyor,Küresel iklim değişikliği ve bilinçsiz tarımsal ilaçlamalar nedeniyle Diyarbakır'da kış uykusuna yatmayan arıların yüzde 30'u telef oldu.,https://www.haberler.com/ekonomi/diyarbakir-da-ari-olumleri-artiyor-16993512-haberi/,https://foto.haberler.com/haber/2024/03/30/diyarbakir-da-kis-uykusuna-yatmayan-arilarin-16993512_amp.jpg,2024-03-30T11:35:00+0300,haberler.com
774,Suluova'da İsrail'in Gazze'ye yönelik saldırıları protesto edildi,"Suluova Hacı Mustafa Camisi önünde toplanan Suluova İHH ve İlim Yayma Cemiyeti Şubesi üyeleri, İsrail'in Gazze'ye yönelik saldırılarını kınayan pankartlar açtı. Suluova İHH Temsilcisi Ali Karakuzu, İsrail'in saldırılarında 32 bin 142 kişinin şehit olduğunu belirterek, eylemlere devam edeceklerini vurguladı.",https://www.haberler.com/guncel/israil-in-gazze-ye-yonelik-saldirilari-suluova-da-16993511-haberi/,https://foto.haberler.com/haber/2024/03/30/israil-in-gazze-ye-yonelik-saldirilari-suluov-16993511_amp.jpg,2024-03-30T11:34:00+0300,haberler.com
775,Ukrayna Devlet Başkanı Zelenskiy: ABD yardımları olmazsa geri çekilmek zorunda kalırız,"Ukrayna Devlet Başkanı Zelenskiy, ABD yardımlarının engellenmesi durumunda Ukrayna güçlerinin geri çekilmek zorunda kalacağını belirtti. Zelenskiy, hava savunma sistemleri ve füzelerin olmamasının küçük adımlarla geri çekilmeyi gerektireceğini söyledi.",https://www.haberler.com/politika/ukrayna-devlet-baskani-zelenskiy-abd-yardimlari-olmazsa-geri-cekilmek-zorunda-kaliriz-16993509-haberi/,https://www.haberler.com/mstatic/haberlercom_haberi.jpg,2024-03-30T11:34:00+0300,haberler.com
776,Eyüpsultan'da 2 Katlı Binada Çıkan Yangın Cep Telefonu Kamerasıyla Kaydedildi,Eyüpsultan'da çıkan yangında alevler kısa sürede yayıldı. İtfaiye ekipleri müdahale ederek yangını söndürdü. Yangının çıkış sebebi araştırılıyor.,https://www.haberler.com/3-sayfa/eyupsultan-da-2-katli-binada-cikan-yangin-cep-telefonu-kamerasiyla-kaydedildi-16993507-haberi/,https://foto.haberler.com/haber/2024/03/30/eyupsultan-da-2-katli-bina-alevlere-teslim-ol-16993507_amp.jpg,2024-03-30T11:34:00+0300,haberler.com
777,Fırat Üniversitesi Öğrencileri Kovancılar İlkokulu Öğrencilerine Oyuncak Dağıttı,"Fırat Üniversitesi öğrencileri tarafından düzenlenen etkinlikte, Kovancılar ilçesindeki Hacı Ahmet Özbağı İlkokulu öğrencilerine oyuncak dağıtıldı. Öğrenciler, Bir Dünya Oyuncak Topluluğu ile birlikte eğlenceli vakit geçirdi. Etkinlik sonrası yapılan röportajda ilkokul öğrencisinin espri dolu cümleleri güldürdü.",https://www.haberler.com/yerel/firat-universitesi-ogrencileri-kovancilar-ilkokulu-ogrencilerine-oyuncak-dagitti-16993504-haberi/,https://foto.haberler.com/haber/2024/03/30/ilkokul-ogrencisinin-milli-egitim-bakanindan-16993504_amp.jpg,2024-03-30T11:33:00+0300,haberler.com
778,İsrail Güçleri Tubas'ta Baskın Düzenledi: 2 Filistinli Yaralandı,"İsrail güçleri, işgal altındaki Batı Şeria'nın Tubas kentine düzenlediği baskında, 2 Filistinliyi yaraladı. Olaylar, İsrail askerlerinin buldozer eşliğinde gerçekleştirdiği baskın sonucunda çıktı. Yaralanan Filistinliler, Tubas Türk Hastanesine kaldırıldı. Görgü tanıkları, olayların askerler kentten çekilene kadar devam ettiğini aktardı.",https://www.haberler.com/guncel/israil-gucleri-tubas-ta-baskin-duzenledi-2-filistinli-yaralandi-16993501-haberi/,https://www.haberler.com/mstatic/haberlercom_haberi.jpg,2024-03-30T11:32:00+0300,haberler.com
