title,description,url,img_url,publishing_date,publisher
Bodrum'a 9 günlük bayram tatili için yoğun ilgi,"Muğla'nın Bodrum ilçesinde turizm sezonu 9 günlük Ramazan Bayramı tatili ile başladı. Bodrum'a gelen uçakların dolu geldiği öğrenildi. Türkiye Seyahat Acentaları Birliği (TÜRSAB) Bodrum Yöre Temsil Kurulu Başkanı Mustafa Demir, yerli turistlerin Bodrum'un doğal güzelliklerini keşfetmek için fırsat bulduklarını belirtti.",https://www.haberler.com/yerel/bodrum-a-9-gunluk-bayram-tatili-icin-yogun-ilgi-17216948-haberi/,https://foto.haberler.com/haber/2024/04/06/bodrum-bayramda-yogun-ilgi-goruyor-17216948_amp.jpg,2024-04-06 20:18:00+03:00,haberler.com
Tayvan'ın deprem için teknik yardım kabul ettiği tek yabancı ekip Türkler oldu,"Tayvan'da meydana gelen 7,4 büyüklüğündeki depremin ardından 7 kişilik uzman Türk arama kurtarma ekibi Tayvan'ın başkenti Taipei'ye geldi. Tayvan İçişleri Bakanı Lin Yu Chang, ""Sadece Türkiye'den gelen arama ekibinin yardımını kabul edeceğiz. Mevcut drone teknolojimiz yetersiz kalıyor"" ifadelerini kullandı.",https://www.haberler.com/3-sayfa/turk-arama-kurtarma-ekibi-tayvan-a-geldi-17216703-haberi/,https://foto.haberler.com/haber/2024/04/06/tayvan-in-deprem-icin-teknik-yardim-kabul-ettigi-17216703_5581_amp.jpg,2024-04-06 19:37:00+03:00,haberler.com
"CHP'de Esenyurt krizi! Belediye Başkanı seçilen Ahmet Özer, eski yönetimi eleştirdi: Boş kasa ile devraldık","Yerel seçimde CHP'den Esenyurt Belediye Başkanlığı'na seçilen Ahmet Özer göreve başladıktan sonra sosyal medya hesabından yaptığı açıklamayla eski yönetime tepki gösterdi. Özer, belediyeyi boş bir kasa ile aldıklarını ifade ederek, ""Eski belediye başkanı tarafından halkçı belediyecilik anlayışımıza aykırı bir şekilde, hızla ihtiyaç dışı işe alımlar başlatılmıştır. Biz 'kimsenin ekmeği ile oynamayacağız' sözümüzün arkasındayız. Ancak bu kasıtlı durum kesinlikle bu kapsam içinde değildir"" dedi.",https://www.haberler.com/politika/esenyurt-un-yeni-belediye-baskanindan-eski-17216710-haberi/,https://foto.haberler.com/haber/2024/04/06/esenyurt-un-yeni-belediye-baskanindan-eski-17216710_7002_amp.jpg,2024-04-06 18:44:00+03:00,haberler.com
"Kanepenin altında 6 yavru kedi, kafaları ve patileri kesilmiş halde bulundu","Ankara'da 6 yavru kedi, kafaları ve patileri kesilmiş halde ölü bulundu. Olayla ilgili soruşturma başlatıldı.",https://www.haberler.com/3-sayfa/ankara-da-kedi-katliami-6-yavru-kedinin-cesedi-bulundu-17216547-haberi/,https://foto.haberler.com/haber/2024/04/06/6-yavru-kedi-kesilmis-halde-bulundu-polis-17216547_5769_amp.jpg,2024-04-06 18:34:00+03:00,haberler.com
Ramazan Bayramı tatili için Edremit Körfezi'nde yoğunluk,"Bayram tatili süresinin uzun olması nedeniyle Edremit Körfezi'ne gelen tatilciler, kara yollarında yoğunluk oluşturdu. İstanbul ve Bursa gibi büyükşehirlerden gelen ziyaretçiler, Akçay ve Güre kavşaklarında uzun kuyruklar oluşturdu. Polis ve jandarma ekipleri trafiği düzenlemek için sinyalizasyonu devre dışı bıraktı.",https://www.haberler.com/ekonomi/ramazan-bayrami-tatili-icin-edremit-korfezi-nde-yogunluk-17216783-haberi/,https://foto.haberler.com/haber/2024/04/06/edremit-korfezi-nde-bayram-tatili-yogunlugu-17216783_amp.jpg,2024-04-06 18:30:00+03:00,haberler.com
İzmir'de 2023 yılında 185 bin kişiye kanser taraması yapıldı,"İzmir İl Sağlık Müdürlüğü Halk Sağlığı Hizmetleri Başkanlığı Kanser Birim Sorumlusu Dr. Ümit Altıntığ, İzmir'de 2023 yılında 185 bin kişiye kanser taraması yapıldığını, 220 hastanın tanı aldığını, bunların yüzde 90'ının erken evre olduğunu söyledi. Altıntığ, kanserin Türkiye'de ve dünya genelinde en önemli halk sağlığı sorunlarından biri olarak kabul edildiğini belirtti.",https://www.haberler.com/saglik/izmir-de-2023-yilinda-185-bin-kisiye-kanser-taramasi-yapildi-17216739-haberi/,https://foto.haberler.com/haber/2024/04/06/izmir-de-2023-yilinda-185-bin-kisiye-kanser-17216739_amp.jpg,2024-04-06 18:10:00+03:00,haberler.com
"3 kişiyi öldürüp yakan şüpheli, katlettiği kadının alyansını satmış","Mersin'de anne ve oğlu evde, baba ise evine 4 kilometre mesafede aracında yanarak ölmüş halde bulunmuştu. Cinayete kurban giden aileyle ilgili yeni bir gelişme yaşandı. Şüphelinin, öldürdüğü kadının alyansını bir kuyumcuya satarken güvenlik kameralarına yakalandığı görüldü. Öte yandan süphelinin cinayetleri ailenin yaklaşık 800 bin TL'lik ziynet eşyasını çalmak için gerçekleştirdiği öğrenildi.",https://www.haberler.com/3-sayfa/mersin-de-yanarak-olen-ailenin-cinayeti-supheli-adliyeye-sevk-edildi-17216112-haberi/,https://foto.haberler.com/haber/2024/04/06/3-kisiyi-oldurup-yakan-supheli-katlettigi-17216112_5470_amp.jpg,2024-04-06 18:08:00+03:00,haberler.com
"Alman polisi, üniforma tedarik sorununu pantolonlarını çıkararak protesto etti","Alman polisi, üniforma sıkıntısına dikkat çekmek için pantolon giymeyerek sokakta gezdiği bir video yayınladı. O görüntüler sosyal medyada çok konuşulmaya başlandı.",https://www.haberler.com/dunya/alman-polisi-uniforma-tedarik-sorununu-17216607-haberi/,https://foto.haberler.com/haber/2024/04/06/alman-polisi-uniforma-tedarik-sorununu-17216607_2716_amp.jpg,2024-04-06 17:22:00+03:00,haberler.com
Anadolu Otoyolu Sakarya geçişinde 9 araçlı zincirleme trafik kazası,"9 günlük bayram tatilinin başlamasıyla birlikte vatandaşlar yollara düşerken, yoğunluğun yaşandığı Anadolu Otoyolu Sakarya geçişinde 9 araç birbirlerine girdi. Zincirleme trafik kazasında 2 kişi yaralandı. Kazadan en dikkat çekici görüntü ise bir cipin arkadan çarptığı otomobilin, cipin üzerine çıkması oldu.",https://www.haberler.com/3-sayfa/anadolu-otoyolu-sakarya-gecisinde-9-aracli-zincirleme-trafik-kazasi-17216365-haberi/,https://foto.haberler.com/haber/2024/04/06/otoyolda-9-aracli-zincirleme-kazada-ilginc-go-17216365_amp.jpg,2024-04-06 17:08:00+03:00,haberler.com
Gazipaşa'da Ramazan Bayramı öncesi denetim yapıldı,"Antalya'nın Gazipaşa ilçesinde Tarım ve Orman Müdürlüğü ekipleri tarafından, Ramazan Bayramı öncesinde toplu tüketim işletmeleri, unlu mamuller, tatlıcılar ve pastanelere yönelik denetim yapıldı.",https://www.haberler.com/yerel/gazipasa-da-ramazan-bayrami-oncesi-denetim-yapildi-17216559-haberi/,https://foto.haberler.com/haber/2024/04/06/gazipasa-da-bayram-oncesi-gida-denetimi-yapil-17216559_amp.jpg,2024-04-06 17:06:00+03:00,haberler.com
"Şanlıurfa'da otogarda çıkan silahlı kavgada ölü sayısı 2'ye yükseldi, 5 şüpheli gözaltında","Şanlıurfa'da şehirlerarası otobüs terminalinde, bilet gişesine gelen bir grup ile çalışanlar arasında alacak verecek meselesi yüzünden kavga çıktı. Silah ve bıçak kullanılan kavgada ölü sayısı 2'ye yükseldi. 5 şüpheli gözaltına alındı.",https://www.haberler.com/3-sayfa/sanliurfa-da-otobus-terminalinde-cikan-silahli-kavgada-olu-sayisi-2-ye-yukseldi-5-supheli-gozaltina-17215945-haberi/,https://foto.haberler.com/haber/2024/04/06/sanliurfa-da-otogarda-cikan-silahli-kavgada-olu-17215945_4432_amp.jpg,2024-04-06 16:54:00+03:00,haberler.com
"YSK, Van kararının gerekçesini açıkladı: Diyarbakır Ağır Ceza Mahkemesi'nin son kararı yok hükmündedir","Yüksek Seçim Kurulu'ndan Van kararının gerekçesine ilişkin yapılan açıklamada, ""Diyarbakır Ağır Ceza Mahkemesi'nin son kararı yok hükmündedir. Abdullah Zeydan seçilme yeterliliği taşımaktadır"" ifadelerine yer verildi.",https://www.haberler.com/guncel/ysk-van-kararinin-gerekcesini-acikladi-17216399-haberi/,https://foto.haberler.com/haber/2024/04/06/ysk-van-kararinin-gerekcesini-acikladi-17216399_8419_amp.jpg,2024-04-06 16:40:00+03:00,haberler.com
"Rusya'da baraj patlaması! 2 bin 400 ev sular altında, 11 bin kişi mahsur",Rusya'nın Orenburg bölgesindeki Orsk şehrinde bir barajın patlaması sonucu 2 bin 400'den fazla ev sular altında kaldı. Sel nedeniyle yaklaşık 11 bin kişi mahsur kaldı ve tahliye çalışmaları devam ediyor.,https://www.haberler.com/guncel/rusya-da-baraj-patlamasi-2-bin-400-ev-sular-altinda-17215747-haberi/,https://foto.haberler.com/haber/2024/04/06/rusya-da-baraj-patlamasi-2-bin-400-ev-sular-17215747_9442_amp.jpg,2024-04-06 16:10:00+03:00,haberler.com
Meghan Markle çiçekli elbisesiyle dikkat çekti! Kate Middleton'a gizli mesaj mı yolladı?,"Los Angeles'taki bir çocuk hastanesini ziyarete giden Sussex Düşesi Meghan Markle, 112 bin TL değerindeki çiçekli kıyafetiyle dikkatleri üzerine çekti. Kıyafeti yorumlayan moda uzmanları, Markle'nın çiçek desenli elbisesiyle kanserle mücadele eden eltisi Kate Middleton'a zeytin dalı uzatma mesajı olduğunu söyledi.",https://www.haberler.com/magazin/meghan-markle-2-776-lik-cicekli-elbise-ile-kate-17216287-haberi/,https://foto.haberler.com/haber/2024/04/06/meghan-markle-nin-cicekli-elbisesi-dikkat-cekti-17216287_6922_amp.jpg,2024-04-06 16:10:00+03:00,haberler.com
İnegöl'de evinde tadilat yaparken elini kaptıran adam acil servise getirildi,"Bursa'nın İnegöl ilçesinde bir adam, evinde tadilat yaparken elini kaptırdığı spiral makinesiyle acil servise getirildi. Yaralı vatandaş tedavi altına alındı.",https://www.haberler.com/3-sayfa/inegol-de-evinde-tadilat-yaparken-elini-kaptiran-adam-acil-servise-getirildi-17216373-haberi/,https://foto.haberler.com/haber/2024/04/06/evinde-tadilat-yaparken-elini-spiral-makinesi-17216373_amp.jpg,2024-04-06 16:06:00+03:00,haberler.com
Sofía Vergara ve Joe Manganiello arasındaki boşanma anlaşması tamamlandı,"Ünlü çift Sofía Vergara ve Joe Manganiello, yedi yıllık evliliklerinin ardından boşanma anlaşmasını tamamladı. Çift, evlilikleriyle ilgili yazılı bir anlaşmaya vararak malvarlıklarını paylaşma kararı aldı.",https://www.haberler.com/magazin/sof-a-vergara-ve-joe-manganiello-bosanma-17216220-haberi/,https://foto.haberler.com/haber/2024/04/06/sof-a-vergara-ve-joe-manganiello-arasindaki-17216220_1528_amp.jpg,2024-04-06 15:53:00+03:00,haberler.com
Erzurum'da Sağlık Çalışanları ve Öğrenciler İsrail'e Karşı Sessiz Yürüyüşlerine Devam Ediyor,"Erzurum'da görev yapan sağlık çalışanları ile tıp fakültesi öğrencileri, İsrail'in Gazze'ye yönelik saldırılarını protesto etmek için sessiz yürüyüşlerini sürdürdü. Grup, Türk ve Filistin bayrakları ile İsrail aleyhine yazıların yer aldığı dövizler ve pankartlarla Yakutiye Medresesi'ne yürüdü. Protesto eylemine çocuklar da katıldı.",https://www.haberler.com/guncel/erzurum-da-saglik-calisanlari-ve-ogrenciler-israil-e-karsi-sessiz-yuruyuslerine-devam-ediyor-17216294-haberi/,https://foto.haberler.com/haber/2024/04/06/erzurum-da-saglikcilar-gazze-icin-sessiz-17216294_amp.jpg,2024-04-06 15:44:00+03:00,haberler.com
Erzurum'da Sağlık Çalışanları İsrail'in Gazze'ye Saldırılarını Protesto Etti,"Erzurum'da sağlık çalışanları, İsrail'in Gazze'ye yönelik saldırılarını protesto etmek amacıyla sessiz yürüyüş düzenledi. Sağlık çalışanları, Filistin'de yaşanan saldırıların son bulmasını talep etti.",https://www.haberler.com/yerel/erzurum-da-saglik-calisanlari-israil-in-gazze-ye-saldirilarini-protesto-etti-17216286-haberi/,https://foto.haberler.com/haber/2024/04/06/hekimlerin-filistin-icin-sessiz-yuruyusleri-d-17216286_amp.jpg,2024-04-06 15:43:00+03:00,haberler.com
Samsun'da Sahte Makaron ve Kaçak Sigara Operasyonu,"Samsun'da yapılan operasyonda, devlet hastanesi çalışanı sağlık memuru dahil olmak üzere 2 kişi sahte makaron, doldurulmuş sigara ve kaçak elektronik sigara suçundan yakalandı.",https://www.haberler.com/3-sayfa/samsun-da-sahte-makaron-ve-kacak-sigara-operasyonu-17216281-haberi/,https://foto.haberler.com/haber/2024/04/06/saglik-memuruna-sigara-kacakciligindan-gozalt-17216281_amp.jpg,2024-04-06 15:42:00+03:00,haberler.com
1915 Çanakkale Köprüsü Tatilcilerin İşini Kolaylaştırdı,"Çanakkale'de 9 günlük Ramazan Bayramı nedeniyle Avrupa Yakasından Anadolu Yakasına geçmek isteyen tatilciler, Eceabat ve Kilitbahir feribot iskelelerinde araç kuyruğu oluşturmadı. Her yıl yaşanan araç kuyruğu, bu kez 1915 Çanakkale Köprüsü'nü kullananlar ve artırılan arabalı vapur seferleri nedeniyle oluşmadı. 1915 Çanakkale Köprüsü tatilciler için adeta can suyu oldu.",https://www.haberler.com/yerel/1915-canakkale-koprusu-tatilcilerin-isini-kolaylastirdi-17216251-haberi/,https://foto.haberler.com/haber/2024/04/06/feribot-kuyrugu-olusmadi-1915-canakkale-kopru-17216251_amp.jpg,2024-04-06 15:37:00+03:00,haberler.com
Ünlü oyuncu Ahmet Kural baba oldu,"Geçtiğimiz sene nikah masasına oturan Ahmet Kural ile Çağla Gizem Şahin çiftinin ilk bebekleri dün dünyaya geldi. Çift, oğullarına Kemal adını verdi.",https://www.haberler.com/magazin/unlu-oyuncu-ahmet-kural-baba-oldu-17216185-haberi/,https://foto.haberler.com/haber/2024/04/06/unlu-oyuncu-ahmet-kural-baba-oldu-17216186_8851_amp.jpg,2024-04-06 15:19:00+03:00,haberler.com
AK Parti ile CHP arasında Hatay krizi! İtiraz süreci devam ederken mazbata Mehmet Öntürk'e verildi,"CHP, Hatay'da İl Seçim Kurulu'nun Büyükşehir Belediye Başkanlığı mazbatasını AK Parti adayı Mehmet Öntürk'e verme kararına itiraz için YSK'ya başvurdu. YSK, süresinde devam eden itiraz varsa mazbatanın verilmemesi yönündeki kararını il seçim kuruluna gönderdi ancak süreç devam ederken Öntürk'e mazbata verildi. CHP Genel Başkan Yardımcısı Gül Çiftçi, ""YSK kararına rağmen Hatay'da il seçim kurulu tarafından verilen mazbata meşru değildir"" dedi.",https://www.haberler.com/politika/ak-parti-ile-chp-arasinda-hatay-krizi-ysk-dan-17216120-haberi/,https://foto.haberler.com/haber/2024/04/06/ak-parti-ile-chp-arasinda-hatay-krizi-ysk-dan-17216121_3826_amp.jpg,2024-04-06 15:17:00+03:00,haberler.com
Ramazan Bayramı Tatili Dolayısıyla Havalimanlarında Yoğunluk Yaşanıyor,Ramazan Bayramı tatili nedeniyle İstanbul Havalimanı'nda yoğunluk yaşanıyor. Dün 222 bin 72 yolcu ve bin 512 uçuş gerçekleştirildi. Bugün ise planlanan uçuş sayısı bin 448 olup 231 bin 38 yolcunun seyahat etmesi bekleniyor.,https://www.haberler.com/3-sayfa/ramazan-bayrami-tatili-dolayisiyla-havalimanlarinda-yogunluk-yasaniyor-17216076-haberi/,https://foto.haberler.com/haber/2024/04/06/istanbul-havalimani-nda-bayram-yogunlugu-deva-17216076_local.jpg,2024-04-06 14:45:00+03:00,haberler.com
"Yankesicilik yaparken yakalanınca ""Bomba var"" diye bağırdı, pazarda ortalık karıştı","İstanbul Bakırköy Halk Pazarı'nda yankesicilik yaptığı iddia edilen bir şüpheli, vatandaşlar tarafından yakalandı. Şüpheli, kurtulmak için ""Bomba var"" diye bağırınca panik oluştu.",https://www.haberler.com/guncel/istanbul-da-semt-pazarinda-yankesicilik-yapan-supheli-bomba-var-diye-bagirdi-17216036-haberi/,https://foto.haberler.com/haber/2024/04/06/yankesicilik-yaparken-yakalaninca-bomba-var-17216036_2760_amp.jpg,2024-04-06 14:36:00+03:00,haberler.com
"Aile içi tartışma faciaya dönüştü: Anne ve ağabey öldü, baba ve kız kardeş ağır yaralı","İstanbul'da bir evde çıkan tartışma sırasında silahına sarılan Yusuf Fırat, aile bireylerine kurşun yağdırıp kendisini de yaraladı. Olayda anne Sabiha ile ağabey Bilal Fırat öldü, baba Murat ile kardeş Zehra Fırat ise ağır yaralandı.",https://www.haberler.com/guncel/istanbul-sancaktepe-de-aile-ici-tartisma-kanli-bitti-17215854-haberi/,https://foto.haberler.com/haber/2024/04/06/aile-ici-tartisma-faciaya-donustu-anne-ve-agabey-17215854_5392_amp.jpg,2024-04-06 14:28:00+03:00,haberler.com
Antalya'da Bayram Tatili İçin Denetimler Sıklaştırıldı,Antalya'da Ramazan Bayramı tatilinin başlamasıyla iç pazar da hareketlendi. Kentin giriş çıkış noktalarındaki denetimler sıklaştırıldı. Tatilcilerin güvenli yolculuğu için havadan ve karadan denetimler yapılıyor.,https://www.haberler.com/yerel/antalya-da-bayram-tatili-icin-denetimler-siklastirildi-17215973-haberi/,https://foto.haberler.com/haber/2024/04/06/antalya-bayramdaki-trafik-yogunluguna-hazir-17215973_amp.jpg,2024-04-06 14:15:00+03:00,haberler.com
"Cumhurbaşkanı Erdoğan'dan 4 il için özel talimat: Buralara ayrı çalışın, sorumluları tespit edin","AK Parti ile MHP arasındaki ittifak görüşmelerinde ayrı adaylarla girme kararı alınan Kütahya, Kilis, Amasya ve Yozgat gibi illerde muhalefet partilerinin aradan sıyrılarak ipi göğüslemesi sonrası Cumhurbaşkanı Erdoğan'dan kurmaylarına ""Buralara ayrı çalışın, sorumluları tespit edin"" talimatını verdiği öğrenildi.",https://www.haberler.com/politika/cumhurbaskani-erdogan-dan-4-il-icin-ozel-talimat-17215890-haberi/,https://foto.haberler.com/haber/2024/04/06/cumhurbaskani-erdogan-dan-4-il-icin-ozel-talimat-17215891_1382_amp.jpg,2024-04-06 13:42:00+03:00,haberler.com
Ramazan Bayramı tatilini şehir dışında geçirmek isteyen vatandaşlar 15 Temmuz Demokrasi Otogarı'nda yoğunluk oluşturdu,9 gün olan bayram tatilini şehir dışında geçirmek isteyen ve otobüsleri tercih vatandaşlar 15 Temmuz Demokrasi Otogarı'nda yoğunluk oluşturdu. Otobüs firmalarının talebe yetişebilmek için ek seferler koyduğu öğrenildi. Vatandaşlar ise bayram nedeniyle bilet fiyatlarında yükseliş olduğunu ifade etti.,https://www.haberler.com/yerel/ramazan-bayrami-tatilini-sehir-disinda-gecirmek-isteyen-vatandaslar-15-temmuz-demokrasi-otogari-nda-17215883-haberi/,https://foto.haberler.com/haber/2024/04/06/15-temmuz-demokrasi-otogari-nda-bayram-yogunl-17215883_amp.jpg,2024-04-06 13:40:00+03:00,haberler.com
Muğla'da Ramazan Bayramı Tatili Trafik Yoğunluğu Başlattı,Türkiye'nin turizm merkezlerinden olan Muğla'da Ramazan Bayramı'nın 9 gün tatil edilmesinin ardından trafik yoğunluğu başladı. Muğla'da trafik ekipleri ile asayiş ekipleri kazaları önlemek amacı ile vatandaşlara uyarıda bulundular.,https://www.haberler.com/3-sayfa/mugla-da-ramazan-bayrami-tatili-trafik-yogunlugu-baslatti-17215860-haberi/,https://foto.haberler.com/haber/2024/04/06/bayram-oncesi-mugla-da-tatilci-yogunlugu-basl-17215860_amp.jpg,2024-04-06 13:34:00+03:00,haberler.com
Ailelerin evlenmelerine karşı çıktığı kuzenler yaşamlarına son verdi,"Şanlıurfa'da evlenmelerine izin verilmeyen 2 kuzen ölü bulundu. Kuzenlerin intihar kararı aldığı, Emir Altundağ'ın Helin Altundağ'ı tabancayla vurup ardından da kendi başına ateş ettiği tespit edildi.",https://www.haberler.com/3-sayfa/ailelerin-evlenmelerine-karsi-ciktigi-kuzenler-17215788-haberi/,https://foto.haberler.com/haber/2024/04/06/ailelerin-evlenmelerine-karsi-ciktigi-kuzenler-17215789_2261_amp.jpg,2024-04-06 13:17:00+03:00,haberler.com
18 yaşında mahallesine muhtar oldu,"Kütahya'nın Domaniç ilçesinin 2 bin nüfuslu Hisar Mahallesi'nde 18 yaşındaki Samet Koyun, genç yaşına rağmen seçim çalışmalarını başarıyla tamamlayıp aldığı 160 oyla yeni muhtar oldu. Görevi eski muhtar Cahit Demiröz'den devralan Koyun, mahalleye hizmet etmek için heyecanlı olduğunu ifade etti. Mahallede 3 dönem muhtarlık yapan Demiröz ise rozetini genç muhtara devretmekten gurur duyduğunu belirtti.",https://www.haberler.com/yasam/18-yasinda-mahallesine-muhtar-oldu-17215766-haberi/,https://foto.haberler.com/haber/2024/04/06/18-yasinda-mahallesine-muhtar-oldu-17215767_5304_amp.jpg,2024-04-06 13:11:00+03:00,haberler.com
Bebek tekstilinde kurutucu kullanımı ve çamaşır yıkamada dikkat edilmesi gerekenler,Gizem Kösoğlu bugünkü yazısı için tıklayın.,https://www.haberler.com/yazarlar/gizem-kosoglu/bebek-tekstilinde-kurutucu-kullanimi-ve-camasir-yikamada-dikkat-edilmesi-gerekenler-2870/,https://foto.haberler.com/genel/yazar-yazilari/2024/04/06/bebek-tekstilinde-kurutucu-kullanimi-ve-camasir-yikamada-dikkat-edilmesi-gerekenler-2870_3695_o.jpg,2024-04-06 13:05:00+03:00,haberler.com
"Meryem Uzerli, hayranıyla yediği yemekten 4 milyon TL kazandı","Güzel oyuncu Meryem Uzerli, Riyad'lı bir hayranının evine konuk olarak gitti. Hayranıyla sohbet ederek yemek yiyen oyuncu 4 milyon TL kazandı.",https://www.haberler.com/magazin/meryem-uzerli-hayraniyla-yedigi-yemekten-4-17215721-haberi/,https://foto.haberler.com/haber/2024/04/06/meryem-uzerli-hayraniyla-yedigi-yemekten-4-17215721_4933_amp.jpg,2024-04-06 13:02:00+03:00,haberler.com
İstanbul Havalimanı ve Sabiha Gökçen'de Bayram Yoğunluğu Devam Ediyor,"Ramazan Bayramı'nı da kapsayan 9 günlük tatili memleketlerinde, tatil bölgelerinde ve yurt dışında geçirmek isteyenler, İstanbul'daki havalimanlarında yoğunluk oluşturmaya devam ediyor.",https://www.haberler.com/guncel/istanbul-havalimani-ve-sabiha-gokcen-de-bayram-yogunlugu-devam-ediyor-17215717-haberi/,https://foto.haberler.com/haber/2024/04/06/istanbul-daki-havalimanlarinda-ramazan-bayram-17215717_local.jpg,2024-04-06 13:00:00+03:00,haberler.com
"ABD, İran'ın beklenen saldırısına karşı yüksek alarma geçti! Ajanslar tarih bile verdi","İran, İsrail'in Suriye'deki İran Konsolosluğu'na gerçekleştirdiği saldırının intikamı için kolları sıvadı. Dünyaca ünlü haber ajansları, ABD'nin beklenen saldırıya karşı alarm durumuna geçtiğini belirtti. CNN International ise İran'ın önümüzdeki hafta bölgedeki İsrail veya ABD varlıklarını hedef alacak önemli bir saldırıya hazırlandığını aktardı.",https://www.haberler.com/politika/iran-israil-veya-abd-varliklarini-hedef-alacak-saldiriya-hazirlaniyor-17215352-haberi/,https://foto.haberler.com/haber/2024/04/06/abd-iran-in-beklenen-saldirisina-karsi-yuksek-17215352_831_amp.jpg,2024-04-06 12:44:00+03:00,haberler.com
"Ankara İtfaiyesi, Ramazan Bayramı'nda Yangın Riskine Karşı Uyarıyor","Ankara İtfaiyesi, Ramazan Bayramı'nda evlerinde bulunmayacak vatandaşları yangın riskine karşı dikkatli olmaları konusunda uyardı. İtfaiye ekipleri, bayram tatili boyunca 7/24 görevde olacak.",https://www.haberler.com/guncel/ankara-itfaiyesi-ramazan-bayrami-nda-yangin-riskine-karsi-uyariyor-17215635-haberi/,https://foto.haberler.com/haber/2024/04/06/ankara-itfaiyesinden-ramazan-bayrami-oncesi-y-17215635_local.jpg,2024-04-06 12:34:00+03:00,haberler.com
Anıtkabir'deki kuralı çiğneyen İmamoğlu'na görevlilerden müdahale: İzin alınması gerekiyor,"31 Mart yerel seçimlerinde yeniden İstanbul Büyükşehir Belediye Başkanı seçilen Ekrem İmamoğlu, İstanbul'un CHP'li ilçe belediye başkanları ile birlikte Anıtkabir'i ziyaret etti. Aslanlı Yol'da eşiyle birlikte yürürken bir taraftan da kameralara açıklama yapan İmamoğlu'na görevliler ""Bunun için izin almanız gerekiyor"" diyerek uyarıda bulundu.",https://www.haberler.com/politika/imamoglu-istanbul-un-chp-li-ilce-belediye-17215587-haberi/,https://foto.haberler.com/haber/2024/04/06/anitkabir-deki-kurali-cigneyen-imamoglu-na-17215587_2329_amp.jpg,2024-04-06 12:27:00+03:00,haberler.com
Kızılcık Şerbeti'nde Alev ve Abdullah'ın barışması seyirciyi sinirlendirdi,"Kızılcık Şerbeti'nin dün akşam yayınlanan bölümünde Abdullah, karısının ölümüne sebep olmakla suçladığı için ayrıldığı yasak aşkı Alev ile barıştı. Abdullah'ın Alev için ev tutması ve yasak aşk yaşamaya devam etmeleri seyircileri küplere bindirdi.",https://www.haberler.com/magazin/kizilcik-serbeti-nde-alev-ve-abdullah-in-17215555-haberi/,https://foto.haberler.com/haber/2024/04/06/kizilcik-serbeti-nde-alev-ve-abdullah-in-17215556_1280_amp.jpg,2024-04-06 12:26:00+03:00,haberler.com
"Seçim günü ortaya çıkan ""sahte aday"" mahalleyi karıştırdı! Pusulada Survivor Aleyna ile Emre bile var","Samsun'da bir mahalleden 4 erkek adaya karşı tek kadın olarak seçime giren Nurcan Korkmaz, oy verme işleminin başlamasından sonra bir kadın adayın daha olduğunu öğrendi. Oy pusulasında yer alan adayın adının Nurdan Kaçmaz olması, aza adaylarının ise Aleyna, Emre gibi Survivor yarışmacılarından oluşması dikkat çekti. Kendisine oynanan oyun nedeniyle seçimi kaybettiğini söyleyen Nurcan Korkmaz, il seçim kuruluna itirazda bulunarak seçimin tekrarlanmasını talep etti.",https://www.haberler.com/guncel/kadin-muhtar-adayindan-sahte-aday-iddiasi-17213941-haberi/,https://foto.haberler.com/haber/2024/04/06/secim-gunu-ortaya-cikan-sahte-aday-mahalleyi-17213941_9775_amp.jpg,2024-04-06 12:06:00+03:00,haberler.com
"AK Parti, kaybedilen seçimler sonrası 81 ilde sahaya iniyor! Vatandaşa 3 kritik soru yöneltilecek","31 Mart yerel seçimlerinden istediği sonucu alamayan AK Parti, bunun nedenlerini araştırmak için sahaya iniyor. 81 ilde yapılacak araştırmada vatandaşlara ""Ne beklentiniz var, AK Parti belediyesinden memnun muydunuz, Neden sandığa gitmediniz?"" soruları yöneltilecek. Araştırmadan çıkacak sonuç da Cumhurbaşkanı Erdoğan'ın önüne rapor olarak sunulacak.",https://www.haberler.com/politika/ak-parti-kaybedilen-secimlerle-ilgili-vatandasa-17215515-haberi/,https://foto.haberler.com/haber/2024/04/06/ak-parti-kaybedilen-secimlerle-ilgili-vatandasa-17215516_8392_amp.jpg,2024-04-06 11:58:00+03:00,haberler.com
"Çanakkale'de Gestaş, Bayram Tatili Boyunca 17 Gemiyle Hizmet Verecek",Çanakkale'de 9 günlük Ramazan Bayramı tatilinde adalar ve boğaz hattında sefer yapan Gestaş firması 17 gemiyle hizmet verecek.,https://www.haberler.com/yerel/canakkale-de-gestas-bayram-tatili-boyunca-17-gemiyle-hizmet-verecek-17215357-haberi/,https://foto.haberler.com/haber/2024/04/06/canakkale-de-gestas-ramazan-bayraminda-17-gem-17215357_amp.jpg,2024-04-06 11:11:00+03:00,haberler.com
