,title,description,url,img_url,publishing_date,publisher
1053,"Assassin's Creed Mirage, Ağustos'ta geliyor","Fransız video oyun geliştiricisi Ubisoft'un popüler aksiyon-macera serisinin son oyunu Assassin's Creed Mirage, GameStop çalışanı tarafından sızdırılan bilgilere göre Ağustos 2023'te piyasaya sürüleceği iddia edildi.",https://www.haberler.com/gamegar/assassin-s-creed-mirage-agustos-ta-geliyor-15859717-haberi/,https://foto.haberler.com/haber/2023/05/04/assassin-s-creed-mirage-agustos-ta-geliyor-15859717_7835_amp.jpg,2023-05-04T08:14:00+0300,haberler.com
1054,Redfall kötü lansman yaptı! Oyuncular gözü Starfield'a dikti,"2023'te piyasaya sürülmesi en çok beklenen oyunlar arasında yer alan Redfall, nihayet piyasaya sürüldü, ancak oyuncuların yaşadıkları optimizasyon sorunları nedeniyle oyun yerden yere vuruldu. Oyuncular ise yayıncının piyasaya süreceği bir diğer açık dünya oyunu Starfield'ın da kötü lansman yapmasından endişeleniyor.",https://www.haberler.com/gamegar/redfall-kotu-lansman-yapti-oyuncular-gozu-15854779-haberi/,https://foto.haberler.com/haber/2023/05/03/redfall-kotu-lansman-yapti-oyuncular-gozu-15854779_4564_amp.jpg,2023-05-03T08:35:00+0300,haberler.com
1055,Steam'de haftanın en çok satanları! 24 - 30 Nisan 2023,"Steam'in 24 - 30 Nisan 2023 tarihleri arasında en çok satan oyunları açıklandı. En çok satanın açıklandığı listede ilk 10'da oyunlar ve donanımlar yer aldı. Kimi oyunlar yükselirken, kimi oyunlar listede geriledi. Bazıları ise listede sırasını korumaya devam etti. İşte Steam'de haftanın en çok satan 10 oyunu.",https://www.haberler.com/gamegar/steam-de-haftanin-en-cok-satanlari-24-30-nisan-15854735-haberi/,https://foto.haberler.com/haber/2023/05/03/steam-de-haftanin-en-cok-satanlari-24-30-nisan-15854735_9897_amp.jpg,2023-05-03T07:30:00+0300,haberler.com
1056,Bu hafta çıkacak yeni oyunlar! 1 - 7 Mayıs 2023,"Her hafta yeni oyunlar piyasaya sürülmeye devam ediyor. Piyasaya yeni sürülen oyunların yanı sıra daha önce sürülmüş fakat farklı platformlara çıkış yapmaya hazırlanan oyunlar da yeni yerlerini almaya başlıyor. PC, Switch, PlayStation, Xbox, iOS ve Android için çıkacak yeni oyunlarda bu hafta neler var? Aksiyon, macera, simülasyon ve daha fazla türde pek çok oyun 1 - 7 Mayıs 2023 arasında çıkış yapmaya hazırlanıyor. Peki, bu hafta hangi oyunlar çıkacak? Detayları haberimizde…",https://www.haberler.com/gamegar/bu-hafta-cikacak-yeni-oyunlar-1-7-mayis-2023-15850531-haberi/,https://foto.haberler.com/haber/2023/05/02/bu-hafta-cikacak-yeni-oyunlar-1-7-mayis-2023-15850531_9982_amp.jpg,2023-05-02T09:38:00+0300,haberler.com
1057,Amazon Prime Gaming Mayıs 2023 oyunları açıklandı! 800 TL değerindeki 15 oyunu ücretsiz veriyor,"Amazon'un abonelerine özel olarak her ay ücretsiz bir şekilde verdiği Amazon Prime Gaming'in Mayıs 2023 oyunları açıklandı. Bu ay kullanıcılarına 800,00 TL değerinde ücretsiz oyunlar veren Amazon Prime Gaming'in oyunları önümüzdeki günlerde erişime açılacak.",https://www.haberler.com/gamegar/amazon-prime-gaming-mayis-2023-oyunlari-aciklandi-15850456-haberi/,https://foto.haberler.com/haber/2023/05/02/amazon-prime-gaming-mayis-2023-oyunlari-aciklandi-15850456_4134_amp.jpg,2023-05-02T08:40:00+0300,haberler.com
1058,"STAR WARS Jedi: Survivor, Steam kullanıcıları tarafından olumsuz incelemelere boğuldu","STAR WARS Jedi: Fallen Order'ın devam niteliğindeki aksiyon-macera oyununun eleştirmenlerden aldığı yüksek puanlara rağmen, oyunculardan kötü incelemeler almaya devam ediyor.",https://www.haberler.com/gamegar/star-wars-jedi-survivor-olumsuz-kullanici-15850430-haberi/,https://foto.haberler.com/haber/2023/05/02/star-wars-jedi-survivor-olumsuz-kullanici-15850430_6733_amp.jpg,2023-05-02T08:19:00+0300,haberler.com
1059,Sony'den yeni patent: PlayStation 5 tasarımı değişiyor!,"PlayStation 5 tasarımı değişiyor. Sony tarafından alınan yeni bir patent, çıkarılabilir optik disk sürücüsü desteği kazanacağını gösterdi.",https://www.haberler.com/teknoloji/sony-den-yeni-patent-playstation-5-tasarimi-15837015-haberi/,https://foto.haberler.com/haber/2023/04/28/sony-den-yeni-patent-playstation-5-tasarimi-15837015_amp.jpg,2023-04-28T23:35:00+0300,haberler.com
1060,Steam masaüstü uygulaması yenilendi,"Popüler dijital video oyun dağıtımcısı Steam, geçtiğimiz aylarda yıllardır düzenleme getirmediği mobil uygulamasına yeni tasarım güncellemesi getirmesinin ardından bu kez de masaüstü uygulaması için yeni özellik ve iyileştirme güncellemesi getirdi.",https://www.haberler.com/gamegar/steam-masaustu-uygulamasi-yenilendi-15832671-haberi/,https://foto.haberler.com/haber/2023/04/28/steam-masaustu-uygulamasi-yenilendi-15832671_9991_amp.jpg,2023-04-28T08:12:00+0300,haberler.com
1061,Epic Games'in bu haftaki ücretsiz oyunu açıklandı! Toplam değeri 333 TL,"Epic Games her hafta olduğu gibi kullanıcılarına ücretsiz oyunlar vermeye devam ediyor. Epic Games bu hafta kullanıcılarına 333 TL değerinde ücretsiz oyun veriyor. Peki, Epic Games bu hafta hangi oyun ücretsiz? Detayları haberimizde...",https://www.haberler.com/gamegar/epic-games-in-bu-haftaki-ucretsiz-oyunu-aciklandi-15832650-haberi/,https://foto.haberler.com/haber/2023/04/28/epic-games-in-bu-haftaki-ucretsiz-oyunu-aciklandi-15832650_3652_amp.jpg,2023-04-28T07:40:00+0300,haberler.com
1062,PlayStation Plus Mayıs 2023 oyunları açıklandı! Toplam değeri 1258 TL,PlayStation Plus Mayıs 2023 oyunlarının geçtiğimiz günlerde sızdırılmasının ardından PlayStation Blog'da 2 Mayıs'tan itibaren eklenecek PlayStation Plus'ın Mayıs 2023 oyunları belli oldu. PlayStation Plus kullanıcılarına 1258 TL değerinde üç adet ücretsiz oyun verilecek.,https://www.haberler.com/gamegar/playstation-plus-mayis-2023-oyunlari-aciklandi-15827777-haberi/,https://foto.haberler.com/haber/2023/04/27/playstation-plus-mayis-2023-oyunlari-aciklandi-15827777_2599_amp.jpg,2023-04-27T09:11:00+0300,haberler.com
1063,Netflix Games kütüphanesine bir yeni oyun daha eklenecek,"Netflix, geçtiğimiz günlerde yayınlanan bir açıklamayla, Laya's Horizon adlı popüler mobil oyununun Netflix Games platformuna gelmeye hazırlandığını duyurdu. Alto's Adventure'ın geliştiricileri Laya's Horizon ile 2 Mayıs'ta Netflix Games'e geliyor.",https://www.haberler.com/gamegar/netflix-games-kutuphanesine-bir-yeni-oyun-daha-15827735-haberi/,https://foto.haberler.com/haber/2023/04/27/netflix-games-kutuphanesine-bir-yeni-oyun-daha-15827735_4041_amp.jpg,2023-04-27T08:41:00+0300,haberler.com
1064,Steam'de haftanın en çok satanları! 17 - 23 Nisan 2023,"Steam'in 17 - 23 Nisan 2023 tarihleri arasında en çok satan oyunları açıklandı. En çok satanın açıklandığı listede ilk 10'da oyunlar ve donanımlar yer aldı. Kimi oyunlar yükselirken, kimi oyunlar listede geriledi. Bazıları ise listede sırasını korumaya devam etti. İşte Steam'de haftanın en çok satan 10 oyunu.",https://www.haberler.com/gamegar/steam-de-haftanin-en-cok-satanlari-17-23-nisan-15819663-haberi/,https://foto.haberler.com/haber/2023/04/25/steam-de-haftanin-en-cok-satanlari-17-23-nisan-15819663_8448_amp.jpg,2023-04-25T11:21:00+0300,haberler.com
1065,Steam Bulmaca Festivali indirimleri başladı,"Popüler dijital video oyun dağıtımcısı Steam her yıl düzenli olarak çeşitli oyun festivali ve indirimleri sunar. Bu yılın ilkbahar etkinliği, Steam Bulmaca Festivali adı altında gerçekleştirildiği ve 24 Nisan - 1 Mayıs tarihleri arasında düzenlenecek.",https://www.haberler.com/gamegar/steam-bulmaca-festivali-indirimleri-basladi-15818990-haberi/,https://foto.haberler.com/haber/2023/04/25/steam-bulmaca-festivali-indirimleri-basladi-15818990_3105_amp.jpg,2023-04-25T08:53:00+0300,haberler.com
1066,Bu hafta çıkacak yeni oyunlar! 24 - 30 Nisan 2023,"Her hafta yeni oyunlar piyasaya sürülmeye devam ediyor. Piyasaya yeni sürülen oyunların yanı sıra daha önce sürülmüş fakat farklı platformlara çıkış yapmaya hazırlanan oyunlar da yeni yerlerini almaya başlıyor. PC, Switch, PlayStation, Xbox, iOS ve Android için çıkacak yeni oyunlarda bu hafta neler var? Aksiyon, macera, simülasyon ve daha fazla türde pek çok oyun 24 - 30 Nisan 2023 arasında çıkış yapmaya hazırlanıyor. Peki, bu hafta hangi oyunlar çıkacak? Detayları haberimizde…",https://www.haberler.com/gamegar/bu-hafta-cikacak-yeni-oyunlar-24-30-nisan-2023-15815112-haberi/,https://foto.haberler.com/haber/2023/04/24/bu-hafta-cikacak-yeni-oyunlar-24-30-nisan-2023-15815112_3040_amp.jpg,2023-04-24T09:05:00+0300,haberler.com
1067,Xbox Game Pass'e 7 adet yeni oyun ekleniyor,Xbox Game Pass'in Topluluk Lideri Megan Spurr'un Xbox Wire'dan yaptığı paylaşım ile Nisan'ın ikinci haftası itibarıyla Xbox Game Pass kütüphanesine eklenecek yeni oyunlar açıklandı.,https://www.haberler.com/gamegar/xbox-game-pass-e-7-adet-yeni-oyun-ekleniyor-15815084-haberi/,https://foto.haberler.com/haber/2023/04/24/xbox-game-pass-e-7-adet-yeni-oyun-ekleniyor-15815084_6370_amp.jpg,2023-04-24T08:45:00+0300,haberler.com
1068,Önümüzdeki aylarda dört Ubisoft oyunu daha Steam'e eklenecek,Popüler dijital video oyun dağıtım platformu Steam'de birçok Ubisoft oyununun bulunmasının yanı sıra henüz platformda yer almayan onlarca Ubisoft oyunu bulunmaktadır. Bu yaza doğru ise dört Ubisoft oyunu daha Steam mağazasına ekleneceği tarihleriyle beraber bildirildi.,https://www.haberler.com/gamegar/onumuzdeki-aylarda-dort-ubisoft-oyunu-daha-steam-15815052-haberi/,https://foto.haberler.com/haber/2023/04/24/onumuzdeki-aylarda-dort-ubisoft-oyunu-daha-steam-15815052_1919_amp.jpg,2023-04-24T07:52:00+0300,haberler.com
1069,"Steam, Türkiye'de en çok satan oyunları açıkladı!","Steam, 11 Nisan ile 18 Nisan tarihleri aralığında Türkiye'de en çok satan oyunları paylaştı. İşte en popüler yapımlar...",https://www.haberler.com/teknoloji/steam-turkiye-de-en-cok-satan-oyunlari-acikladi-15810371-haberi/,https://foto.haberler.com/haber/2023/04/22/steam-turkiye-de-en-cok-satan-oyunlari-acikla-15810371_amp.jpg,2023-04-28T11:46:00+0300,haberler.com
1070,"Minecraft Legends, Xbox Game Pass'e eklendi","Microsoft'un popüler oyun hizmeti Xbox Game Pass'e 18 Nisan'da piyasaya sürülen Minecraft Legends ilk günden eklendi. Minecraft Legends, Minecraft oyununun yeni bir sürümüdür ve yeni özellikler ve içerikler sunar.",https://www.haberler.com/gamegar/minecraft-legends-xbox-game-pass-e-eklendi-15778443-haberi/,https://foto.haberler.com/haber/2023/04/19/minecraft-legends-xbox-game-pass-e-eklendi-15778443_5570_amp.jpg,2023-04-24T07:18:00+0300,haberler.com
1071,Steam duyurdu: İşte en çok satan oyunlar,"Steam, haftanın en çok satan oyunlar listesini güncelledi. Steam Deck yine listeye damga vurdu. İşte ayrıntılar!",https://www.haberler.com/teknoloji/steam-duyurdu-iste-en-cok-satan-oyunlar-15778359-haberi/,https://foto.haberler.com/haber/2023/04/19/steam-duyurdu-iste-en-cok-satan-oyunlar-15778359_amp.jpg,2023-04-28T11:27:00+0300,haberler.com
1072,Steam'de haftanın en çok satanları! 11 - 18 Nisan 2023,"Steam'in 11 - 18 Nisan 2023 tarihleri arasında en çok satan oyunları açıklandı. En çok satanın açıklandığı listede ilk 10'da oyunlar ve donanımlar yer aldı. Kimi oyunlar yükselirken, kimi oyunlar listede geriledi. Bazıları ise listede sırasını korumaya devam etti. İşte Steam'de haftanın en çok satan 10 oyunu.",https://www.haberler.com/gamegar/steam-de-haftanin-en-cok-satanlari-11-18-nisan-15775758-haberi/,https://foto.haberler.com/haber/2023/04/18/steam-de-haftanin-en-cok-satanlari-11-18-nisan-15775758_289_amp.jpg,2023-04-18T12:17:00+0300,haberler.com
1073,"Diablo IV, gold statüsüne ulaştı","Blizzard Entertainment'ın Hack and Slash türündeki aksiyon rol yapma oyunu Diablo IV, 6 Haziran'da piyasaya sürülmeye hazırlanırken haftalar kala gold statüsüne ulaştığı bildirildi.",https://www.haberler.com/gamegar/diablo-iv-gold-statusune-ulasti-15775012-haberi/,https://foto.haberler.com/haber/2023/04/18/diablo-iv-gold-statusune-ulasti-15775012_9089_amp.jpg,2023-04-18T08:49:00+0300,haberler.com
1074,Harry Potter evreninde geçecek çok oyunculu quidditch oyunu geliyor,"Hogwarts Legacy'nin yayıncılığını yapan Warner Bros. Games, bir sonraki Harry Potter evreninde geçecek oyununu duyurdu. Harry Potter: Quidditch Champions, Harry Potter romanları tarafından popülerleştirilen kurgusal spora dayanan rekabetçi bir oyundur.",https://www.haberler.com/gamegar/harry-potter-evreninde-gececek-cok-oyunculu-15775003-haberi/,https://foto.haberler.com/haber/2023/04/18/harry-potter-evreninde-gececek-cok-oyunculu-15775003_5787_amp.jpg,2023-04-18T07:56:00+0300,haberler.com
1075,Bu hafta çıkacak yeni oyunlar! 17 - 23 Nisan 2023,"Her hafta yeni oyunlar piyasaya sürülmeye devam ediyor. Piyasaya yeni sürülen oyunların yanı sıra daha önce sürülmüş fakat farklı platformlara çıkış yapmaya hazırlanan oyunlar da yeni yerlerini almaya başlıyor. PC, Switch, PlayStation, Xbox, iOS ve Android için çıkacak yeni oyunlarda bu hafta neler var? Aksiyon, macera, simülasyon ve daha fazla türde pek çok 17 - 23 Nisan 2023 arasında çıkış yapmaya hazırlanıyor. Peki, bu hafta hangi oyunlar çıkacak? Detayları haberimizde…",https://www.haberler.com/gamegar/bu-hafta-cikacak-yeni-oyunlar-17-23-nisan-2023-15771973-haberi/,https://foto.haberler.com/haber/2023/04/17/bu-hafta-cikacak-yeni-oyunlar-17-23-nisan-2023-15771973_1744_amp.jpg,2023-04-17T09:34:00+0300,haberler.com
1076,Angry Birds'ün geliştiricisi rekor rakama Sega'ya satılıyor,"Bir zamanların en çok oynanan mobil oyunları arasında yer alan Angry Birds'ün arkasındaki şirket Rovio Entertainment, Japonya merkezli video oyun geliştiricisi Sega'ya 1 milyar dolara satılacağı bildirildi.",https://www.haberler.com/gamegar/angry-birds-un-gelistiricisi-rekor-rakama-sega-ya-15771888-haberi/,https://foto.haberler.com/haber/2023/04/17/angry-birds-un-gelistiricisi-rekor-rakama-sega-ya-15771888_4961_amp.jpg,2023-04-17T09:07:00+0300,haberler.com
1077,Discord'a sesli mesaj özelliği geldi,"Popüler yazılı ve sesli sohbet uygulaması Discord, geçtiğimiz günlerde yeni özelliğini duyurdu. Yapılan duyuruda Discord mobil uygulamanın tüm kullanıcıları artık direkt mesaj ve sunucularda 20 dakikaya kadar ses kaydı gönderebilecekler. Gönderilen sesli mesajlar masaüstünde dinlenebilse de, yalnızca mobil uygulamadan sesli mesaj gönderilebilecek.",https://www.haberler.com/gamegar/discord-a-sesli-mesaj-ozelligi-geldi-15771875-haberi/,https://foto.haberler.com/haber/2023/04/17/discord-a-sesli-mesaj-ozelligi-geldi-15771875_1553_amp.jpg,2023-04-17T08:02:00+0300,haberler.com
1078,Suicide Squad: Kill the Justice League tekrardan ertelendi,"Duyurulmasından bu yana birçok kez ertelenen Rocksteady'nin geliştirdiği aksiyon-macera oyunu Suicide Squad: Kill the Justice League, resmi olarak 2 Şubat 2024'e ertelendiği duyuruldu.",https://www.haberler.com/gamegar/suicide-squad-kill-the-justice-league-tekrardan-15764862-haberi/,https://foto.haberler.com/haber/2023/04/14/suicide-squad-kill-the-justice-league-tekrardan-15764862_2842_amp.jpg,2023-04-14T09:05:00+0300,haberler.com
1079,Ubisoft Plus aboneliği Xbox'a geldi,"Fransız video oyun geliştiricisi Ubisoft, Ubisoft Plus'ın Xbox sürümünü ilk olarak Ocak 2022'de duyurmuştu. Duyurudan aylar sonra Ubisoft'un abonelik hizmeti olan Ubisoft Plus, Xbox kullanıcıları için kullanıma sunuldu, ancak PC'deki abonelikten daha az oyuna sahip olacak.",https://www.haberler.com/gamegar/ubisoft-plus-aboneligi-xbox-a-geldi-15764853-haberi/,https://foto.haberler.com/haber/2023/04/14/ubisoft-plus-aboneligi-xbox-a-geldi-15764853_6260_amp.jpg,2023-04-14T08:12:00+0300,haberler.com
1080,Steam değeri 320 TL olan iki oyun Epic Games'te ücretsiz oldu,"Her hafta Perşembe günü kullanıcılarına ücretsiz oyunlar veren popüler dijital video oyun dağıtımcısı Epic Games, bu hafta da kullanıcılarını boş geçirmedi ve Steam değeri 320 TL olan iki oyunu ücretsiz olarak verdi.",https://www.haberler.com/gamegar/steam-degeri-320-tl-olan-iki-oyun-epic-games-te-15764842-haberi/,https://foto.haberler.com/haber/2023/04/14/steam-degeri-320-tl-olan-iki-oyun-epic-games-te-15764842_3740_amp.jpg,2023-04-14T07:40:00+0300,haberler.com
1081,Steam çöktü mü? Steam bağlantı yok hatası!,"Steam çöktü mü? Sorusu gündem oldu. Dijital oyun yayınlama platformu Steam'e bağlanmaya çalışan kullanıcılar Steam ağına bağlanamıyor hatası ile karşılaştı. Peki, Steam çöktü mü? Steam ağına bağlanılamıyor 2023 hatası! Detayları haberimizde…",https://www.haberler.com/gamegar/steam-coktu-mu-steam-agina-baglanilamiyor-2023-15761014-haberi/,https://foto.haberler.com/haber/2022/07/19/steam-coktu-mu-steam-agina-baglanilamiyor-2022-15084837_7518_amp.jpg,2023-09-15T15:56:00+0300,haberler.com
1082,28 Mart - 4 Şubat 2023 arasında Steam'de haftanın en çok satan oyunları,"Steam'in 28 Mart - 4 Şubat 2023 tarihleri arasında en çok satan oyunları açıklandı. En çok satanın açıklandığı listede ilk 10'da oyunlar ve donanımlar yer aldı. Kimi oyunlar yükselirken, kimi oyunlar listede geriledi. Bazıları ise listede sırasını korumaya devam etti. İşte Steam'de haftanın en çok satan 10 oyunu.",https://www.haberler.com/gamegar/steam-de-en-cok-satan-oyunlar-aciklandi-28-mart-15756568-haberi/,https://foto.haberler.com/haber/2023/04/11/steam-de-en-cok-satan-oyunlar-aciklandi-28-mart-15756568_8789_amp.jpg,2023-10-11T09:19:00+0300,haberler.com
1083,Resident Evil Village'in Denuvo koruması kaldırıldı,"Capcom, Resident Evil serisinin son oyunu olan Resident Evil Village'ı çıkardığında oyunun koruması hakkında bir tartışma başlamıştı. Oyunun orijinal sürümü, oyunun korsan kopyalarının yayılmasını engellemek için Denuvo adı verilen bir dijital hak koruma (DRM) teknolojisi ile korunmuştu. Ancak, Capcom sonunda, oyuncular bir konu haline gelen bu korumayı kaldırmaya karar verdi.",https://www.haberler.com/gamegar/capcom-denuvo-korumasini-resident-evil-village-15755919-haberi/,https://foto.haberler.com/haber/2023/04/11/capcom-denuvo-korumasini-resident-evil-village-15755919_5269_amp.jpg,2023-04-11T09:27:00+0300,haberler.com
1084,Valorant VP fiyatları ne kadar 2023? Valorant VP ne kadar zam oldu?,"Riot Games'in 10 Nisan 2023'te yaptığı yeni paylaşım ile 25 Nisan 2023'ten itibaren Valorant VP fiyatlarına ortalama olarak yüzde 35 zam geleceğini duyurdu. Yapılacak zamlar sonrası ise Valorant oyuncuları yeni zamlarla beraber VP fiyatlarını merak etmeye başladı. Peki, Valorant VP fiyatları ne kadar 2023? Valorant VP ne kadar zam oldu? Valorant VP zamları ne kadar? Detayları haberimizde...",https://www.haberler.com/gamegar/valorant-vp-fiyatlari-ne-kadar-2023-valorant-vp-15755877-haberi/,https://foto.haberler.com/haber/2023/04/11/valorant-vp-fiyatlari-ne-kadar-2023-valorant-vp-15755877_8050_amp.jpg,2023-04-11T08:25:00+0300,haberler.com
1085,Türkiye'de Valorant VP fiyatlarına zam geliyor! Valorant VP 2023 ne kadar?,Riot Games'in oynaması ücretsiz popüler FPS nişancı oyunu Valorant'a yapılan yeni duyuru ile Türkiye'deki fiyatlarına zam geleceği duyuruldu. 25 Nisan 2023'ten itibaren Valorant VP fiyatlarına ortalama yüzde 35 fiyat artışı gelecek.,https://www.haberler.com/gamegar/turkiye-de-valorant-vp-fiyatlarina-zam-geliyor-15755870-haberi/,https://foto.haberler.com/haber/2023/04/11/turkiye-de-valorant-vp-fiyatlarina-zam-geliyor-15755870_4963_amp.jpg,2023-04-11T07:53:00+0300,haberler.com
1086,Age of Empires II: Definitive Edition - Return of Rome'un çıkış tarihi belli oldu,Age of Empires serisinin 25. Yıldönümünde duyurusu yapılan Age of Empires II: Definitive Edition - Return of Rome'un çıkış tarihi açıklandı. Age of Empires'in Twitter hesabından yapılan duyuruda yeni DLC'nin 16 Mayıs'ta çıkış yapacağı açıklandı.,https://www.haberler.com/gamegar/age-of-empires-ii-definitive-edition-return-of-15755865-haberi/,https://foto.haberler.com/haber/2023/04/11/age-of-empires-ii-definitive-edition-return-of-15755865_7092_amp.jpg,2023-04-11T07:35:00+0300,haberler.com
1087,Bu hafta çıkacak yeni oyunlar! 10 - 16 Nisan 2023,"Her hafta yeni oyunlar piyasaya sürülmeye devam ediyor. Piyasaya yeni sürülen oyunların yanı sıra daha önce sürülmüş fakat farklı platformlara çıkış yapmaya hazırlanan oyunlar da yeni yerlerini almaya başlıyor. PC, Switch, PlayStation, Xbox, iOS ve Android için çıkacak yeni oyunlarda bu hafta neler var? Aksiyon, macera, simülasyon ve daha fazla türde pek çok oyun 10 - 16 Nisan 2023 arasında çıkış yapmaya hazırlanıyor. Peki, bu hafta hangi oyunlar çıkacak? Detayları haberimizde…",https://www.haberler.com/gamegar/bu-hafta-cikacak-yeni-oyunlar-10-16-nisan-2023-15753389-haberi/,https://foto.haberler.com/haber/2023/04/10/bu-hafta-cikacak-yeni-oyunlar-10-16-nisan-2023-15753389_9407_amp.jpg,2023-04-10T09:13:00+0300,haberler.com
1088,Undawn ne zaman çıkacak? Undawn mobile ne zaman çıkacak?,"PUBG Mobile'ın geliştiricisi Tencent Games ve Lightspeed & Quantum tarafından geliştiriciliğini yapılan FPS macera oyunu Undawn'ın PC ve mobile cihazlar için çıkış tarihi merak edilen konular arasında yer alıyor. Peki, Undawn ne zaman çıkacak? Undawn mobile ne zaman çıkacak? Detayları haberimizde...",https://www.haberler.com/gamegar/undawn-ne-zaman-cikacak-undawn-mobile-ne-zaman-15753372-haberi/,https://foto.haberler.com/haber/2023/04/10/undawn-ne-zaman-cikacak-undawn-mobile-ne-zaman-15753372_2327_amp.jpg,2023-04-10T08:57:00+0300,haberler.com
1089,Second Extinction sistem gereksinimleri neler? Second Extinction kaç GB?,"Systemic Reaction'ın geliştirip piyasaya sürdüğü açık dünya FPS macera oyunu Second Extinction'ın sistem gereksinimleri ve kaç GB yer kapladığı merak edilen konular arasında yer alıyor. Peki, Second Extinction sistem gereksinimleri neler? Second Extinction kaç GB? Detayları haberimizde...",https://www.haberler.com/gamegar/second-extinction-sistem-gereksinimleri-neler-15753355-haberi/,https://foto.haberler.com/haber/2023/04/10/second-extinction-sistem-gereksinimleri-neler-15753355_327_amp.jpg,2023-04-10T08:13:00+0300,haberler.com
1090,Undawn sistem gereksinimleri neler? Undawn kaç GB?,"Lightspeed Studios tarafından geliştirilip Level Infinite'in yayıncılığını üstlendiği açık dünya rol yapma oyunu Undawn'ın sistem gereksinimleri ve kaç GB yer kapladığı merak edilen konular arasında yer alıyor. Peki, Undawn sistem gereksinimleri neler? Undawn kaç GB? Detayları haberimizde...",https://www.haberler.com/gamegar/undawn-sistem-gereksinimleri-neler-undawn-kac-gb-15753350-haberi/,https://foto.haberler.com/haber/2023/04/10/undawn-sistem-gereksinimleri-neler-undawn-kac-gb-15753350_1338_amp.jpg,2023-04-10T08:06:00+0300,haberler.com
1091,Mordhau sistem gereksinimleri neler? Mordhau kaç GB?,"Tritemion tarafından geliştirilip yayınlanan orta çağ temalı çok oyunculu FPS oyunu Mordhau'nun sistem gereksinimleri ve kaç GB yer kapladığı merak edilen konular arasında yer alıyor. Peki, Mordhau sistem gereksinimleri neler? Mordhau kaç GB? Detayları haberimizde...",https://www.haberler.com/gamegar/mordhau-sistem-gereksinimleri-neler-mordhau-kac-15753349-haberi/,https://foto.haberler.com/haber/2023/04/10/mordhau-sistem-gereksinimleri-neler-mordhau-kac-15753349_9564_amp.jpg,2023-04-10T08:08:00+0300,haberler.com
1092,Star Wars Jedi: Survivor'dan final oynanış fragmanı yayınlandı,"Star Wars Celebration Europe 2023'ün bir parçası olarak geliştirici Respawn Entertainment ve Electronic Arts, bu ay piyasaya sürülmeye hazırlanan Star Wars Jedi: Survivor'ın oynanış fragmanını yayınladı.",https://www.haberler.com/gamegar/star-wars-jedi-survivor-dan-final-oynanis-15753343-haberi/,https://foto.haberler.com/haber/2023/04/10/star-wars-jedi-survivor-dan-final-oynanis-15753343_7135_amp.jpg,2023-04-10T07:31:00+0300,haberler.com
1093,Steam değeri 80 TL olan iki oyun Epic Games'te ücretsiz oldu,"Her hafta Perşembe günü kullanıcılarına ücretsiz oyunlar veren popüler dijital video oyun dağıtımcısı Epic Games, bu hafta da kullanıcılarını boş geçirmedi ve Steam değeri 80 TL olan iki oyunu ücretsiz olarak verdi.",https://www.haberler.com/gamegar/steam-degeri-80-tl-olan-iki-oyun-epic-games-te-15747944-haberi/,https://foto.haberler.com/haber/2023/04/07/steam-degeri-80-tl-olan-iki-oyun-epic-games-te-15747944_4275_amp.jpg,2023-04-07T08:03:00+0300,haberler.com
1094,"EA Sports, FIFA lisansı altında yeni oyunu EA Sports FC'nin logosunu tanıttı","EA Sports, perşembe günü FIFA lisansı altında yayınladığı 30 yıllık serininin devamı olan EA Sports FC'yi tanıtmaya başladı. Yayıncı, oyunun yeni logusunu tanıtırken Avrupa, Güney Amerika ve Kuzey Amerika kulüpleri ve büyük yerel ligleriyle olan partnerliğini de açıkladı.",https://www.haberler.com/gamegar/fifa-serisinin-yeni-adi-ea-sports-fc-logosunu-15747941-haberi/,https://foto.haberler.com/haber/2023/04/07/fifa-serisinin-yeni-adi-ea-sports-fc-logosunu-15747941_3842_amp.jpg,2023-04-07T07:54:00+0300,haberler.com
1095,God of War Ragnarok'a New Game + özelliği eklendi,"Sony'nin popüler aksiyon-macera oyunu God of War Ragnarok'a New Game + özelliği geldi. Bu özellik, oyuncuların oyunu bitirdikten sonra tekrar oynamalarına olanak tanıyor ve oyuncuların önceki oyunlarından kazandıkları öğeleri, yetenekleri ve güçleri koruyor.",https://www.haberler.com/gamegar/god-of-war-ragnarok-a-new-game-ozelligi-eklendi-15745668-haberi/,https://foto.haberler.com/haber/2023/04/06/god-of-war-ragnarok-a-new-game-ozelligi-eklendi-15745668_4466_amp.jpg,2023-04-06T09:18:00+0300,haberler.com
