,title,description,url,img_url,publishing_date,publisher
0,Hollanda'da bir kafede çok sayıda kişi rehin alındı! Bölgedeki evler tahliye edildi,"Hollanda'nın Ede şehrinde bir kafede çok sayıda kişi rehin alındı. Polis, bölgedeki 150 evi tahliye etti. 3 rehinenin serbest kaldığı ancak olayın devam ettiğini bildirildi.",https://www.haberler.com/guncel/hollanda-da-bir-kafede-cok-sayida-kisi-rehin-16993699-haberi/,https://foto.haberler.com/haber/2024/03/30/hollanda-da-bir-kafede-cok-sayida-kisi-rehin-16993699_4298_amp.jpg,2024-03-30T14:04:00+0300,haberler.com
1,"Çankırı'da tır otomobilin üzerine devrildi! 4 kişi öldü, 2'si polis 3 kişi yaralandı","Çankırı'da arızalanan bir otomobilin sürücüsü, aracını yol kenarına park etti. Polis ekibinin bölgede güvenlik önlemi aldığı sırada aynı yönde seyreden bir tır, otomobilin üzerine devrildi. Kazada 4 kişi hayatını kaybetti, 2'si polis 3 kişi yaralandı.",https://www.haberler.com/guncel/cerkes-te-tirin-otomobile-carpmasi-sonucu-4-kisi-hayatini-kaybetti-16993643-haberi/,https://foto.haberler.com/haber/2024/03/30/cankiri-da-tir-otomobilin-uzerine-devrildi-4-16993643_4126_amp.jpg,2024-03-30T14:06:00+0300,haberler.com
2,Türkiye yarın sandık başına gidiyor! İşte vatandaşı yakından ilgilendiren seçim yasakları,"Türkiye, yerel yöneticilerini belirlemek üzere sandık başına gidiyor. Vatandaşların oy kullanacağı okullarda son hazırlıklar sürerken yarın bazı seçim yasakları da yarın sabah saat 06.00'dan itibaren uygulanacak.",https://www.haberler.com/politika/turkiye-yarin-sandik-basina-gidiyor-iste-16993602-haberi/,https://foto.haberler.com/haber/2024/03/30/turkiye-yarin-sandik-basina-gidiyor-iste-16993603_2986_amp.jpg,2024-03-30T12:13:00+0300,haberler.com
3,"ABC Deterjan'a 4,6 milyon lira ceza","Rekabet Kurulu tarafından, alıcılarının yeniden satış fiyatını belirlediğini ve bu suretle Rekabetin Korunması Hakkında Kanunu ihlal ettiğini kabul eden ABC Deterjan'a 4 milyon 635 bin 94 lira idari para cezası verildi.",https://www.haberler.com/ekonomi/abc-deterjan-a-4-milyon-tl-idari-para-cezasi-16993502-haberi/,https://foto.haberler.com/haber/2024/03/30/abc-deterjan-a-4-6-milyon-lira-ceza-16993502_9294_amp.jpg,2024-03-30T12:28:00+0300,haberler.com
4,"42 bin lira maaş, dayalı döşeli ev veriyor ama çalışan yok","Sivas'ta koyun yetiştiriciliği yapan Niyazi Mit, çoban bulamadığı için isyan etti. Toplamda 42 bin lira maaş vereceğini belirten Mit, bunun yanı sıra gelecek kişinin çocuğunun eğitim masraflarını da üstleniyor ama gelen giden yok.",https://www.haberler.com/yerel/tarimin-kalbi-sivas-ta-coban-bulunamiyor-16993181-haberi/,https://foto.haberler.com/haber/2024/03/30/42-bin-lira-maas-dayali-doseli-ev-veriyor-ama-16993181_8328_amp.jpg,2024-03-30T11:52:00+0300,haberler.com
5,"Hadise'yi makyajsız görenler şaşıp kaldı: Bu Hadise mi, tanıyamadım","Makyajsız görüntülenen Hadise'nin durumu hayranlarını üzdü. Ünlü şarkıcının fotoğrafını görenler ""Yüzüne ne olmuş?"", ""Bu Hadise mi?"", ""Tanıyamadım"", ""Resmen başka biri"" şeklinde yorumlar yaptı.",https://www.haberler.com/magazin/hadise-yi-makyajsiz-gorenler-sasip-kaldi-bu-16993798-haberi/,https://foto.haberler.com/haber/2024/03/30/hadise-yi-makyajsiz-gorenler-sasip-kaldi-bu-16993799_5602_amp.jpg,2024-03-30T13:22:00+0300,haberler.com
6,Evin bahçesinden lahit çıktı: Her şey altyapı çalışmalarıyla başladı!,"Hatay'ın Defne ilçesinde, bir evin bahçesinde lahit bulundu. Lahit incelenmek üzere Hatay Müze Müdürlüğü'ne götürüldü.",https://www.ittifakgazetesi.com/evin-bahcesinden-lahit-cikti-her-sey-altyapi-calismalariyla-basladi,https://ittifakgazetesicom.teimg.com/ittifakgazetesi-com/uploads/2024/03/lahit-hatay-kapak.jpg,2024-03-30T11:17:16+03:00,haberler.com
7,İmamoğlu'ndan gövde gösterisi! Seçim öncesi son konuşmasını AK Parti'nin kalesinde yaptı,"İBB Başkanı İmamoğlu, Pazar günü gerçekleşecek seçim öncesi son konuşmasını AK Parti'nin kalelerinden olan Sultanbeyli'de yaptı. 2019 seçimlerinde kollarını sıvadığı anlara gönderme yapan İmamoğlu, ""Ben kolları Beylikdüzü'nde değil, seçimin iptal edildiği akşam Sultanbeyli'de orucumu açarken iftar saatinde sıvadım."" diye konuştu.",https://www.haberler.com/politika/imamoglu-ndan-govde-gosterisi-secim-oncesi-son-16992798-haberi/,https://foto.haberler.com/haber/2024/03/29/imamoglu-ndan-govde-gosterisi-secim-oncesi-son-16992799_2338_amp.jpg,2024-03-30T00:00:00+0300,haberler.com
8,"Ülke savaştayken komutanın yaptığına bakın! 3 meslektaşı ile aşk yaşadı, o anlar böyle kayda alındı","Ukrayna'da bir gizli kamera, aynı anda 3 meslektaşı ile aşk yaşayan komutanı kayda aldı. Ülkede savaş devam ederken çekilen görüntüler sosyal medyada büyük infial yarattı.",https://www.haberler.com/dunya/ulke-savastayken-komutanin-yaptigina-bakin-3-16993160-haberi/,https://foto.haberler.com/haber/2024/03/30/ulke-savastayken-komutanin-yaptigina-bakin-3-16993161_196_amp.jpg,2024-03-30T09:49:00+0300,haberler.com
9,Adanalı ünlüler: Çukurova'nın bağrından çıkan o isimler!,Onlarca yıldır özellikle kültür sanat alanında çıkardığı ünlü isimlerle bilinen Adana yine topraklarından şöhretli isimleri göndermeye devam ediyor. Bilinen ve Adanalı olduklarını neredeyse her ortamda belli eden isimlerin yanı sıra gündemde olan fakat Adanalı oldukları pek bilinmeyen isimleri İttifakgazetesi.com derledi. İlk defa onlarca Adanalı bir arada!..,https://www.ittifakgazetesi.com/cukurovanin-bagrindan-cikan-o-isimler-iste-onlarca-adanali-unluler,https://ittifakgazetesicom.teimg.com/ittifakgazetesi-com/uploads/2024/01/adanali-unlu-isimler/adanali-unluler-01.jpg,2024-03-30T09:59:49+03:00,haberler.com
10,İstanbul'da yarışı kim önde götürüyor? Ekrem İmamoğlu ve Murat Kurum arasında 1 puan fark var,"Yerel seçimlere sayılı saatler kala İstanbul için son seçim anketi ortaya çıktı. ORC Araştırma'nın yaptığı ankete göre, mevcut Başkan ve CHP'nin yeniden aday gösterdiği Ekrem İmamoğlu'nu tercih edenlerin oranı 42,4 iken, Cumhur İttifakı'nın adayı Murat Kurum ise yüzde 41,3'te kaldı. Öte yandan Yeniden Refah'ın adayı Mehmet Altınöz 3,6, DEM Parti'nin adayları Meral Danış Beştaş ile Murat Çepni ise yüzde 3,5'lik bir oran aldı.",https://www.haberler.com/politika/ekrem-imamoglu-mu-murat-kurum-mu-secime-saatler-16992055-haberi/,https://foto.haberler.com/haber/2024/03/29/ekrem-imamoglu-mu-murat-kurum-mu-secime-saatler-16992056_7224_amp.jpg,2024-03-29T18:05:00+0300,haberler.com
11,Soruşturma kapsamında açığa alınan Yarbay intihar mektubu bırakarak yaşamına son verdi,"Ankara'da görevli Yarbay Gökhan Ünyeli, hakkında yürütülen soruşturma sonucunda açığa alındıktan sonra intihar etti. Ünyeli, intiharından önce arkadaşlarına gönderdiği mektupta ""Tam 12 yıl önce kim olduğu belirsiz bir kişi tarafından telefonuma yapılan cevapsız çağrı nedeniyle yaşadıklarım umarım kimsenin başına gelmez. FETÖ ve PKK başta olmak üzere Türkiye Cumhuriyeti'nin bölünmez bütünlüğüne kasteden tüm terör örgütlerini lanetliyorum"" ifadelerini kullandı.",https://www.haberler.com/3-sayfa/ankara-da-aciga-alinan-yarbay-intihar-etti-16991382-haberi/,https://foto.haberler.com/haber/2024/03/29/sorusturma-kapsaminda-aciga-alinan-yarbay-intihar-16991382_6081_amp.jpg,2024-03-29T15:53:00+0300,haberler.com
12,"Cumhurbaşkanı Erdoğan, miting sonrası Murat Kurum'u sahneye çağırdı, görevli uyardı: Efendim onlar Sancaktepe'de","Cumhurbaşkanı Recep Tayyip Erdoğan'ın İstanbul Sultanbeyli'deki mitinginde ilginç anlar yaşandı. Sahneye Cumhur İttifakı'nın İBB Başkan adayı Murat Kurum'u çağıran Erdoğan'ı, görevli uyararak, ""Efendim onlar Sancaktepe'ye konuşmaya gitti."" dedi.",https://www.haberler.com/politika/erdogan-miting-sonrasi-murat-kurum-u-sahneye-16991682-haberi/,https://foto.haberler.com/haber/2024/03/29/erdogan-miting-sonrasi-murat-kurum-u-sahneye-16991683_3416_amp.jpg,2024-03-29T17:13:00+0300,haberler.com
13,"Adalet Bakanı Yılmaz Tunç'tan ""17 bakan niye sahada?"" eleştirilerine yanıt","Adalet Bakanı Yılmaz Tunç, Bartın'da yaptığı konuşmada ""Bakanlar neden sahaya çıktı?"" eleştirilerine yanıt verdi. Tunç, ""Sürekli dertleri '17 bakan niye sahada?' 17 bakan sadece seçimde sahada değil ki sürekli milletinin arasında"" ifadelerini kullanırken İBB Başkanı İmamoğlu'nu da hedef aldı. Tunç, ""Sen İstanbul'da seçimi kaybediyorsun, haberin yok. Sen 5 yıl İstanbul'a kayıp yıllar yaşattın, sen İstanbul'a çivi çakmadın. Ne yaptın sen İstanbul'a? Tatilden gelmedi"" dedi.",https://www.haberler.com/guncel/adalet-bakani-tunc-bartin-da-vatandaslara-hitap-16991567-haberi/,https://foto.haberler.com/haber/2024/03/29/adalet-bakani-yilmaz-tunc-istanbullu-sandikta-16991567_9845_amp.jpg,2024-03-29T19:03:00+0300,haberler.com
14,Görüntü Bursa'dan! Tesla marka elektrikli otomobil alev topuna döndü,"Bursa'nın Gemlik ilçesinde seyir halindeki bir Tesla marka elektrikli otomobil alev alev yanarak küle döndü. Sürücü, otomobili yol kenarına çekip terk etti. Olay anları kameraya yansıdı.",https://www.haberler.com/3-sayfa/bursa-da-tesla-marka-elektrikli-otomobil-alev-aldi-16993235-haberi/,https://foto.haberler.com/haber/2024/03/30/goruntu-bursa-dan-tesla-marka-elektrikli-16993235_9113_amp.jpg,2024-03-30T14:23:00+0300,haberler.com
15,Cumhurbaşkanı Erdoğan'ın ilçedeki mitingi öncesi 'Kent Lokantası' dev afişle kapatıldı,"Seçim çalışmaları kapsamında Arnavutköy 15 Temmuz Şehitler Meydanı'nda düzenlenecek mitingde vatandaşlara hitap edecek Cumhurbaşkanı Erdoğan'ın ilçeyi ziyareti öncesi güzergahı üzerindeki Kent Lokantası, Murat Kurum afişiyle kapatıldı.",https://www.haberler.com/politika/cumhurbaskani-erdogan-in-ilcedeki-mitingi-oncesi-16993102-haberi/,https://foto.haberler.com/haber/2024/03/30/cumhurbaskani-erdogan-in-ilcedeki-mitingi-oncesi-16993103_9942_amp.jpg,2024-03-30T09:17:00+0300,haberler.com
16,Emekliye trende yüzde 10 indirim uygulaması başladı,"Ulaştırma ve Altyapı Bakanı Abdulkadir Uraloğlu, bu gece yarısı itibarıyla emeklilerin yüzde 10 indirimli seyahat edeceğini duyurdu. İndirimin yıl boyunca geçerli olacağını duyuran Uraloğlu, yüksek hızlı, ana hat ve bölgesel trenlerde uygulanacak indirimden faydalanmak için sadece emekli olduğunu gösteren belgenin yeterli olacağını ifade etti.",https://www.haberler.com/ekonomi/emeklilere-tren-biletlerinde-10-indirim-mujdesi-16992837-haberi/,https://foto.haberler.com/haber/2024/03/29/emeklilere-tren-biletlerinde-10-indirim-mujdesi-16992838_8425_amp.jpg,2024-03-29T23:56:00+0300,haberler.com
17,"AK Parti Genel Başkan Yardımcısı Ali İhsan Yavuz, kazanacakları illeri tek tek saydı: Hiç beklemediğiniz sürprizler olacak","AK Parti Genel Başkan Yardımcısı Ali İhsan Yavuz, katıldığı canlı yayında, yaklaşan 31 Mart seçimleri hakkında konuştu. Yavuz, ""Sürprizler de olacak. Yeni, hiç beklemediğiniz örnekler vereyim. İstanbul, Ankara yeniden AK Parti belediyeciliğinin olduğu yerlere dönüşecek ama Edirne, Antalya, Artvin, Hatay, İzmir gibi yeni iller de olacak. Bu akşam anketçi bir arkadaşımızla görüştüm İzmir'i bekliyoruz."" dedi.",https://www.haberler.com/politika/ak-parti-genel-baskan-yardimcisi-ali-ihsan-yavuz-16992745-haberi/,https://foto.haberler.com/haber/2024/03/29/ak-parti-genel-baskan-yardimcisi-ali-ihsan-yavuz-16992746_5796_amp.jpg,2024-03-29T23:00:00+0300,haberler.com
18,Kocaeli Büyükşehir Belediye Başkan Adayı Tahir Büyükakın'ın afişleri İzmir'e asıldı,"AK Parti Kocaeli Belediye Başkan Adayı Tahir Büyükakın'ın seçim afişleri İzmir'e asıldı. Bayraklı'da bir reklam panosunda İzmir adayları arasında yer alan Büyükakın'ın afişinin üzerinde ""Hayaldi gerçek oldu, Kartepe Teleferik hayırlı olsun"" mesajı yer aldı.",https://www.haberler.com/politika/kocaeli-buyuksehir-belediye-baskan-adayi-tahir-16993256-haberi/,https://foto.haberler.com/haber/2024/03/30/kocaeli-buyuksehir-belediye-baskan-adayi-tahir-16993257_7512_amp.jpg,2024-03-30T10:31:00+0300,haberler.com
19,Rusya'da yeni saldırı girişimi! Orta Asya kökenli 3 kişi son anda yakalandı,Moskova'da 139 kişinin hayatını kaybettiği terör saldırısının şokunu yaşayan Rusya'da yeni bir saldırı girişimi oldu. Rusya iç istihbarat örgütü tarafından yakalanarak gözaltına alınan 3 kişinin Stavropol'daki kalabalık bir etkinliğe bombalı saldırı düzenlemeyi planladığı öğrenildi.,https://www.haberler.com/dunya/rusya-da-yenis-saldiri-girisimi-orta-asya-16993292-haberi/,https://foto.haberler.com/haber/2024/03/30/rusya-da-yenis-saldiri-girisimi-orta-asya-16993293_3873_amp.jpg,2024-03-30T10:52:00+0300,haberler.com
20,Türkiye sandık başına gidiyor! İşte 31 Mart seçimlerine dair 10 soru 10 cevap,Türkiye yarın sandık başına gidiyor. Yaklaşık 61 milyon seçmenin oy kullanmasının beklendiği 31 Mart Mahalli İdareler Seçimleri'nde 34 parti yarışacak. Bizler de seçime saatler kala en çok merak edilen soru ve cevapları sizler için derledik.,https://www.haberler.com/politika/turkiye-sandik-basina-gidiyor-iste-31-mart-16993069-haberi/,https://foto.haberler.com/haber/2024/03/30/turkiye-sandik-basina-gidiyor-iste-31-mart-16993070_2451_amp.jpg,2024-03-30T08:59:00+0300,haberler.com
21,"İYİ Parti'nin Ordu adayı Enver Yılmaz'ın ""Seçim öncesi evrakları yakıyorlar"" iddiası","İYİ Parti Ordu Büyükşehir Belediye Başkan adayı Enver Yılmaz, yerel seçimlere saatler kala sosyal medya hesabından dikkat çeken bir video paylaştı. Paylaşımdaki videoda bazı kağıtların boş bir arazide yakıldığı görülürken, Yılmaz duruma tepki göstererek, ""Bu telaş niye? Panik halde, yaktığınız evraklar içerisinde, belediye şirketlerinin usulsüz ihale dosyaları mı var?"" sorusunu yöneltti.",https://www.haberler.com/politika/iyi-partili-buyuksehir-adayi-videoyu-paylasip-16992924-haberi/,https://foto.haberler.com/haber/2024/03/30/iyi-partili-buyuksehir-adayi-videoyu-paylasip-16992925_9803_amp.jpg,2024-03-30T00:58:00+0300,haberler.com
22,Ali Koç'tan çarpıcı açıklamalar: TFF ceza verirse Türk futbolu sıkıntıya girer,"Fenerbahçe Kulübü, Mart ayı Yüksek Divan Kurulu Toplantısı'nı gerçekleştirdi. Toplantıda konuşan Fenerbahçe Başkanı Ali Koç, kulübün içinde bulunduğu durumu ve Trabzonspor maçında yaşananları sert bir dille anlattı. Koç, ""Futbolcularımıza ceza vereceklermiş. Onların menfaatleri açısından inşallah ceza vermezler. Türk futbolu uluslararası alanda çok sıkıntıya girer. Şimdi kılıfına uydurmaya çalışıyorlar. Çünkü üstlerinde baskı var. Zaten her şeyi kılıfına uydurmaya çalışıyorlar"" dedi.",https://www.haberler.com/spor/ali-koc-tan-carpici-aciklamalar-tff-ceza-verirse-16991847-haberi/,https://foto.haberler.com/haber/2024/03/29/ali-koc-tan-carpici-aciklamalar-tff-ceza-verirse-16991848_5384_amp.jpg,2024-03-29T17:28:00+0300,haberler.com
23,"Biden yönetimi, İsrail'e milyarlarca dolarlık yeni savaş uçağı ve bomba sevkiyatına sessiz sedasız onay verdi","İsrail'in 7 Ekim'den beri Gazze'ye insanlık dışı saldırı sürürken, ABD ise silah ve mühimmat desteğine devam ediyor. İsrail Savunma Bakanı Yoav Gallant'ın bu haftaki Washington ziyaretinin ardından Biden yönetiminin İsrail'e milyarlarca dolarlık yeni savaş uçağı ve binlerce yeni güdümsüz bomba sevkiyatına onay verdiği ortaya çıktı. Yeni sevkiyatın onayıyla ilgili kamuoyuna ve Kongre'ye herhangi bir bildirimde bulunulmadı. Skandalı ortaya ABD basını çıkardı.",https://www.haberler.com/guncel/abd-israil-e-yeni-savas-ucagi-ve-bomba-sevkiyatina-onay-verdi-16992793-haberi/,https://foto.haberler.com/haber/2024/03/30/abd-israil-e-yeni-savas-ucagi-ve-bomba-sevkiyatina-onay-verdi-16992793_3373_amp.jpg,2024-03-30T00:37:00+0300,haberler.com
24,Kurultayda en yakınındaki isim konuştu: Kılıçdaroğlu konuşmak için 1 Nisan'ı bekliyor,"CHP'nin eski lideri Kemal Kılıçdaroğlu'nun kendisi hakkında yürütülen tartışmalarla ilgili 1 Nisan'dan sonra konuşabileceği öne sürüldü. Kurultayda Kılıçdaroğlu'nun en yakınındaki isimlerden biri olan gazeteci Nuray Başaran, telefon görüşmesinde Kılıçdaroğlu'nun ""Hem beni başarısız buluyor hem destek istiyorlar. Ben ne yapacağımı şaşırmış vaziyetteyim."" dediğini öne sürdü. Başaran ayrıca kurultayla ilgili ""Elimde görüntüler, belgeler var."" diyerek yayınlamak için 1 Nisan'ı beklediğini söyledi.",https://www.haberler.com/politika/chp-kurultayi-kilicdaroglu-nun-1-nisan-da-16991269-haberi/,https://foto.haberler.com/haber/2024/03/29/kilicdaroglu-yla-ilgili-1-nisan-iddiasi-ne-16991269_3453_amp.jpg,2024-03-29T15:56:00+0300,haberler.com
25,YRP adayı İstanbul yarışından çekilecek mi? Mehmet Altınöz suskunluğunu bozdu,"Yeniden Refah Partisi Genel Başkanı Fatih Erbakan'ın, Cumhur İttifakı İBB Başkan adayı Murat Kurum'u desteklemek için şartlarını sıralamasıyla ilgili Yeniden Refahlı İBB adayı Mehmet Altınöz sessizliğini bozdu. Altınöz, adaylıktan çekilmenin söz konusu olmadığını ifade ederek, ""Bu iddiaları ortaya atanlar ispat etmek durumundadır. İddialarını ispat edemezlerse müfteridirler, ahlaksızdırlar. Kesinlikle çekilmeyeceğiz, devam edeceğiz"" dedi.",https://www.haberler.com/politika/yrp-adayi-secimden-cekilecek-mi-mehmet-altinoz-16992528-haberi/,https://foto.haberler.com/haber/2024/03/29/yrp-adayi-secimden-cekilecek-mi-mehmet-altinoz-16992528_8311_amp.jpg,2024-03-29T21:20:00+0300,haberler.com
26,"Özgür Özel'den ""Bana abla mabla demeyin"" diyen Akşener'e yanıt: Canı sağ olsun, ablam benim","CHP Genel Başkanı Özgür Özel, Manisa'nın Turgutlu ilçesinde düzenlenen halk buluşmasında İYİ Parti lideri Akşener'in ""Bana abla mabla demeyin istemiyorum. Sizin bana vıcık vıcık riyakarlıkla abla demenizi istemiyorum"" sözlerine yanıt verdi. Özel, ""Bugün bütün televizyonlar peşimde, 'Meral Hanım'a bir cevap ver' diye cevabım iki kelime, 'Canı sağ olsun, ablam benim'"" dedi.",https://www.haberler.com/politika/chp-genel-baskani-ozgur-ozel-secimlerde-iktidara-sari-kart-gostermeye-davet-ediyor-16992391-haberi/,https://foto.haberler.com/haber/2024/03/29/ozgur-ozel-den-bana-abla-mabla-demeyin-diyen-16992391_8217_amp.jpg,2024-03-29T19:41:00+0300,haberler.com
27,İBB Başkan adayı Murat Kurum: Sultanbeyli'de fetret dönemini bitirecek miyiz?,"İstanbul Sultanbeyli'deki mitingde konuşan Cumhur İttifakı İBB Başkan adayı Murat Kurum, 2019'daki yerel seçimlerde yüzde 59,04'le AK Parti'nin kazandığı ilçe için, ""Sultanbeyli'de fetret dönemini bitirecek miyiz?"" ifadelerini kullandı.",https://www.haberler.com/politika/ibb-baskan-adayi-murat-kurum-dan-ak-parti-nin-16992237-haberi/,https://foto.haberler.com/haber/2024/03/29/ibb-baskan-adayi-murat-kurum-dan-ak-parti-nin-16992238_603_amp.jpg,2024-03-29T18:44:00+0300,haberler.com
28,Kaotik Evrende Sanat Ve Çağdaşlık!,Vahap Aydoğan bugünkü yazısı için tıklayın.,https://www.haberler.com/yazarlar/vahap-aydogan/kaotik-evrende-sanat-ve-cagdaslik-2848/,https://foto.haberler.com/genel/yazar-yazilari/2024/03/29/kaotik-evrende-sanat-ve-cagdaslik-2848_6956_o.jpg,2024-03-29T01:27:00+0300,haberler.com
29,TEVİTÖL'de gençlerin gücü okul müdüründen daha fazla,Yeşim Mutlu bugünkü yazısı için tıklayın.,https://www.haberler.com/yazarlar/yesim-mutlu/tevitol-de-genclerin-gucu-okul-mudurunden-daha-fazla-2846/,https://foto.haberler.com/genel/yazar-yazilari/2024/03/28/tevitol-de-genclerin-gucu-okul-mudurunden-daha-fazla-2846_2665_o.jpg,2024-03-28T10:18:00+0300,haberler.com
30,Cumhurbaşkanı Erdoğan peş peşe 3 il sıraladı: O kibirli tiplere en güzel cevap olacak,"Roman Dernekleriyle İstişare Toplantısı'na telefonla katılan Cumhurbaşkanı Erdoğan ""Roman kardeşlerim kendilerini vatandaş yerine koymayanlara sandıklarda en güzel cevabı verecek. Gerek Edirne gerek Tekirdağ gerekse Kırklareli'nde böyle bir patlamanın olması o kibirli tiplere en güzel cevap olacaktır"" ifadelerini kullandı.",https://www.haberler.com/guncel/cumhurbaskani-erdogan-roman-vatandaslara-hitap-16993241-haberi/,https://foto.haberler.com/haber/2024/03/30/cumhurbaskani-erdogan-pes-pese-3-il-siraladi-o-16993241_3415_amp.jpg,2024-03-30T13:39:00+0300,haberler.com
31,"Elazığ'da 4,7 büyüklüğünde deprem! Vatandaşlar geceyi dışarıda geçirdi","Dün gece saatlerinde Elazığ Merkez'de 4,7 büyüklüğünde deprem oldu. Çevre illerden de hissedilen deprem sonrası vatandaşlar geceyi dışarıda geçirdi.",https://www.haberler.com/guncel/elazig-da-4-7-buyuklugunde-deprem-meydana-geldi-16993028-haberi/,https://foto.haberler.com/haber/2024/03/30/elazig-da-4-7-buyuklugunde-deprem-16993028_amp.jpg,2024-03-30T09:27:00+0300,haberler.com
32,Sokak ortasında 4 çocuk annesi eşini katleden kocanın ifadesi ortaya çıktı: Aldattığı için öldürdüm,"Muğla'da sokak ortasında 4 çocuk annesi eşini silahla öldüren kocanın ifadesi ortaya çıktı. Cinayet sonrası cesedin başında bekleyen şahıs, polisteki ifadesinde eşinin kendisini aldatması nedeniyle olayı gerçekleştirdiğini söyledi.",https://www.haberler.com/3-sayfa/mugla-da-kiskanclik-cinayeti-esini-sokak-16992613-haberi/,https://foto.haberler.com/haber/2024/03/29/mugla-da-sokak-ortasinda-esini-katleden-kocanin-16992613_5201_amp.jpg,2024-03-29T21:56:00+0300,haberler.com
33,Henüz ömrünün baharındaydı! Diş teknisyeni Nurşah'ın acı sonu,"İstanbul Kağıthane'de otomobilin kontrolünü kaybeden diş teknisyeni Nurşah Kılınç, aracın bariyerleri aşarak elektrik direğine çarpması sonucu feci şekilde can verdi. Kaza anı ise güvenlik kamerası tarafından saniye saniye kaydedildi.",https://www.haberler.com/3-sayfa/henuz-omrunun-baharindaydi-dis-teknisyeni-nursah-16993477-haberi/,https://foto.haberler.com/haber/2024/03/30/henuz-omrunun-baharindaydi-dis-teknisyeni-nursah-16993478_8768_amp.jpg,2024-03-30T11:24:00+0300,haberler.com
34,Tiryakilere kötü haber! Seçim sonrası sigaraya 10 TL zam geleceği iddia edildi,"31 Mart Pazar günü yapılacak yerel seçimler sonrasıyla ilgili ekonomik anlamda çok sayıda iddia ortaya atılırken, bunlara bir yenisi daha eklendi. Sigaraya 1-10 Nisan tarihleri arasında 10 TL'lik dev bir zam geleceği iddia edildi.",https://www.haberler.com/ekonomi/tiryakilere-kotu-haber-secim-sonrasi-sigaraya-10-16991369-haberi/,https://foto.haberler.com/haber/2024/03/29/tiryakilere-kotu-haber-secim-sonrasi-sigaraya-10-16991370_2602_amp.jpg,2024-03-29T15:38:00+0300,haberler.com
35,Kızılcık Şerbeti'nde beklenen an! Yeni gelinin Pembe Hanım'a verdiği ayar herkesin dilinde,"Yeni bölümüyle ekrana gelen Kızılcık Şerbeti dizisinde yeni gelin Görkem'in gerçek yüzünü ortaya çıkardığı sahne gündem yarattı. Pembe Hanım, Görkem'in ""Bana kızım kızım diye konuşup arkamdan kuyumu kazmaya çalışırsanız dünyayı size dar ederim"" sözleri karşısında hayatının şokunu yaşadı.",https://www.haberler.com/yasam/kizilcik-serbeti-nde-beklenen-an-yeni-gelinin-16993270-haberi/,https://foto.haberler.com/haber/2024/03/30/kizilcik-serbeti-nde-beklenen-an-yeni-gelinin-16993271_8134_amp.jpg,2024-03-30T10:53:00+0300,haberler.com
36,"Yapılmayan yola daha fazla dayanamadı, köyün ilk kadın muhtar adayı oldu","Muş'un Çallıdere köyünde ilk kez bir kadın, muhtar adayı oldu. Yıllardır göreve gelen muhtarlar köy yolu için elini taşın altına koymayınca, 27 yaşındaki Bahar İncesu köyde muhtar adayı olan bir erkeğe karşı adaylığını ilan etti.",https://www.haberler.com/yerel/mus-un-varto-ilcesinde-ilk-kez-bir-kadin-muhtar-adayi-16993035-haberi/,https://foto.haberler.com/haber/2024/03/30/yapilmayan-yola-daha-fazla-dayanamadi-koyun-ilk-16993035_1505_amp.jpg,2024-03-30T12:09:00+0300,haberler.com
37,"Kadın muhtar adayı, 8 azasını da kadınlardan seçti; 4 erkek adaya karşı yarışacak","Diyarbakır'ın Yenişehir ilçesinde yaşayan ev kadını Fatima Kantar, yerel seçimlerde oturduğu mahalle için muhtar adayı oldu. 8 azasını da kadınlardan seçen Kantar, 4 erkek adaya karşı yarışacak. 'Kadın elinin değdiği her yer güzelleşir' sloganıyla yola çıkan Kantar, mahalle halkından büyük destek alıyor. Mahalle sakinlerinden Salih Kalır, ""Kadına değer veren herkes oylarını Fatima Kantar'a versin"" ifadelerini kullandı.",https://www.haberler.com/politika/kadin-muhtar-adayi-8-azasini-da-kadinlardan-16993440-haberi/,https://foto.haberler.com/haber/2024/03/30/kadin-muhtar-adayi-8-azasini-da-kadinlardan-16993441_9382_amp.jpg,2024-03-30T11:16:00+0300,haberler.com
38,Seçim yayın yasakları başladı,"Yerel seçimlerde yayın yasakları bu geceden itibaren başladı. Seçim gününe kadar devam edecek bu süre zarfında yayın organlarında siyasi reklam, seçim ve seçim sonuçları ile ilgili haber, tahmin ve yorum yapılmayacak.",https://www.haberler.com/guncel/secimlerde-siyasi-reklam-yasagi-basladi-16992854-haberi/,https://foto.haberler.com/haber/2024/03/30/secim-yayin-yasaklari-basladi-16992854_4111_amp.jpg,2024-03-30T00:51:00+0300,haberler.com
