,title,description,url,img_url,publishing_date,publisher
363,Milli Savunma Bakanlığı'ndan ATAK'lı paylaşım: Teröristler kendilerini bekleyen sondan kurtulamıyor,"Milli Savunma Bakanlığı, yerli ve milli taarruz helikopteri ATAK'ın terörle mücadeledeki etkinliğini vurgulayan bir paylaşımda bulundu. Bakanlık, 'Kahraman pilotlarımızın yetenekleri yerli ve millî gücümüz ATAK ile birleşince teröristler kendilerini bekleyen sondan kurtulamıyor.' ifadesini kullandı.",https://www.haberler.com/politika/milli-savunma-bakanligi-ndan-atak-li-paylasim-16977772-haberi/,https://foto.haberler.com/haber/2024/03/25/milli-savunma-bakanligi-ndan-atak-li-paylasim-16977772_9054_amp.jpg,2024-03-25T12:55:00+0300,haberler.com
364,İspanya'da Telegram kullanımı askıya alındı,"İspanya'da Telegram'la ilgili kritik bir karar alındı. Ülkedeki Ulusal Mahkeme, telif hakları ihlali iddiasıyla platformun kullanımının askıya alınmasına karar verdi. Mahkeme ayrıca telefon operatörlerine uygulamanın kullanımını durdurma talimatı verdi.",https://www.haberler.com/guncel/ispanya-da-telegram-kullanimi-askiya-alindi-16974472-haberi/,https://foto.haberler.com/haber/2024/03/24/ispanya-da-telegram-kullanimi-askiya-alindi-16974472_209_amp.jpg,2024-03-24T08:20:00+0300,haberler.com
365,Fatma Şahin: Barcelona ve Tokyo'ya gidenler Gaziantep'e gelecek,"Gaziantep Büyükşehir Belediye Başkanı Fatma Şahin, konuk olduğu Haberler.com YouTube kanalında yeni dönem için projelerini açıkladı. Tokyo ve Barcelona'da olan su şehri görüntüsünü Gaziantep'e kazandıracaklarını belirten Şahin, bu iki kente gidenlerin artık Gaziantep'e geleceğini söyledi. Şahin, seçimlerde alacağı oy oranını da açıklayarak yüzde 54'ü referans aldığını vurguladı.",https://www.haberler.com/yasam/barcelona-ve-tokyo-ya-gidenler-gaziantep-e-gelecek-16974801-haberi/,https://foto.haberler.com/haber/2024/03/24/barcelona-ve-tokyo-ya-gidenler-gaziantep-e-gelecek-16974802_351_amp.jpg,2024-03-24T09:54:00+0300,haberler.com
366,Rekabet Kurulu devreye girdi! Yemeksepeti'ne soruşturma başlatıldı,"Çevrimiçi yemek siparişi servisi 'Yemeksepeti', kendi kurye hizmetini zorunlu tutma ve üye işletmelerin faaliyetlerini zorlaştırma iddiaları üzerine Rekabet Kurulu tarafından soruşturmaya tabi tutuldu.",https://www.haberler.com/ekonomi/rekabet-kurulu-devreye-girdi-yemeksepeti-ne-16969363-haberi/,https://foto.haberler.com/haber/2024/03/22/rekabet-kurulu-devreye-girdi-yemeksepeti-ne-16969364_2505_amp.jpg,2024-03-22T10:30:00+0300,haberler.com
367,"Fransa Rekabet Kurumu, Google'a 250 milyon euro ceza verdi","Fransa Rekabet Kurumu, Google'a içerik ücretlendirilmesinde AB yasalarına aykırı davrandığı gerekçesiyle 250 milyon Euro ceza kesti.",https://www.haberler.com/guncel/fransa-rekabet-kurumu-google-a-250-milyon-avro-ceza-kesti-16963159-haberi/,https://foto.haberler.com/haber/2024/03/20/fransa-rekabet-kurumu-google-a-250-milyon-euro-16963159_7098_amp.jpg,2024-03-20T13:34:00+0300,haberler.com
368,Çin'de Drone Sektörü Hızla Gelişiyor,"Çin'in drone sektörü, insansız hava araçlarının ekonomide daha fazla kullanılmasıyla güçlü bir gelişim sergiliyor. Ülkede kayıtlı İHA sayısı yüzde 32,2 artarak 1,27 milyona ulaştı. Drone işletmeciliği yapan şirket sayısı 19.000'e, drone pilotu sayısı ise 194.000'e yükseldi.",https://www.haberler.com/guncel/cin-de-drone-sektoru-hizla-gelisiyor-16993791-haberi/,https://www.haberler.com/mstatic/haberlercom_haberi.jpg,2024-03-30T13:18:00+0300,haberler.com
369,Elektronik Haberleşme Sektörü Gelirleri Rekor Kırdı,"Ulaştırma ve Altyapı Bakanı Abdulkadir Uraloğlu, elektronik haberleşme sektörü operatör gelirlerinin 2023'te rekor bir artışla 224 milyar lirayı aştığını açıkladı. Ayrıca, mobil abone sayısı ve fiber altyapı uzunluğunda da önemli artışlar yaşandığı belirtildi.",https://www.haberler.com/ekonomi/elektronik-haberlesme-sektoru-gelirleri-rekor-kirdi-16993774-haberi/,https://www.haberler.com/mstatic/haberlercom_haberi.jpg,2024-03-30T13:10:00+0300,haberler.com
370,Elazığ'da 4.7 Büyüklüğünde Deprem Meydana Geldi,Elazığ'ın Merkez bölgesinde 4.7 büyüklüğünde bir deprem meydana geldi. Depremin ayrıntıları ve yaşananlar hakkında bilgi verildi.,https://www.haberler.com/teknoloji/elazig-da-4-7-buyuklugunde-deprem-meydana-geldi-16993753-haberi/,https://www.haberler.com/mstatic/haberlercom_haberi.jpg,2024-03-30T13:08:00+0300,haberler.com
371,YSK Üyeleri Seçim Sonuçlarını Kokpit Ekranından Takip Edecek,"Yüksek Seçim Kurulu (YSK) üyeleri, yarınki Mahalli İdareler Genel Seçimleri'nin sonuçlarını, ""kokpit"" adı verilen ekrandan takip edecek. YSK, yarın yapılacak yerel seçime yönelik teknik hazırlıklarını da tamamladı. Seçimle ilgili her türlü iş ve işlemlerin yürütüldüğü, bilgi ve belgenin üretildiği, elektronik ortamda saklandığı, güvenli bir şekilde korunduğu, seçmen kütüklerinin sürekli güncellendiği Seçim Bilişim Sistemi (SEÇSİS), toplanan seçim sonuçlarının eş zamanlı izlenebilmesine olanak tanıyor. Kurulun kendi mühendisleri ile HAVELSAN ortak çalışması sonucu, seçim mevzuatına uygun yazılımla hazırlanan SEÇSİS, seçim sonuçlarının eş zamanlı olarak siyasi partilerle paylaşılmasını da sağlıyor. Bu kapsamda, SEÇSİS Veri Merkezi'nde, seçim sonuçlarını eş zamanlı izlemek amacıyla hazırlıklar tamamlandı. YSK Başkanı Ahmet Yener, kurul üyeleri ve siyasi partilerin YSK temsilcileri kurul odasında, seçim sonuçlarını ""kokpit"" adı verilen ekran üzerinden izleyecek. ""Kokpit"" ekranı, YSK konferans salonunda, seçime girme yeterliliği bulunan siyasi partilere de açık olacak. İlçe seçim kurullarında SEÇSİS'e girilen veriler doğrudan YSK'ya ulaşacak, eş zamanlı olarak da siyasi partilerle paylaşılacak.",https://www.haberler.com/guncel/ysk-uyeleri-secim-sonuclarini-kokpit-ekranindan-takip-edecek-16993631-haberi/,https://www.haberler.com/mstatic/haberlercom_haberi.jpg,2024-03-30T12:24:00+0300,haberler.com
372,Ulaştırma ve Altyapı Bakan Yardımcısı: Küresel İnternet Aktörleri Sorumlu Hareket Etmeli,"Ulaştırma ve Altyapı Bakan Yardımcısı Ömer Fatih Sayan, seçim mevzuatı ve YSK kararlarına ilişkin küresel internet aktörlerinin sorumlu bir şekilde hareket etmesi gerektiğini belirtti.",https://www.haberler.com/politika/ulastirma-ve-altyapi-bakan-yardimcisi-kuresel-internet-aktorleri-sorumlu-hareket-etmeli-16993055-haberi/,https://www.haberler.com/mstatic/haberlercom_haberi.jpg,2024-03-30T06:29:00+0300,haberler.com
373,30 Mart 2024 Konya elektrik kesintisi! GÜNCEL KESİNTİLER! Konya'da elektrik ne zaman gelecek?,"Konya'da elektrik ne zaman gelecek? 30 Mart 2024 günü Konya'nın çeşitli ilçelerinde elektrik kesintisi yaşanacak ve kesinti gün boyu sürecek. 30 Mart Konya'nın hangi ilçelerinde elektrik kesintisi yaşanacak merak ediliyor. Peki, Konya elektrik kesintisi kaç saat sürecek? Konya'ya elektrik ne zaman gelecek? Konya elektrik kesintisi ve detayları…",https://www.haberler.com/haberler/30-mart-2024-konya-elektrik-kesintisi-guncel-16992931-haberi/,https://foto.haberler.com/haber/2024/03/30/30-mart-2024-konya-elektrik-kesintisi-guncel-16992931_8733_amp.jpg,2024-03-30T00:58:00+0300,haberler.com
374,30 Mart İzmir GEDİZ elektrik kesintisi! GÜNCEL KESİNTİLER! Bugün İzmir'de elektrik ne zaman gelecek? İzmir'de elektrik kesintisi!,"Gediz elektrik kesintisi listesi! İzmir'de elektrik ne zaman gelecek? 30 Mart günü İzmir'in çeşitli ilçelerinde elektrik kesintisi yaşanacak ve kesinti gün boyu sürecek. Peki, 30 Mart günü İzmir'in hangi ilçelerinde elektrik kesintisi yaşanacak. İzmir'de Buca elektrik kesintisi, Karabağlar elektrik kesintisi, Bornova elektrik kesintisi araştırmaları yapılıyor. Peki, İzmir elektrik kesintisi kaç saat sürecek? İzmir'e elektrik ne zaman gelecek? İzmir elektrik kesintisi ve detayları…",https://www.haberler.com/haberler/30-mart-izmir-gediz-elektrik-kesintisi-guncel-16992889-haberi/,https://foto.haberler.com/haber/2024/03/30/30-mart-izmir-gediz-elektrik-kesintisi-guncel-16992889_1560_amp.jpg,2024-03-30T00:30:00+0300,haberler.com
375,"42 bin lira maaş, sigorta, dayalı döşeli ev ve karavana rağmen tarımın kalbinde çoban bulunamıyor","Sivas'ta aile çobanı arayan Niyazi Mit, koyun yetiştiriciliği için sağlanacak olan maaş, sigorta, barınma, giyim ve yeme içme gibi temel ihtiyaçlar, yaz aylarında arazide rahat etmesi için karavan gibi imkanlar sağlamasına rağmen çoban bulamıyor.",https://www.haberler.com/guncel/tarimin-kalbi-sivas-ta-coban-bulunamiyor-16993265-haberi/,https://foto.haberler.com/haber/2024/03/30/42-bin-lira-maas-da-var-cocuklarin-okul-16993265_624_amp.jpg,2024-03-30T11:46:00+0300,haberler.com
376,"Mehmet Şimşek açıkladı: Dünya Bankası'ndan 1,5 milyar dolarlık kaynak temin ettik","Hazine ve Maliye Bakanı Mehmet Şimşek, Türkiye'nin ekonomi yol haritasına duyulan güvenle dış kaynak akışının bu yıl da devam ettiğini belirterek, ""Dünya Bankası ile yürüttüğümüz verimli işbirliği kapsamında 3 ayrı proje finansmanı için 1,5 milyar dolarlık kaynak temin ettik. Söz konusu kaynak, Türkiye'nin enerji arz güvenliğinin sağlanması ve işletmelerin yeşil dönüşüm sürecinin desteklenmesi amaçları için kullanılacak"" dedi.",https://www.haberler.com/guncel/hazine-ve-maliye-bakani-mehmet-simsek-turkiye-nin-ekonomi-yol-haritasina-duyulan-guvenle-dis-kaynak-16990044-haberi/,https://foto.haberler.com/haber/2024/03/29/mehmet-simsek-acikladi-dunya-bankasi-ndan-1-5-16990044_5997_amp.jpg,2024-03-29T11:57:00+0300,haberler.com
377,Dolar ve euro ne kadar? İşte kurlarda son durum,"Güne değer kazancıyla başlayan dolar 32,3690 TL seviyesinden işlem görüyor. Euro 34,910 TL'den sterlin ise 40,9480 TL seviyesinden satılıyor. Dünya piyasalarında Fed Başkanı Powell'ın bugünkü açıklamaları izlenecek.",https://www.haberler.com/ekonomi/dolar-tl-gune-deger-kazanciyla-basladi-16990125-haberi/,https://foto.haberler.com/haber/2024/03/29/dolar-ve-euro-ne-kadar-iste-kurlarda-son-durum-16990125_3525_amp.jpg,2024-03-29T11:09:00+0300,haberler.com
378,Kira gelir beyannameleri için başvuru süresi uzatıldı,Gelir İdaresi Başkanlığı yazılı bir açıklama yaparak 1 Nisan'da sona ermesi beklenen 2023 yılı kira gelir beyannamesi başvurularının 5 Nisan Cuma gününe kadar uzatıldığını bildirdi.,https://www.haberler.com/ekonomi/gelir-vergisi-beyannamesi-verme-suresi-uzatildi-16989474-haberi/,https://foto.haberler.com/haber/2024/03/29/kira-gelir-beyannameleri-icin-basvuru-suresi-16989474_4485_amp.jpg,2024-03-29T09:57:00+0300,haberler.com
379,Akaryakıt fiyatlarının 3 haneye çıkacağı iddiası sonrası Cumhurbaşkanlığından açıklama geldi,"Akaryakıt fiyatlarının seçim sonrası daha da artarak üç haneli rakamlara çıkacağı gerekçesiyle tabelalara değişim talimatı verildiği iddiası kamuoyunda infial yarattı. İletişim Başkanlığı'ndan yapılan açıklamada ""Yapılan araştırmalar sonucunda, akaryakıt dağıtım şirketlerinin iddia edildiği gibi bir talepte bulunmadığı tespit edilmiştir. Akaryakıt dağıtım şirketlerinin, 'bu sene sonunda akaryakıt fiyatlarının üç hanelere geleceğine dair' bir tahmininin bulunmadığı belirlenmiştir"" denildi.",https://www.haberler.com/ekonomi/akaryakit-fiyatlarinin-3-haneye-cikacagi-iddiasi-16989841-haberi/,https://foto.haberler.com/haber/2024/03/29/akaryakit-fiyatlarinin-3-haneye-cikacagi-iddiasi-16989842_4444_amp.jpg,2024-03-29T07:47:00+0300,haberler.com
380,Kripto para borsası FTX'in kurucusu Sam Bankman-Fried'a 25 yıl hapis cezası,"Kasım 2022'de iflas eden ve istifa ettiğini söyleyen kripto para borsası FTX'in kurucusu ve CEO'su Sam Bankman-Fried, dolandırıcılık ve kara para aklama iddiasıyla yargılandığı ceza davasında 25 yıl hapis cezası aldı. Kamuoyunda ""Kripto Kralı"" olarak bilinen Bankman-Fried'ın cezasına itiraz etmeyi planladığı öğrenildi.",https://www.haberler.com/ekonomi/kripto-para-borsasi-ftx-in-kurucusu-sam-bankman-fried-a-25-yil-hapis-cezasi-16989025-haberi/,https://foto.haberler.com/haber/2024/03/28/kripto-para-borsasi-ftx-in-kurucusu-sam-bankman-16989025_9144_amp.jpg,2024-03-28T20:01:00+0300,haberler.com
381,Emeklilere 8-12 bin liralık promosyon ödemesine özel bankalar da dahil oldu,"Cumhurbaşkanı Recep Tayyip Erdoğan'ın duyurduğu, kamu bankaları tarafından emeklilere verilecek 8 bin lira ile 12 bin lira arasındaki promosyona özel bankalar da dahil oldu. SGK, promosyon ödemeleriyle ilgili 19 banka ile protokol imzaladı.",https://www.haberler.com/ekonomi/emeklilere-8-12-bin-liralik-promosyon-odemesine-16988825-haberi/,https://foto.haberler.com/haber/2024/03/28/emeklilere-8-12-bin-liralik-promosyon-odemesine-16988825_4391_amp.jpg,2024-03-28T18:36:00+0300,haberler.com
382,"Bakanlık harekete geçti! ""Jasmine bebek"" için toplatma kararı","Ticaret Bakanlığından, güvensiz olduğu ortaya çıkan ""Jasmine"" bebekle ilgili toplatma kararı verildi. Karar üzerine gazetelere ilan veren üretici firma, mevzuatta belirtilen temel gerekleri sağlamadığı belirlenen oyuncağın bedeli karşılığında iade edilmesi çağrısı yaptı.",https://www.haberler.com/ekonomi/bakanlik-harekete-gecti-jasmine-bebek-icin-16988620-haberi/,https://foto.haberler.com/haber/2024/03/28/bakanlik-harekete-gecti-jasmine-bebek-icin-16988620_2732_amp.jpg,2024-03-28T17:23:00+0300,haberler.com
383,Cumhurbaşkanı Erdoğan: Temmuz ayında emekli maaşlarını masaya yatıracağız,"Cumhurbaşkanı Erdoğan Bursa'daki mitingde emeklileri ilgilendiren bir açıklamada bulundu. Erdoğan ""Temmuz ayında enflasyona göre emekli maaşlarını tekrar masaya yatıracağız."" dedi. Erdoğan ayrıca muhalefete de tepki göstererek CHP'nin çeşitli şehirlerde DEM Parti ile karanlık ittifaklar kurduğunu belirtti.",https://www.haberler.com/ekonomi/cumhurbaskani-erdogan-temmuz-ayinda-enflasyona-16987887-haberi/,https://foto.haberler.com/haber/2024/03/28/cumhurbaskani-erdogan-temmuz-ayinda-enflasyona-16987887_785_amp.jpg,2024-03-28T14:32:00+0300,haberler.com
384,"Dolar, euro ne kadar oldu? İşte kurlarda son durum","Yeni güne değer kazancıyla başlayan dolar, 32,3130 seviyesinden işlem görüyor. Euro ise 34,9620 TL'den satılıyor. Piyasalarda bugün yurt içinde Türkiye Cumhuriyet Merkez Bankası Para Politikası Kurulu (PPK) Toplantı Özeti, yurt dışında ise ABD'de büyüme verileri takip edilecek.",https://www.haberler.com/ekonomi/dolar-tl-gune-deger-kazanciyla-basladi-16986791-haberi/,https://foto.haberler.com/haber/2024/03/28/dolar-tl-gune-deger-kazanciyla-basladi-16986791_7512_amp.jpg,2024-03-28T10:25:00+0300,haberler.com
385,Emeklilerin promosyon ödemeleri bugün başlıyor! Başvurular e-devlet üzerinden yapılabiliyor,Emeklilerin banka promosyon tutarlarında artışa gidildi. Kamu bankaları 8 bin ile 12 bin lira arasında değişen tutarlarda promosyon ödeyecek. Başvurular bankalardan ya da e-devlet üzerinden yapılabiliyor. Promosyon ödemeleri bugün başlıyor.,https://www.haberler.com/ekonomi/emeklilerin-promosyon-odemeleri-bugun-basliyor-16986627-haberi/,https://foto.haberler.com/haber/2024/03/28/emeklilerin-promosyon-odemeleri-bugun-basliyor-16986628_507_amp.jpg,2024-03-28T08:24:00+0300,haberler.com
386,S&P Global Türkiye'nin büyüme tahminini yükseltti,"Uluslararası kredi derecelendirme kuruluşu S&P Global, Türkiye'nin 2024 için büyüme tahminini yüzde 2,4'ten yüzde 3'e yükseltti. Ayrıca 2025 için tahmin yüzde 2,7'den yüzde 3'e çıkarılırken 2026 için ise tahmin, yüzde 3'ten yüzde 2,8'e çekildi.",https://www.haberler.com/ekonomi/s-p-global-turkiye-nin-buyume-tahminini-yukseltti-16983794-haberi/,https://foto.haberler.com/haber/2024/03/27/s-p-global-turkiye-nin-buyume-tahminini-yukseltti-16983794_4118_amp.jpg,2024-03-27T11:10:00+0300,haberler.com
387,Dolar ve euro bugün ne kadar? İşte kurlardaki son durum,"Dün 32,1990 TL'den kapanan dolar, İstanbul serbest piyasada 32,2270 TL'den, euro ise 34,9070 TL'den güne başladı. Dünya piyasalarında Fed'in yarın açıklayacağı büyüme verileri takip edilirken ülkelerin merkez bankalarının faiz indirimine ne zaman geçeceği ise belirsizliğini koruyor.",https://www.haberler.com/ekonomi/istanbul-serbest-piyasada-dolar-ve-euro-yukseliste-16983583-haberi/,https://foto.haberler.com/haber/2024/03/27/dolar-ve-euro-bugun-ne-kadar-iste-kurlardaki-son-16983583_9401_amp.jpg,2024-03-27T09:50:00+0300,haberler.com
388,Emeklilere verilecek promosyon için başvurular rekor seviyede,"Cumhurbaşkanı Recep Tayyip Erdoğan'ın, geçtiğimiz günlerde ""Kamu bankalarımız bu yılki promosyon ödemesi miktarlarını alınan aylığa göre 8 bin lira ile 12 bin lira arasında belirledi."" açıklaması sonrası promosyon başvurularında rekor kırıldı. Promosyon başvurularının ilk gününde Ziraat Bankası'na 446 bin, Vakıfbank ve Halkbank'a da toplam 100 bin kişi başvurdu.",https://www.haberler.com/ekonomi/emeklilere-verilecek-promosyon-icin-basvurular-16982935-haberi/,https://foto.haberler.com/haber/2024/03/26/emeklilere-verilecek-promosyon-icin-basvurular-16982936_1739_amp.jpg,2024-03-26T22:57:00+0300,haberler.com
389,"Ticaret Bakanlığı ve MSB'den ""İsrail ile silah ticareti yapıldığı"" iddialarına ilişkin peş peşe açıklamalar","Ticaret Bakanlığı ve Milli Savunma Bakanlığı, sosyal medya ve çeşitli internet sitelerinde TÜİK verilerine dayandırılarak İsrail ile silah ticareti yapıldığına ilişkin iddialara yönelik açıklama yaptı. MSB ""iş birliği"" iddialarını yalanlarken, Ticaret Bakanlığı ise iddiaya konu ihracat listesindeki ürünlerin savaş silahları ve mühimmatı değil, spor ve av gibi kişisel amaçlı kullanılan, yivsiz av tüfeği yedek parça ve aksesuarları ile balıkçılık malzemeleri olduğunu belirtti.",https://www.haberler.com/ekonomi/ticaret-bakanligi-israil-ile-silah-ticareti-iddialarini-yalanladi-16982519-haberi/,https://foto.haberler.com/haber/2024/03/26/ticaret-bakanligi-israil-ile-silah-ticareti-16982519_6865_amp.jpg,2024-03-26T22:17:00+0300,haberler.com
390,Bakan Işıkhan: Ankara Büyükşehir Belediyesi şirketleriyle birlikte SGK'ya en borçlu belediye,"Çalışma ve Sosyal Hizmetler Bakanı Vedat Işıkhan, SGK'ya en borçlu 5 belediyenin tamamının CHP'li olduğunu belirtti. Bakan Işıkhan, ""Ankara Büyükşehir Belediyesi'nin prim borcu son 5 yılda 20 katına çıkmış. İstanbul Büyükşehir Belediyesi, İzmir Büyükşehir Belediyesi ve diğer CHP'li belediyeler de aynı durumda."" ifadelerini kullandı.",https://www.haberler.com/politika/bakan-isikhan-sgk-ya-en-borclu-5-belediyenin-16982082-haberi/,https://foto.haberler.com/haber/2024/03/26/bakan-isikhan-sgk-ya-en-borclu-5-belediyenin-16982083_8292_amp.jpg,2024-03-26T17:12:00+0300,haberler.com
391,Çikolataseverlere kötü haber! Kakao fiyatlarında tarihi rekor,Fildişi Sahili ve Gana'daki kakao fabrikalarının üretimi kısma veya durdurma kararı alması nedeniyle kakao fiyatları rekor kırmaya devam ediyor. Fabrikaların kararı sonrası arzdaki azalışın etkisiyle kakaonun ton fiyatı 10 bin doların üzerine çıktı.,https://www.haberler.com/ekonomi/kakaonun-ton-fiyati-tum-zamanlarin-en-yuksek-seviyesine-cikti-16981710-haberi/,https://foto.haberler.com/haber/2024/03/26/cikolataseverlere-kotu-haber-kakao-fiyatlarinda-16981710_2876_amp.jpg,2024-03-26T16:24:00+0300,haberler.com
392,Cumhurbaşkanı Erdoğan'dan dikkat çeken enflasyon mesajı: Ne verirsek verelim dipsiz kuyu misali kaybolup gidiyor,"Partisinin Aksaray mitinginde enflasyonla mücadele vurgusu yapan Cumhurbaşkanı Erdoğan, ""Yılın ikinci yarısında enflasyonun düşmesi ile elimiz rahatlayacak. Öncelik enflasyonu düşürmek. Ne verirsek verelim dipsiz kuyu misali kaybolup gidiyor. Alım gücündeki düşüşü telafi için adımlar atıyoruz"" dedi.",https://www.haberler.com/politika/cumhurbaskani-erdogan-dan-dikkat-ceken-enflasyon-16981527-haberi/,https://foto.haberler.com/haber/2024/03/26/cumhurbaskani-erdogan-dan-dikkat-ceken-enflasyon-16981528_3504_amp.jpg,2024-03-26T14:56:00+0300,haberler.com
393,"Dolar, euro bugün ne kadar? İşte kurlarda son durum","Dolar güne değer kazancıyla başlaması sonrasında 32,1720 TL seviyesinden işlem görüyor. Euro ise 34,9480 TL'den satılıyor. Dolar endeksi yüzde 0,1 düşüşle 104,1 oldu.",https://www.haberler.com/ekonomi/dolar-tl-32-17-seviyesinden-islem-goruyor-16980450-haberi/,https://foto.haberler.com/haber/2024/03/26/dolar-euro-bugun-ne-kadar-iste-kurlarda-son-16980450_6807_amp.jpg,2024-03-26T10:50:00+0300,haberler.com
394,"MHP'li milletvekili Kaşlı'dan emeklilere öneri: Devletten beklemek yerine domates, su satmalı","MHP Aksaray Milletvekili Ramazan Kaşlı, katıldığı canlı yayında emeklilerle ilgili ek iş önerisinde bulundu. Kaşlı, ""Sadece devletten beklemek yerine aile ekonomisine katkı sağlayacak bir şeyler bulmasını, uğraşmasını isteriz."" dedi. Kaşlı, ""Domates mi alır satarız, su mu alır satarız?"" ifadeleriyle 10 bin lira ek gelir getirecek işler yapılmasını önerdi.",https://www.haberler.com/politika/mhp-li-milletvekili-kasli-devletten-beklemek-16980270-haberi/,https://foto.haberler.com/haber/2024/03/26/mhp-li-milletvekili-kasli-devletten-beklemek-16980270_7342_amp.jpg,2024-03-26T10:20:00+0300,haberler.com
395,"SGK'dan ölüm aylığı alan 3,3 milyon hak sahibine başvurmaları halinde 5 bin TL promosyon ödenecek","Cumhurbaşkanı Erdoğan'ın geçtiğimiz günlerde ""Kamu bankaları emeklilere 8-12 bin lira arasında promosyon ödemesi yapacak"" açıklaması sonrası SGK'dan bir hamle daha geldi. Yapılan açıklamaya göre SGK'dan ölüm aylığı alan 3,3 milyon hak sahibine de başvurmaları halinde bankalar tarafından 5 bin TL promosyon ödenecek.",https://www.haberler.com/ekonomi/sgk-dan-olum-ayligi-alan-3-3-milyon-hak-sahibine-16979709-haberi/,https://foto.haberler.com/haber/2024/03/25/sgk-dan-olum-ayligi-alan-3-3-milyon-hak-sahibine-16979709_5100_amp.jpg,2024-03-25T21:40:00+0300,haberler.com
396,Bakan Işıkhan'dan emeklilere özel indirim ve kampanya müjdesi,"Çalışma ve Sosyal Güvenlik Bakanı Vedat Işıkhan'dan emeklilere özel indirim ve kampanya müjdesi geldi. Bakan Işıkhan, Kırşehir'deki temasları sırasında yaptığı açıklamada, ""PTT AVM'de, Tarım Kredi Kooperatif Marketleri'nde, Türk Hava Yolları'nda, TCDD'de, GSM operatörlerinde, sinema ve tiyatrolarda, PTT Kargo'da emeklilere özel indirimler ve kampanyalar başlatacağız. Ayrıca Türkiye'nin önde gelen zincir marketlerinde ve giyim mağazalarında emeklilere özel indirimler sağlayacağız."" dedi.",https://www.haberler.com/ekonomi/bakan-isikhan-dan-emeklilere-ozel-indirim-ve-16979264-haberi/,https://foto.haberler.com/haber/2024/03/25/bakan-isikhan-dan-emeklilere-ozel-indirim-ve-16979264_4462_amp.jpg,2024-03-25T20:30:00+0300,haberler.com
397,Cumhurbaşkanı Erdoğan'dan seyyanen zam bekleyen emeklilere yeni mesaj,"Cumhurbaşkanı Erdoğan, Çorum mitinginde yaptığı konuşmada seyyanen zam bekleyen emekliler için yeni sözler sarfetti. Erdoğan açıklamasında ""Emeklilerimizin Ramazan Bayramı ikramiyesini ise 2-5 Nisan arasında hesaplarına yatırıyoruz. İnşallah bundan sonra da emeklilerimizin yanında olmayı sürdüreceğiz"" dedi.",https://www.haberler.com/politika/cumhurbaskani-erdogan-dan-seyyanen-zam-bekleyen-16978893-haberi/,https://foto.haberler.com/haber/2024/03/25/cumhurbaskani-erdogan-dan-seyyanen-zam-bekleyen-16978894_3528_amp.jpg,2024-03-25T17:13:00+0300,haberler.com
398,"Erdoğan: Enflasyon yılın 2. yarısında düşecek, alım gücü eskisinin de üzerine çıkacak","AK Parti'nin Tokat mitinginde konuşan Cumhurbaşkanı Erdoğan, enflasyonun yılın 2. yarısında düşeceğini söyledi. Cumhurbaşkanı Erdoğan ""Alım gücü eskisinin de üzerine çıkacak"" ifadelerini kullandı.",https://www.haberler.com/politika/erdogan-enflasyon-yilin-2-yarisinda-dusecek-16978154-haberi/,https://foto.haberler.com/haber/2024/03/25/erdogan-enflasyon-yilin-2-yarisinda-dusecek-16978154_7540_amp.jpg,2024-03-25T15:19:00+0300,haberler.com
399,Seyyanen zam iddialarına AK Parti isim son noktayı koydu: Böyle bir çalışma yok,"Milyonlarca emeklinin seyyanen zam beklentileriyle ilgili bir değerlendirmede bulunan AK Parti Grup Başkanı Abdullah Güler, ""Bakanlığımız ve Cumhurbaşkanımız böyle bir çalışma arz ederse bizim haberimiz olacak. Ama bizim elimizde muhalefetin dediği gibi 5 binlik 10 binlik seyyanen zam söz konusu değil, böyle bir çalışmamız yok"" dedi.",https://www.haberler.com/politika/seyyanen-zam-iddialarina-ak-partili-isim-son-16977635-haberi/,https://foto.haberler.com/haber/2024/03/25/seyyanen-zam-iddialarina-ak-partili-isim-son-16977636_8319_amp.jpg,2024-03-25T13:23:00+0300,haberler.com
400,"Yatırımcılar dikkat! Gram, çeyrek ve cumhuriyet altını ne kadar?","Altının gramı, haftaya değer kazancıyla başlayarak 2 bin 241 lira seviyesinden işlem görüyor. Çeyrek altın 3 bin 760 liradan, Cumhuriyet altını ise 15 bin 290 liradan satılıyor.",https://www.haberler.com/ekonomi/altinin-gram-fiyati-deger-kazanciyla-haftaya-basladi-16977236-haberi/,https://foto.haberler.com/haber/2024/03/25/yatirimcilar-dikkat-gram-ceyrek-ve-cumhuriyet-16977236_2424_amp.jpg,2024-03-25T10:54:00+0300,haberler.com
