title,description,url,img_url,publishing_date,publisher
AK Parti'nin Yeniden Refah ziyaretine damga vuran anlar: Bizim yüzümüzden kaybettiğiniz belediye yok çok şükür,"AK Parti heyeti, bayramlaşma ziyaretleri kapsamında Yeniden Refah Partisi'ni ziyaret ederken, görüşmede ilginç anlar yaşandı. YRP Genel Başkan Yardımcısı Mehmet Fatih Uğurlu yerel seçimlerle ilgili, ""Seçimlerde çok şükür başarı yakaladık, üçüncü parti olduk. Bizim yüzümüzden kaybettiğiniz belediye yok çok şükür."" ifadelerini kullandı. Uğurlu'nun çıkışı karşısında AK Parti heyeti tebessüm etti.",https://www.haberler.com/politika/ak-parti-nin-yeniden-refah-ziyaretine-damga-vuran-17229583-haberi/,https://foto.haberler.com/haber/2024/04/11/ak-parti-nin-yeniden-refah-ziyaretine-damga-vuran-17229583_6853_amp.jpg,2024-04-11 19:15:00+03:00,haberler.com
İstanbul'da hafta başından itibaren sıcaklıklar artacak,"Ramazan Bayramı'nda rüzgarın etkisiyle serin bir havanın yaşandığı İstanbul'da sıcaklıklar hafta başından itibaren artacak. Uzmanlar yazın gelişini müjdelerken, megakentte sıcaklıklarda 4-5 derece artış görülecek.",https://www.haberler.com/yasam/istanbul-da-hafta-basindan-itibaren-sicakliklar-17229502-haberi/,https://foto.haberler.com/haber/2024/04/11/istanbul-da-hafta-basindan-itibaren-sicakliklar-17229503_425_amp.jpg,2024-04-11 18:34:00+03:00,haberler.com
Kırıkkale'de Çeşnigir Köprüsü ve Kanyonu Bayram Tatiliyle Ziyaretçi Akınına Uğruyor,"Kırıkkale'de Anadolu Selçuklu döneminden günümüze kadar ihtişamını koruyan Çeşnigir Köprüsü ve kanyonunda, Ramazan Bayramı tatili dolayısıyla ziyaretçi yoğunluğu yaşanıyor. Köprüde hatıra fotoğrafı çekenler, tekne turu yapanlar ve balık tutanlar, tarihi ve doğal güzellikleri bir arada yaşama fırsatı buluyor.",https://www.haberler.com/yerel/kirikkale-de-cesnigir-koprusu-ve-kanyonu-bayram-tatiliyle-ziyaretci-akinina-ugruyor-17229487-haberi/,https://foto.haberler.com/haber/2024/04/11/tarih-ve-doganin-ic-ice-oldugu-mekanda-bayram-17229487_amp.jpg,2024-04-11 18:16:00+03:00,haberler.com
İstanbul Beylikdüzü'nde eğlence mekanı çıkışında kadınlar arasında kavga,"İstanbul Beylikdüzü'ndeki bir eğlence mekanı çıkışında kadınlar arasında kavga çıktı. Kadınların birbirine tokat atarak saldırdığı ve birbirlerinin saçlarını çektiği kavga, vatandaşların müdahalesiyle son bulurken olay anı cep telefonu kamerasına yansıdı.",https://www.haberler.com/3-sayfa/istanbul-beylikduzu-nde-eglence-mekani-cikisinda-kadinlar-arasinda-kavga-cikti-17229187-haberi/,https://foto.haberler.com/haber/2024/04/11/istanbul-beylikduzu-nde-eglence-mekani-cikisinda-17229187_6039_amp.jpg,2024-04-11 18:06:00+03:00,haberler.com
Galatasaray'ın Süper Kupa'yı alacağı maç belli oldu,"PFDK, Süper Kupa maçında sahadan çekilen Fenerbahçe'yi 3-0 hükmen mağlup saydı. Kararın, Tahkim Kurulu ve TFF Yönetim Kurulu tarafından onaylanması gerekiyor. Onayın ardından Galatasaray'ın, Süper Lig'deki ilk iç saha maçı olan Pendikspor maçında kupayı kaldırması bekleniyor.",https://www.haberler.com/spor/galatasaray-in-super-kupa-yi-alacagi-mac-belli-17229469-haberi/,https://foto.haberler.com/haber/2024/04/11/galatasaray-in-super-kupa-yi-alacagi-mac-belli-17229470_472_amp.jpg,2024-04-11 18:03:00+03:00,haberler.com
Kurultay iptal mi ediliyor? Adaylığını açıklayan İYİ Parti'nin ağır topundan zehir zemberek çıkış,"İYİ Parti'de Genel Başkan Meral Akşener'in aday olmayacağı olağanüstü kurultaya sayılı günler kala, genel başkanlık için aday olan Koray Aydın'dan çarpıcı bir açıklama geldi. Aydın, olağanüstü kurultayın iptal edilme girişimlerinin olduğunu öne sürüp Akşener'e çağrıda bulunarak, ""Olağanüstü kurultayın iptal edilmesi, İYİ Parti'nin siyaset ve toplum nazarındaki güvenilirliğini ve ciddiyetini sarsacaktır."" dedi.",https://www.haberler.com/politika/kurultay-iptal-mi-ediliyor-adayligini-aciklayan-17229449-haberi/,https://foto.haberler.com/haber/2024/04/11/kurultay-iptal-mi-ediliyor-adayligini-aciklayan-17229449_3580_amp.jpg,2024-04-11 17:55:00+03:00,haberler.com
Cumhurbaşkanı Erdoğan 12 yıl sonra ilk kez Irak'a resmi ziyarette bulunacak,"Cumhurbaşkanı Erdoğan, 12 yıl sonra ilk kez Irak'a resmi ziyaret gerçekleştirecek. Nisan ayı sonunda gerçekleşecek ziyarette en önemli konu başlığı PKK terör örgütüyle mücadele olacak. Yaz aylarında Kuzey Irak'a düzenlenmesi beklenen operasyon tüm ayrıntılarıyla ele alınacak.",https://www.haberler.com/politika/cumhurbaskani-erdogan-12-yil-sonra-ilk-kez-irak-a-17229446-haberi/,https://foto.haberler.com/haber/2024/04/11/cumhurbaskani-erdogan-12-yil-sonra-ilk-kez-irak-a-17229446_9778_amp.jpg,2024-04-11 17:55:00+03:00,haberler.com
PFDK'dan Fenerbahçe'ye ağır fatura! Süper Kupa'nın cezası belli oldu,"PFDK, Fenerbahçe'nin Galatasaray ile karşı karşıya geldiği maçta sahadan çekilmesiyle ilgili kararını resmen açıkladı. Sarı-lacivertliler, 3-0 hükmen mağlup sayıldı ve 4 milyon TL para cezasına çarptırıldı.",https://www.haberler.com/guncel/pfdk-fenerbahce-nin-super-kupa-macinda-3-0-17229317-haberi/,https://foto.haberler.com/haber/2024/04/11/pfdk-fenerbahce-nin-super-kupa-macinda-3-0-17229317_8689_amp.jpg,2024-04-11 17:17:00+03:00,haberler.com
İmamoğlu'na memleketi Trabzon'da davullu zurnalı karşılama: Cumhurbaşkanım Allah'ına kurban,"İBB Başkanı Ekrem İmamoğlu ve Dilek İmamoğlu, Ramazan Bayramı dolayısıyla memleketi Trabzon'a gitti. İmamoğlu'nu havalimanında davul-zurna eşliğinde karşılayan coşkulu kalabalık, ""Cumhurbaşkanım Allah'ına kurban"" ve ""Ekrem abi gelecek sensin"" sloganları attı.",https://www.haberler.com/politika/imamoglu-na-memleketi-trabzon-da-davullu-zurnali-17229386-haberi/,https://foto.haberler.com/haber/2024/04/11/imamoglu-na-memleketi-trabzon-da-davullu-zurnali-17229386_1931_amp.jpg,2024-04-11 17:16:00+03:00,haberler.com
CANLI maç izle! (OLYMPİAKOS-FENERBAHÇE) Canlı şifresiz donmadan HD maç izle! 11 Nisan günün maçları nereden izlenir?,"Canlı maç izle şifresiz! Futbolseverler 11 Nisan bu akşamki Şampiyonlar Ligi, UEFA Avrupa Ligi, Konferans Ligi gibi Avrupa kupaları mücadelelerini canlı yayın ile izlemenin yanı sıra Premier Lig, Bundesliga, La Liga gibi dünyanın en büyük liglerindeki maçların heyecanına ekran başında ortak olmak için canlı maç izle linki araştırıyor. Maçların yayınlanacağı Bein Sports canlı izle! S Sport canlı izle ve futbol severlerin maça doyacağı diğer full hd canlı maç izle!",https://www.haberler.com/haberler/canli-mac-izle-olympiakos-fenerbahce-canli-17229300-haberi/,https://foto.haberler.com/haber/2024/04/11/canli-mac-izle-olympiakos-fenerbahce-canli-17229300_5258_amp.jpg,2024-04-11 16:51:00+03:00,haberler.com
Basketbol FIBA Kadınlar Avrupa Ligi Dörtlü Finali Başlıyor,Mersin'de düzenlenecek olan Basketbol FIBA Kadınlar Avrupa Ligi Dörtlü Finali öncesinde takımların başantrenörleri ve kaptanları basın mensuplarıyla bir araya geldi. Yarı finalde Fenerbahçe Alagöz Holding ile ÇBK Mersin karşılaşacak.,https://www.haberler.com/spor/basketbol-fiba-kadinlar-avrupa-ligi-dortlu-finali-basliyor-17229303-haberi/,https://foto.haberler.com/haber/2024/04/11/basketbol-fiba-kadinlar-avrupa-ligi-nde-dortl-17229303_amp.jpg,2024-04-11 16:42:00+03:00,haberler.com
YSK Başkanı Ahmet Yener: 4 yerde seçim yenilenecek,"31 Mart'taki seçim sonuçlarına ilişkin değerlendirmelerde bulunan Yüksek Seçim Kurulu Başkanı Ahmet Yener, Kayseri'nin Pınarbaşı ilçesi, Şanlıurfa'nın Hilvan ilçesi, Edirne'de bir belde ve Sivas'taki bir seçim bölgesinde seçimlerin yeniden yapılacağını belirtti.",https://www.haberler.com/guncel/ysk-31-mart-secim-sonuclarina-yapilan-itirazlari-degerlendirdi-17228976-haberi/,https://foto.haberler.com/haber/2024/04/11/ysk-baskani-ahmet-yener-4-yerde-secim-yenilenecek-17228976_3606_amp.jpg,2024-04-11 16:35:00+03:00,haberler.com
Türk siyasetinin önemli aktörlerinden olan Akşener'in geçmişten bugüne uzanan yolculuğu,"Siyasi tarihimizden bir yıldız daha kaydı. Meral Akşener, 15 Mayıs 2016 tarihinde uğruna kendini polis barikatına zincirlediği siyasi mücadeleden ve 25 Ekim 2017 tarihinde kurduğu İYİ Parti'de 31 Mart 2024 Yerel Seçimlerinde aldığı yenilgiden sonra genel başkanlığa aday olmayacağını açıkladı.",https://www.haberler.com/politika/turk-siyasetinin-onemli-aktorlerinden-olan-17229273-haberi/,https://foto.haberler.com/haber/2024/04/11/turk-siyasetinin-onemli-aktorlerinden-olan-17229273_3352_amp.jpg,2024-04-11 16:35:00+03:00,haberler.com
Çeşme'deki Oteller Bayram Tatiliyle Dolup Taştı,"9 günlük Ramazan Bayramı tatili nedeniyle Çeşme'deki oteller yüzde 100 dolarken, dünyaca ünlü Ilıca Plajı'nda da yoğunluk yaşandı. Tatilcilerin turizm cenneti Çeşme'ye akın etmesiyle nüfus 1 milyona dayandı.",https://www.haberler.com/yerel/cesme-deki-oteller-bayram-tatiliyle-dolup-tasti-17229280-haberi/,https://foto.haberler.com/haber/2024/04/11/unlu-tatil-merkezi-cesme-de-nufus-1-milyona-17229280_amp.jpg,2024-04-11 16:28:00+03:00,haberler.com
Ceyda Düvenci'nin kızı şarkı söyledi! Bülent Şakrak ve Engin Akgün'ün birbirine yaptığı yorumlar alkış topladı,"Ceyda Düvenci'nin eski eşi Engin Akgün, Serebral Palsi hastası kızı Sıla'nın şarkısını söylediği anları yayınladı. Düvenci'nin eski eşi Bülent Şakrak ""Aşkım"" diyerek yorum yapınca Akgün de ""Çok içinden söylüyor be Bülent baba sayende"" yazdı. Şakrak da ""Estağfurullah Engin baba, ne yaptıysa kendi yaptı benim kuzum"" karşılığını verdi.",https://www.haberler.com/magazin/ceyda-duvenci-nin-kizi-sarki-soyledi-bulent-17229277-haberi/,https://foto.haberler.com/haber/2024/04/11/ceyda-duvenci-nin-kizi-sarki-soyledi-bulent-17229278_8832_amp.jpg,2024-04-11 16:28:00+03:00,haberler.com
Yılport Samsunspor'da Bayramlaşma Programı Düzenlendi,"Trendyol Süper Lig ekiplerinden Yılport Samsunspor'da, Ramazan Bayramı dolayısıyla bayramlaşma programı düzenlendi. Samsunsporlu futbolcular ve yöneticiler, taraftarlarla bir araya gelerek bayramlaştı.",https://www.haberler.com/spor/yilport-samsunspor-da-bayramlasma-programi-duzenlendi-17229267-haberi/,https://foto.haberler.com/haber/2024/04/11/samsunspor-da-bayramlasma-toreni-duzenlendi-17229267_amp.jpg,2024-04-11 16:22:00+03:00,haberler.com
Samsunspor Yönetimi ve Taraftarlar Bayramlaştı,"Samsunspor yönetim kurulu ve futbol takımı, taraftarlarla bayramlaşma töreni düzenledi. Futbolcuların Beşiktaş maçından iyi bir sonuç alması umuluyor.",https://www.haberler.com/spor/samsunspor-yonetimi-ve-taraftarlar-bayramlasti-17229197-haberi/,https://foto.haberler.com/haber/2024/04/11/samsunspor-da-camia-bayramlasti-17229197_amp.jpg,2024-04-11 15:57:00+03:00,haberler.com
"Beşiktaş, Samsunspor maçı hazırlıklarına devam ediyor","Beşiktaş, Trendyol Süper Lig'in 32. haftasında Samsunspor ile evinde oynayacağı maçın hazırlıklarına antrenmanla devam etti. Teknik Direktör Fernando Santos yönetiminde yapılan antrenmanda kondisyon ve taktik çalışmaları gerçekleştirildi. Antrenmanı Futbol Takımları Genel Koordinatörü Samet Aybaba da izledi.",https://www.haberler.com/spor/besiktas-samsunspor-maci-hazirliklarina-devam-ediyor-17229191-haberi/,https://foto.haberler.com/haber/2024/04/11/besiktas-antalyaspor-maci-hazirliklarini-surd-17229191_amp.jpg,2024-04-11 15:55:00+03:00,haberler.com
Taksim Meydanı ve İstiklal Caddesi Bayramın İkinci Gününde Turist Akınına Uğradı,"Ramazan Bayramı'nın ikinci gününde Taksim Meydanı ve İstiklal Caddesi'ne yerli ve yabancı turistler akın etti. İstanbul'un en çok ziyaret edilen yerlerinden olan Taksim Meydanı ve İstiklal Caddesi, bayramın ikinci gününde oldukça yoğundu. Vatandaşlar cadde boyunca gezdi, turistler ise hem havanın hem de bayramın keyfini çıkardı.",https://www.haberler.com/yerel/taksim-meydani-ve-istiklal-caddesi-bayramin-ikinci-gununde-turist-akinina-ugradi-17229167-haberi/,https://foto.haberler.com/haber/2024/04/11/taksim-de-bayram-yogunlugu-17229167_amp.jpg,2024-04-11 15:45:00+03:00,haberler.com
"Avrupa Merkez Bankası, politika faizini piyasa beklentileri doğrultusunda sabit tuttu","Piyasaların Avrupa'dan beklediği verinin sonucu geldi. Avrupa Merkez Bankası (ECB), 3 temel politika faizini piyasa beklentileri doğrultusunda sabit tuttuğunu açıkladı.",https://www.haberler.com/guncel/avrupa-merkez-bankasi-politika-faizini-piyasa-17229127-haberi/,https://foto.haberler.com/haber/2024/04/11/avrupa-merkez-bankasi-politika-faizini-piyasa-17229127_3014_amp.jpg,2024-04-11 15:45:00+03:00,haberler.com
"Emre Aşık'ın eski eşi Yağmur Sarnıç, canına kıyacağını söyledi: Artık dayanamıyorum","Eski eşi Emre Aşık ile uzun yıllardır davalık olan ve çocukları elinden alınan Yağmur Sarnıç, gözyaşları içinde yayınladığı videoda intihar edeceğini söyledi. Yaşadıklarına dayanacak gücünün kalmadığını söyleyen Sarnıç, ""Ben öldükten sonra çocuklarım Türk milletine emanet, o pisliğin eline bırakmayın"" dedi.",https://www.haberler.com/magazin/emre-asik-in-eski-esi-yagmur-sarnic-canina-17229112-haberi/,https://foto.haberler.com/haber/2024/04/11/emre-asik-in-eski-esi-yagmur-sarnic-canina-17229113_6883_amp.jpg,2024-04-11 15:45:00+03:00,haberler.com
"MHP'li Feti Yıldız'dan CHP lideri Özel'e ""Ölüm"" göndermeli mesaj","MHP Hukuk ve Seçim İşlerinden Sorumlu Genel Başkan Yardımcısı Feti Yıldız, CHP Genel Başkanı Özgür Özel'in MHP lideri Devlet Bahçeli'ye verdiği yanıt üzerine sert bir açıklama yaptı. Yıldız'ın paylaşımının sonuna ""İnsanlar vardır şafak vaktinde doğar, akşam ezanında ölürler"" notunu düşmesi dikkat çekti.",https://www.haberler.com/politika/mhp-li-feti-yildiz-dan-chp-lideri-ozel-e-olum-17229101-haberi/,https://foto.haberler.com/haber/2024/04/11/mhp-li-feti-yildiz-dan-chp-lideri-ozel-e-olum-17229102_2331_amp.jpg,2024-04-11 15:20:00+03:00,haberler.com
"Samet Aybaba, Beşiktaşlı futbolcularla yemekte buluştu","Beşiktaş Futbol Takımları Genel Koordinatörü Samet Aybaba, siyah-beyazlı futbolcularla BJK Nevzat Demir Tesisleri'nde yemekte bir araya geldi.",https://www.haberler.com/spor/samet-aybaba-besiktasli-futbolcularla-yemekte-bulustu-17229089-haberi/,https://foto.haberler.com/haber/2024/04/11/samet-aybaba-futbolcularla-yemekte-bir-araya-17229089_amp.jpg,2024-04-11 15:15:00+03:00,haberler.com
"Pamukkale, Ramazan Bayramı'nda 50 Bin Turisti Ağırladı","UNESCO Dünya Mirası Listesi'nde yer alan Denizli'deki Pamukkale, Ramazan Bayramı tatilinin 6 gününde 50 bin civarında turisti ağırladı. Türkiye'nin önemli turistik merkezleri arasında yer alan ve travertenleri, şifalı termal suyu, çevresindeki antik kentlerle dört mevsim turist çeken Pamukkale'de, bayram tatili yoğunluğu yaşanıyor.",https://www.haberler.com/guncel/pamukkale-ramazan-bayrami-nda-50-bin-turisti-agirladi-17229080-haberi/,https://foto.haberler.com/haber/2024/04/11/pamukkale-yi-bayram-tatilinin-6-gununde-yakla-17229080_amp.jpg,2024-04-11 15:08:00+03:00,haberler.com
ABD'de polis şiddeti bitmek bilmiyor! Siyahi sürücüye 41 saniyede 96 kurşun,"ABD''de 4 polis, emniyet kemeri takmadığı gerekçesiyle durdurdukları siyahi bir sürücüyü çıkan çatışma sonucu 41 saniyede 96 kurşun sıkarak öldürdü. Yaşanan o dehşet anlarının görüntüleri paylaşıldı.",https://www.haberler.com/3-sayfa/abd-de-polisler-tarafindan-oldurulen-siyahi-surucunun-goruntuleri-paylasildi-17228955-haberi/,https://foto.haberler.com/haber/2024/04/11/abd-de-polis-siddeti-bitmek-bilmiyor-siyahi-17228955_469_amp.jpg,2024-04-11 14:53:00+03:00,haberler.com
"Manisa Futbol Kulübü, Trendyol 1. Lig'in 30. haftasında Eyüpspor'u ağırlayacak","Manisa Futbol Kulübü, Trendyol 1. Lig'in 30. haftasında yarın Eyüpspor'u Manisa 19 Mayıs Stadyumu'nda konuk edecek. Siyah-beyazlılar, bu maçtan 3 puanla ayrılmayı hedefliyor.",https://www.haberler.com/spor/manisa-futbol-kulubu-trendyol-1-lig-in-30-haftasinda-eyupspor-u-agirlayacak-17228997-haberi/,https://foto.haberler.com/haber/2024/04/11/manisa-fk-eyupspor-u-konuk-edecek-17228997_amp.jpg,2024-04-11 14:32:00+03:00,haberler.com
Depremde evi yıkılan kadının 80 bin liralık altını yaşadığı konteynerden çalındı,"Kahramanmaraş'ta depremde evi yıkılan bir kadının yaklaşık 80 bin TL değerindeki altınları, yaşadığı konteyner kentte çalındı. Kadın, bir an önce hırsızların yakalanmasını istiyor.",https://www.haberler.com/yerel/depremde-evi-yikilan-kadinin-altinlari-calindi-17228794-haberi/,https://foto.haberler.com/haber/2024/04/11/depremde-evi-yikilan-kadinin-80-bin-liralik-17228794_9183_amp.jpg,2024-04-11 14:24:00+03:00,haberler.com
"Altınlı paylaşımlarından dolayı mercek altına alınan Nevra Bilem, eşinin aldığı bayram hediyesiyle gündemde","Altınlarla yaptığı paylaşımlardan sonra fenomenler hakkında başlatılan soruşturmada mercek altına alınan Nevra Bilem, eşinin kendisine bayram hediyesi olarak aldığı altınları paylaşınca tepki çekti.",https://www.haberler.com/magazin/altinli-paylasimlarindan-dolayi-mercek-altina-17228967-haberi/,https://foto.haberler.com/haber/2024/04/11/altinli-paylasimlarindan-dolayi-mercek-altina-17228968_8267_amp.jpg,2024-04-11 14:23:00+03:00,haberler.com
İstanbul'da Bayram Tatili ve Güneşli Hava İle Tarihi Yarımada Akını,"Ramazan Bayramı tatili ve güneşli havanın etkisiyle tarihi yarımada, yerli ve yabancı turistlerin yanı sıra İstanbulluların akınına uğradı. Bayramın ikinci gününü İstanbul'un tarihi ve turistik yerlerini gezip değerlendirmek isteyen vatandaşlar Sultanahmet Meydanı, Ayasofya-i Kebir Cami-i Şerifi ile Yerebatan Sarnıcı'nın bulunduğu alanda yoğunluk oluşturdu. İstanbul'un ünlü lezzetleri mısır, simit ve kestane satın alanlar, banklarda ve çimlerde oturarak güzel havanın tadını çıkardı. Bazı ziyaretçiler cep telefonlarıyla özçekim yaptı, bazıları ise Ayasofya'nın önünde fotoğraf çektirdi. Yabancı turistler, bireysel olarak veya kafilelerdeki rehberler eşliğinde tarihi mekanları dolaştı. Tarihi yarımadaya kent içinden ve il dışından gelen vatandaşlar müze ve camileri ziyaret etti.",https://www.haberler.com/guncel/istanbul-da-bayram-tatili-ve-gunesli-hava-ile-tarihi-yarimada-akini-17228962-haberi/,https://foto.haberler.com/haber/2024/04/11/istanbul-da-tarihi-yarimadadaki-turistik-17228962_amp.jpg,2024-04-11 14:16:00+03:00,haberler.com
Gabar petrolünde yeni rekor! Bugün itibariyle 40 bin varil üretime geçildi,"Türkiye, enerjide dışa bağımlılığı azaltma hedefi doğrultusunda Gabar petrolü gibi önemli bir enerji kaynağını araştırmaya devam ediyor. Enerji ve Tabii Kaynaklar Bakanı Alparslan Bayraktar, günlük üretimin 40 bin varili aştığını duyurarak yeni bir rekorun kırıldığını belirtti. Gabar petrolünde hedef ise 2024 yılı sonuna kadar günlük 100 bin varil üretim miktarına ulaşmak.",https://www.haberler.com/guncel/gabar-petrolunde-yeni-rekor-bugun-itibariyle-40-17228915-haberi/,https://foto.haberler.com/haber/2024/04/11/gabar-petrolunde-yeni-rekor-bugun-itibariyle-40-17228915_1625_amp.jpg,2024-04-11 14:09:00+03:00,haberler.com
Vietnamlı emlak patronu idam cezasına çarptırıldı,"Vietnamlı emlak patronu Truong My Lan, 12,5 milyar dolarlık rekor mali dolandırıcılık davası kapsamında idam cezasına çarptırıldı.",https://www.haberler.com/3-sayfa/vietnamli-emlak-patronu-12-5-milyar-dolarlik-dolandiricilik-davasinda-idam-cezasina-carptirildi-17228934-haberi/,https://foto.haberler.com/haber/2024/04/11/vietnamli-emlak-patronuna-dolandiricilik-sucu-17228934_amp.jpg,2024-04-11 14:03:00+03:00,haberler.com
Trabzonspor Basketbol Takımı Bayramlaştı,"Trabzonspor Kulübü Asbaşkanı Zeyyat Kafkas ve yönetim kurulu üyesi Ceyhun Eskici, Türkiye Erkekler Bölgesel Basketbol Ligi'nde mücadele eden takımı ziyaret etti. Kafkas ve Eskici, antrenman öncesinde basketbolcular ve teknik kadro ile bayramlaştı.",https://www.haberler.com/spor/trabzonspor-basketbol-takimi-bayramlasti-17228933-haberi/,https://foto.haberler.com/haber/2024/04/11/trabzonsporlu-yoneticiler-basketbol-takimini-17228933_amp.jpg,2024-04-11 14:02:00+03:00,haberler.com
"Oyuncu Ufuk Özkan, 17 yıllık eski eşiyle nafaka yüzünden karşı karşıya geldi","Oyuncu Ufuk Özkan ile 1,5 yıl önce boşandığı 17 yıllık eşi Nazan Özen arasında nafaka krizi yaşandı. 45 bin TL'lik tazminat düşürülmesi için dava açan Özkan'ın 6 aydır herhangi bir ödeme yapmadığını belirten Özen, ""Her türlü ödeme kolaylığı sağlamamıza rağmen geri adım atmadı. En azından oğlunun temel ihtiyaçlarını karşılasın"" dedi.",https://www.haberler.com/magazin/oyuncu-ufuk-ozkan-17-yillik-eski-esiyle-nafaka-17228904-haberi/,https://foto.haberler.com/haber/2024/04/11/oyuncu-ufuk-ozkan-17-yillik-eski-esiyle-nafaka-17228905_9765_amp.jpg,2024-04-11 13:55:00+03:00,haberler.com
Başak Demirtaş'la ilgili çirkin paylaşıma tepki yağıyor,"Edirne Cezaevi'nde tutuklu bulunan eski HDP Eş Başkanı Selahattin Demirtaş'ın eşi Başak Demirtaş'la ilgili sosyal medyada yapılan çirkin paylaşım büyük tepki çekti. Konuyla ilgili bir açıklama yapan Demirtaş'ın avukatı ""Hepsinin gereği yapılıyor, yapılacak"" ifadelerine yer verdi.",https://www.haberler.com/politika/basak-demirtas-la-ilgili-cirkin-paylasima-tepki-17228907-haberi/,https://foto.haberler.com/haber/2024/04/11/basak-demirtas-la-ilgili-cirkin-paylasima-tepki-17228908_5479_amp.jpg,2024-04-11 13:51:00+03:00,haberler.com
Hırsızlık yapan kadın yakalanınca polisin elini ısırdı,"Adana'da mezarlıkta otomobilin camını kırıp hırsızlık yapmak isterken suçüstü yakalanan kadın, kendisini yakalayan polisin elini ısırdı. O anlar saniye saniye kameralara yansıdı.",https://www.haberler.com/3-sayfa/adana-da-mezarlikta-hirsizlik-yapmak-isterken-sucustu-yakalanan-kadin-polise-saldirdi-17228732-haberi/,https://foto.haberler.com/haber/2024/04/11/hirsizlik-yaparken-sucustu-yakalanan-kadin-po-17228732_amp.jpg,2024-04-11 13:14:00+03:00,haberler.com
Bayram tatili için Edirne'den Avrupa'ya geçişler arttı,Bayram tatilini yurt dışında geçirmek isteyen vatandaşların Edirne'den Avrupa'ya açılan sınır kapılarından geçişleri sürüyor. Kapıkule ve Hamzabeyli ile Pazarkule ve İpsala sınır kapılarından 130 binin üzerinde yolcu ve 30 binden fazla araç çıkışı gerçekleşti.,https://www.haberler.com/guncel/bayram-tatili-icin-edirne-den-avrupa-ya-gecisler-artti-17228785-haberi/,https://foto.haberler.com/haber/2024/04/11/edirne-deki-sinir-kapilarinda-bayram-nedeniyl-17228785_amp.jpg,2024-04-11 12:56:00+03:00,haberler.com
"Defne Belediye Başkanı makam araçlarını satışa çıkardı, lüks otomobili iade etti","Hatay'ın Defne ilçesinde seçimlerden zaferle çıkan Belediye Başkanı Halil İbrahim Özgün, israfı önlemek amacıyla belediyede kullanılan makam araçlarını satışa çıkardı ve kendinden önceki başkanın kiralık lüks aracını iade etti.",https://www.haberler.com/yerel/defne-belediye-baskani-makam-araclarini-satiyor-17228527-haberi/,https://foto.haberler.com/haber/2024/04/11/defne-belediye-baskani-makam-araclarini-satisa-17228527_8274_amp.jpg,2024-04-11 12:15:00+03:00,haberler.com
"Camiden ters kelepçe ile çıkartılan Örümcek Adam'ın ilk sözleri: Ayağım alçıya alındı, yürüyemiyorum","Hatay'ın İskenderun ilçesinde bayram namazı kılmak için cemaat arasına 'Örümcek Adam' kostümüyle giren ve polis ekipleri tarafından camiden çıkartılan Ayaz Koç, yaşadıklarını anlattı. Koç, ""Beni yere yatırdılar, ters kelepçe yapıldı, ayağıma basıldı. Tartaklandım, ayağım alçıya alındı, yürüyemiyorum"" dedi.",https://www.haberler.com/3-sayfa/camiden-ters-kelepce-ile-cikartilan-orumcek-adam-17228705-haberi/,https://foto.haberler.com/haber/2024/04/11/camiden-ters-kelepce-ile-cikartilan-orumcek-adam-17228705_6805_amp.jpg,2024-04-11 12:13:00+03:00,haberler.com
"Amasya Valisi Yılmaz Doruk, sağlık ve güvenlik çalışanlarını ziyaret etti","Amasya Valisi Yılmaz Doruk ve beraberindeki heyet, Ramazan Bayramı'nda görevi başında bulunan sağlık ve güvenlik çalışanlarını ziyaret ederek bayramlarını kutladı. Vali Doruk, Belediye Başkanı Turgay Sevindi ve protokol üyeleri, sağlık çalışanlarını, emniyet ve jandarma personelini ziyaret etti. Doruk ve Sevindi ile beraberindekiler, mesailerine devam eden çalışanların bayramını kutladı. Amasya Emniyet Müdürlüğü ziyaretinin ardından gazetecilere açıklamalarda bulunan Vali Doruk, hüzünlü bir bayram yaşandığını, İsrail'in Gazze'de Filistinli Müslümanlara saldırıda bulunduğunu söyledi. Bayramın tüm insanlığa barış, huzur ve mutluluk getirmesini dileyen Doruk, 'Bayram boyunca yüce dinimizin de bizlere emrettiği gibi yetimlerin, öksüzlerin, kimsesizlerin ve ihtiyaç sahiplerinin her zaman yanında olmaya gayret göstermeliyiz. Birlik ve beraberliğimizin zirveye ulaştığı bu özel günlerde büyüklerimizi ziyaret ederek hayır dualarını almalı, küçüklerimize sevgi ve şefkatle yaklaşarak onların bayram sevincine ortak olmalıyız.' ifadelerini kullandı.",https://www.haberler.com/guncel/amasya-valisi-yilmaz-doruk-saglik-ve-guvenlik-calisanlarini-ziyaret-etti-17228701-haberi/,https://foto.haberler.com/haber/2024/04/11/amasya-valisi-yilmaz-doruk-saglik-ve-guvenlik-17228701_amp.jpg,2024-04-11 12:10:00+03:00,haberler.com
